id,time,accessdate,title,description,link
"tag:google.com,2013:googlealerts/feed:18073045915564750887",2024-06-10T21:12:56Z,2024-06-10T21:12:56Z,"EU elections fallout: a shock <b>snap</b> vote, resignations and the far right – video report",Emmanuel Macron announced a <b>snap</b> election after Marine Le Pen&#39;s far-right party took record votes in the European elections.,https://www.google.com/url?rct=j&sa=t&url=https://www.theguardian.com/world/video/2024/jun/10/snap-election-resignations-far-right-fallout-eu-elections-video-report&ct=ga&cd=CAIyHDFlZTI2MTBhMjBkODFiZWQ6Y29tOmVuOlVTOlI&usg=AOvVaw2JSAofVS30DJK2w9MlsAHf
"tag:google.com,2013:googlealerts/feed:1938789899045557306",2024-06-10T21:12:19Z,2024-06-10T21:12:19Z,<b>USDA</b> Cattle and Carcass Training Centers to Host Events for Cattle Industry | Drovers,<b>USDA</b> offers educational events for cattle producers and feeders who want a better understanding of factors contributing to the market value of&nbsp;...,https://www.google.com/url?rct=j&sa=t&url=https://www.drovers.com/news/industry/usda-cattle-and-carcass-training-centers-host-events-cattle-industry&ct=ga&cd=CAIyHDFlZTI2MTBhMjBkODFiZWQ6Y29tOmVuOlVTOlI&usg=AOvVaw3bg1NwwaPg8G9pzbBR8Ykz
"tag:google.com,2013:googlealerts/feed:17123570036349823088",2024-06-10T21:05:25Z,2024-06-10T21:05:25Z,VOA60 World - France gears up for campaigning after President Macron calls <b>snap</b> election,"France: The country geared up for campaigning on Monday, after President Emmanuel Macron called a <b>snap</b> parliamentary election following a bruising&nbsp;...",https://www.google.com/url?rct=j&sa=t&url=https://www.voanews.com/a/voa60-world---france-gears-up-for-campaigning-after-president-macron-calls-snap-election/7650212.html&ct=ga&cd=CAIyHDFlZTI2MTBhMjBkODFiZWQ6Y29tOmVuOlVTOlI&usg=AOvVaw3v99nHsFULZNF1CjpaTy1X
"tag:google.com,2013:googlealerts/feed:15715069766779043347",2024-06-10T21:04:58Z,2024-06-10T21:04:58Z,Highly Pathogenic Avian Influenza crisis spurs request for <b>USDA</b> action,The Iowa Department of Agriculture and Land Stewardship is seeking help from the <b>USDA</b> to aid dairy and poultry farmers affected by HPAI.,https://www.google.com/url?rct=j&sa=t&url=https://corridorbusiness.com/highly-pathogenic-avian-influenza-crisis-spurs-usda-action/&ct=ga&cd=CAIyHDFlZTI2MTBhMjBkODFiZWQ6Y29tOmVuOlVTOlI&usg=AOvVaw3aECa9HH2q44py2q4UmH9X
"tag:google.com,2013:googlealerts/feed:6047688634494293128",2024-06-10T21:00:49Z,2024-06-10T21:00:49Z,<b>USDA</b> breaks ground for new dairy forage research facility - Brownfield Ag News,"Dennis Hancock is the director of the <b>USDA</b> Dairy Forage Research Center near Sauk City, Wisconsin. He tells Brownfield the new facility has been&nbsp;...",https://www.google.com/url?rct=j&sa=t&url=https://www.brownfieldagnews.com/news/usda-breaks-ground-for-new-dairy-forage-research-facility/&ct=ga&cd=CAIyHDFlZTI2MTBhMjBkODFiZWQ6Y29tOmVuOlVTOlI&usg=AOvVaw3FJVR09AW378Q22nFlIMjU
"tag:google.com,2013:googlealerts/feed:3404544542802406380",2024-06-10T20:53:03Z,2024-06-10T20:53:03Z,French President Emmanuel Macron calls for <b>snap</b> elections - KVCR News,France&#39;s president calls <b>snap</b> elections after the far-right made some big gains in European Union polls.,https://www.google.com/url?rct=j&sa=t&url=https://www.kvcrnews.org/2024-06-10/french-president-emmanuel-macron-calls-for-snap-elections&ct=ga&cd=CAIyHDFlZTI2MTBhMjBkODFiZWQ6Y29tOmVuOlVTOlI&usg=AOvVaw3vEKk7bsFsGF-PZYWzzsRE
"tag:google.com,2013:googlealerts/feed:9813376752320959873",2024-06-10T20:43:56Z,2024-06-10T20:43:56Z,Applications Now Open for FreshConnect CSA for <b>SNAP</b> Grant Program,The program allows <b>SNAP</b> participants to access the popular Community Supported Agriculture (CSA) model by providing farm organizations a way to&nbsp;...,https://www.google.com/url?rct=j&sa=t&url=https://agriculture.ny.gov/news/applications-now-open-freshconnect-csa-snap-grant-program&ct=ga&cd=CAIyHDFlZTI2MTBhMjBkODFiZWQ6Y29tOmVuOlVTOlI&usg=AOvVaw1TuptI0j2R5ioQk7zhDHi7
"tag:google.com,2013:googlealerts/feed:666024748282088935",2024-06-10T20:38:47Z,2024-06-10T20:38:47Z,"Texas Medicaid, <b>SNAP</b> delays could cost state millions in federal funding | KXAN Austin","HHSC “continues to be riddled with backlogs, delays, errors, and failing leadership. Families are being denied <b>SNAP</b> food assistance and more than two&nbsp;...",https://www.google.com/url?rct=j&sa=t&url=https://www.kxan.com/news/texas/texas-medicaid-snap-delays-could-cost-state-millions-in-federal-funding/&ct=ga&cd=CAIyHDFlZTI2MTBhMjBkODFiZWQ6Y29tOmVuOlVTOlI&usg=AOvVaw0JTZv8FmZJSwd7vsFPy1JS
"tag:google.com,2013:googlealerts/feed:6318645925433110967",2024-06-10T20:34:39Z,2024-06-10T20:34:39Z,What should I do if I&#39;m a victim of stolen <b>SNAP benefits</b>? - CBS News,"PHILADELPHIA (CBS) -- After a man from Chester told CBS News Philadelphia his <b>SNAP benefits</b>, sometimes referred to as <b>food stamps</b>, had been stolen&nbsp;...",https://www.google.com/url?rct=j&sa=t&url=https://www.cbsnews.com/philadelphia/news/stolen-snap-benefits-ebt-card-philadelphia-delaware-new-jersey-pensylvania/&ct=ga&cd=CAIyHDFlZTI2MTBhMjBkODFiZWQ6Y29tOmVuOlVTOlI&usg=AOvVaw31HfZjzxqo1hDxPdTtDuUX
"tag:google.com,2013:googlealerts/feed:5262307903297949433",2024-06-10T20:21:57Z,2024-06-10T20:21:57Z,Macron responds to election defeat with <b>snap</b> election | Radio Schuman | Euronews,Macron responds to election defeat with <b>snap</b> election | Radio Schuman. Euronews - Copyright Euronews. Copyright Euronews. By Maïa de La&nbsp;...,https://www.google.com/url?rct=j&sa=t&url=https://www.euronews.com/my-europe/2024/06/10/macron-responds-to-election-defeat-with-snap-election-radio-schuman&ct=ga&cd=CAIyHDFlZTI2MTBhMjBkODFiZWQ6Y29tOmVuOlVTOlI&usg=AOvVaw2cnmlTQKl8rixmyvOVerBx
"tag:google.com,2013:googlealerts/feed:10762687411962291140",2024-06-10T20:19:02Z,2024-06-10T20:19:02Z,French President Emmanuel Macron calls for <b>snap</b> elections | WJCT News 89.9,France&#39;s president calls <b>snap</b> elections after the far-right made some big gains in European Union polls.,https://www.google.com/url?rct=j&sa=t&url=https://news.wjct.org/2024-06-10/french-president-emmanuel-macron-calls-for-snap-elections&ct=ga&cd=CAIyHDFlZTI2MTBhMjBkODFiZWQ6Y29tOmVuOlVTOlI&usg=AOvVaw2tbTct_SXIR9A54KBZFDxj
