id,time,accessdate,title,description,link
"tag:google.com,2013:googlealerts/feed:17575472819238481116",2024-06-20T03:54:23Z,2024-06-20T03:54:23Z,"SeaWolves <b>snap</b> losing streak, sit two games back of first after 11-2 win at Somerset - YourErie.com","SeaWolves <b>snap</b> losing streak, sit two games back of first after 11-2 win at Somerset ... Copyright 2024 Nexstar Media Inc. All rights reserved. This&nbsp;...",https://www.google.com/url?rct=j&sa=t&url=https://www.yourerie.com/sports/erie-seawolves/seawolves-snap-losing-streak-sit-two-games-back-of-first-after-11-2-win-at-somerset/&ct=ga&cd=CAIyHDFlZTI2MTBhMjBkODFiZWQ6Y29tOmVuOlVTOlI&usg=AOvVaw2Cb_Sz1slrnYmrPo6FehaQ
"tag:google.com,2013:googlealerts/feed:11683564749105143101",2024-06-20T03:34:58Z,2024-06-20T03:34:58Z,Iowa skill players say pre-<b>snap</b> motion could make big difference for the Hawkeye offense,Iowa skill players say pre-<b>snap</b> motion could make big difference for the Hawkeye offense. 1 view · 5 minutes ago ...more&nbsp;...,https://www.google.com/url?rct=j&sa=t&url=https://www.youtube.com/watch%3Fv%3DOwN4AIIouek&ct=ga&cd=CAIyHDFlZTI2MTBhMjBkODFiZWQ6Y29tOmVuOlVTOlI&usg=AOvVaw31xHF31TEuWlrfjKYasx-O
"tag:google.com,2013:googlealerts/feed:10767635312382254178",2024-06-20T03:05:58Z,2024-06-20T03:05:58Z,Moonshine Spirit Men&#39;s Backcountry Striped Long Sleeve <b>Snap</b> Western Shirt | Pacific City,"100% cotton. Spread collar. Long sleeves. <b>Snap</b> placket, pockets, and cuffs. Two single-point chest pockets with <b>snap</b> closures.",https://www.google.com/url?rct=j&sa=t&url=https://www.gopacificcity.com/shopnow/product/moonshine-spirit-mens-backcountry-striped-long-sleeve-snap-western-shirt-bootbarn-1e3d42%3Fmodel%3D0%26variant%3D0&ct=ga&cd=CAIyHDFlZTI2MTBhMjBkODFiZWQ6Y29tOmVuOlVTOlI&usg=AOvVaw3S1FCgCG8LegujG4kun7mU
"tag:google.com,2013:googlealerts/feed:16827376421853973878",2024-06-20T02:26:03Z,2024-06-20T02:26:03Z,2 - <b>USDA</b> pegs US corn acres at 92.888 mln - Reuters,"<b>Snap</b> launches AI tools for advanced augmented reality June 18, 2024 ... <b>USDA</b> estimated quarterly corn ending stocks as of June 1 at 3.534 billion&nbsp;...",https://www.google.com/url?rct=j&sa=t&url=https://www.reuters.com/article/markets/oil/2-usda-pegs-us-corn-acres-at-92888-mln-idUSN29386381/&ct=ga&cd=CAIyHDFlZTI2MTBhMjBkODFiZWQ6Y29tOmVuOlVTOlI&usg=AOvVaw3du9IIVdBjBHx9qtw4vR6s
"tag:google.com,2013:googlealerts/feed:12156322977404518388",2024-06-20T01:57:03Z,2024-06-20T01:57:03Z,<b>Snap</b>! (Hardcover) - Skylark Bookshop,<b>Snap</b>! (Hardcover) ; By Anna Walker ; About the Author. Anna Walker is an award-winning illustrator and author of many picture books for children&nbsp;...,https://www.google.com/url?rct=j&sa=t&url=https://shop.skylarkbookshop.com/book/9781957363240&ct=ga&cd=CAIyHDFlZTI2MTBhMjBkODFiZWQ6Y29tOmVuOlVTOlI&usg=AOvVaw18zMe4OeNFh-rdQySlIc9Z
"tag:google.com,2013:googlealerts/feed:4453668441370870626",2024-06-20T01:54:20Z,2024-06-20T01:54:20Z,"IRIS USA 41 Quart Utility Storage Tote w/ Secure <b>Snap</b> Tight Lid, Clear (6 Pack), 1 Piece",These storage containers feature an ultra-clear body to see what you need at a glance and <b>snap</b>-tight lids to ensure that your valuables will be&nbsp;...,https://www.google.com/url?rct=j&sa=t&url=https://www.kingsoopers.com/p/iris-usa-41-quart-utility-storage-tote-w-secure-snap-tight-lid-clear-6-pack-/0076201647231&ct=ga&cd=CAIyHDFlZTI2MTBhMjBkODFiZWQ6Y29tOmVuOlVTOlI&usg=AOvVaw3VjcX2kYS-fcnAGHoVbCzj
"tag:google.com,2013:googlealerts/feed:8474388898831533476",2024-06-20T01:51:45Z,2024-06-20T01:51:45Z,"Simply Potatoes Hash Browns, Southwest Style, 20 Oz (1 Lb 4 Oz) 567 G - Hilltop Supermarket",$339 each. <b>SNAP</b> Eligible. Quantity. -.,https://www.google.com/url?rct=j&sa=t&url=https://shop.hilltopsupermarket.com/online/hilltopsupermarket/tags/snapeligible/produce%3Fpid%3D8d3346d9-e9e7-4d71-a0ea-ac240119a41f%26productName%3Dtaco-bell-salsa&ct=ga&cd=CAIyHDFlZTI2MTBhMjBkODFiZWQ6Y29tOmVuOlVTOlI&usg=AOvVaw1Z3wW7KOROq2oUOfZ4eQ-Q
"tag:google.com,2013:googlealerts/feed:7776418002016920660",2024-06-20T17:07:23Z,2024-06-20T17:07:23Z,<b>USDA</b> reminds producers to file crop acreage reports - Havre Weekly Chronicle,Press release BOZEMAN — Agricultural producers in Montana should make an appointment with their local Farm Service Agency office to complete crop.,https://www.google.com/url?rct=j&sa=t&url=https://www.havredailynews.com/story/2024/06/20/local/usda-reminds-producers-to-file-crop-acreage-reports/545960.html&ct=ga&cd=CAIyHDFlZTI2MTBhMjBkODFiZWQ6Y29tOmVuOlVTOlI&usg=AOvVaw0KyOj9EGPNS2G2fCJxJpif
"tag:google.com,2013:googlealerts/feed:6410660158444499070",2024-06-20T16:53:01Z,2024-06-20T16:53:01Z,Civil Rights Department Obtains $15 Million Settlement Agreement with Snapchat Over ...,"The settlement announced today resolves a more than three-year investigation into <b>Snap</b> Inc. over claims of employment discrimination, equal pay&nbsp;...",https://www.google.com/url?rct=j&sa=t&url=https://calcivilrights.ca.gov/2024/06/19/civil-rights-department-obtains-15-million-settlement-agreement-with-snapchat-over-alleged-sex-based-employment-discrimination/&ct=ga&cd=CAIyHDFlZTI2MTBhMjBkODFiZWQ6Y29tOmVuOlVTOlI&usg=AOvVaw0KwBV6beLnXcwwW_sqp7FT
"tag:google.com,2013:googlealerts/feed:1302925481068116982",2024-06-20T16:40:10Z,2024-06-20T16:40:10Z,COMMUNITY <b>SNAP</b> SHOTS - Double Mountain Chronicle,"COMMUNITY <b>SNAP</b> SHOTS. ... COMMUNITY <b>SNAP</b> SHOTS. By News Staff on Thursday, June 20, 2024. Subhead. Fisher County Red Dirt Mudbog in Rotan.",https://www.google.com/url?rct=j&sa=t&url=https://www.doublemountainchronicle.com/news/community-snap-shots&ct=ga&cd=CAIyHDFlZTI2MTBhMjBkODFiZWQ6Y29tOmVuOlVTOlI&usg=AOvVaw1nhd783GUyaIY8tpIYtbmb
"tag:google.com,2013:googlealerts/feed:14040424100546395510",2024-06-20T16:24:07Z,2024-06-20T16:24:07Z,"Accenture, KB Home rise; <b>Snap</b>, Jabil fall, Thursday, 6/20/2024 - WRAL.com","Accenture Plc. (ACN), up $19.88 to $305.23. The consulting company raised part of its revenue forecast for the year. <b>Snap</b> Inc&nbsp;...",https://www.google.com/url?rct=j&sa=t&url=https://www.wral.com/story/accenture-kb-home-rise-snap-jabil-fall-thursday-6-20-2024/21491604/&ct=ga&cd=CAIyHDFlZTI2MTBhMjBkODFiZWQ6Y29tOmVuOlVTOlI&usg=AOvVaw2OJo7xYXPwSJ1SKFIkzqin
"tag:google.com,2013:googlealerts/feed:15256790327363613834",2024-06-20T16:21:59Z,2024-06-20T16:21:59Z,"Accenture, KB Home rise; <b>Snap</b>, Jabil fall, Thursday, 6/20/2024 - CTPost","The consulting company raised part of its revenue forecast for the year. Advertisement. Article continues below this ad. <b>Snap</b> Inc. (<b>SNAP</b>), down 38&nbsp;...",https://www.google.com/url?rct=j&sa=t&url=https://www.ctpost.com/business/article/accenture-kb-home-rise-snap-jabil-fall-19523660.php&ct=ga&cd=CAIyHDFlZTI2MTBhMjBkODFiZWQ6Y29tOmVuOlVTOlI&usg=AOvVaw2DzF4FIF2AgmTuXwAahwAR
"tag:google.com,2013:googlealerts/feed:127047849819214051",2024-06-20T16:21:54Z,2024-06-20T16:21:54Z,Sounds <b>Snap</b> Losing Streak in Debut as Elite Giants - Maury County Source,"Sounds <b>Snap</b> Losing Streak in Debut as Elite Giants &middot; Garrett Mitchell made a strong rehab appearance, going 1-for-3 with a single and a stolen base.",https://www.google.com/url?rct=j&sa=t&url=https://maurycountysource.com/sounds-snap-losing-streak-in-debut-as-elite-giants/&ct=ga&cd=CAIyHDFlZTI2MTBhMjBkODFiZWQ6Y29tOmVuOlVTOlI&usg=AOvVaw1ivqT_--wVqGElcXvaZRbO
"tag:google.com,2013:googlealerts/feed:5030005380664286576",2024-06-20T16:17:50Z,2024-06-20T16:17:50Z,R-CALF | Ranch Group Applauds Action to Overturn <b>USDA&#39;s</b> Electronic Eartag Mandate,Res. 167) and the Senate that when passed will overturn the Department of Agriculture (<b>USDA</b>) Animal and Plant Health Inspection Service&#39;s (APHIS)&nbsp;...,https://www.google.com/url?rct=j&sa=t&url=https://www.tsln.com/news/r-calf-ranch-group-applauds-action-to-overturn-usdas-electronic-eartag-mandate/&ct=ga&cd=CAIyHDFlZTI2MTBhMjBkODFiZWQ6Y29tOmVuOlVTOlI&usg=AOvVaw3dXl4xVVz1FzMAxamFt7uR
"tag:google.com,2013:googlealerts/feed:6527445092736348601",2024-06-20T16:05:14Z,2024-06-20T16:05:14Z,<b>Snap</b> agrees to pay $15 million to settle gender discrimination lawsuit - The Verge,Snapchat parent company <b>Snap</b> Inc. has agreed to pay $15 million to settle a gender discrimination lawsuit from the California Civil Rights&nbsp;...,https://www.google.com/url?rct=j&sa=t&url=https://www.theverge.com/2024/6/20/24182303/snap-gender-discrimination-settlement-california&ct=ga&cd=CAIyHDFlZTI2MTBhMjBkODFiZWQ6Y29tOmVuOlVTOlI&usg=AOvVaw2BArGJgVoELcCRN6V6ofEH
"tag:google.com,2013:googlealerts/feed:2653125316723346100",2024-06-20T15:32:55Z,2024-06-20T15:32:55Z,Spending caps endanger <b>USDA</b> programs | TheFencePost.com,"Senate Appropriations Committee Chairwoman Patty Murray, D-Wash., said this week that the spending caps imposed by the Fiscal Responsibility Act&nbsp;...",https://www.google.com/url?rct=j&sa=t&url=https://www.thefencepost.com/news/spending-caps-endanger-usda-programs/&ct=ga&cd=CAIyHDFlZTI2MTBhMjBkODFiZWQ6Y29tOmVuOlVTOlI&usg=AOvVaw12hMSXKbmS4hUYWs0Bm3G7
"tag:google.com,2013:googlealerts/feed:16114813343495654312",2024-06-20T15:26:50Z,2024-06-20T15:26:50Z,Best Makkari Decks - Marvel <b>Snap</b> - Shacknews,"It&#39;s Week 3 of Marvel <b>Snap&#39;s</b> June 2024 season, The Celestials&#39; Finest. This week, Eternals speedster Makkari runs in as part of this week&#39;s&nbsp;...",https://www.google.com/url?rct=j&sa=t&url=https://www.shacknews.com/article/140310/best-makkari-decks-marvel-snap&ct=ga&cd=CAIyHDFlZTI2MTBhMjBkODFiZWQ6Y29tOmVuOlVTOlI&usg=AOvVaw1uQkghjNBJtmtL6cdITAq4
"tag:google.com,2013:googlealerts/feed:7125190454184294978",2024-06-20T15:16:23Z,2024-06-20T15:16:23Z,France&#39;s National Rally Seen Leading Popular Vote in <b>Snap</b> Elections - IFOP - USNews.com,"France&#39;s National Rally Seen Leading Popular Vote in <b>Snap</b> Elections - IFOP. By Reuters. |. June 20, 2024. |. By Reuters. |. June 20, 2024, at 11:04&nbsp;...",https://www.google.com/url?rct=j&sa=t&url=https://www.usnews.com/news/world/articles/2024-06-20/frances-national-rally-seen-leading-popular-vote-in-snap-elections-ifop&ct=ga&cd=CAIyHDFlZTI2MTBhMjBkODFiZWQ6Y29tOmVuOlVTOlI&usg=AOvVaw1vN0WcD22Xv8xOkpwEXix4
"tag:google.com,2013:googlealerts/feed:744945492959796424",2024-06-20T15:07:57Z,2024-06-20T15:07:57Z,More Kids Will Have a Chance to Eat School Breakfast and Lunch at No Cost,"<b>USDA&#39;s</b> Food and Nutrition Service recently announced ... <b>Supplemental Nutrition Assistance Program</b>, also known as <b>SNAP</b>, Medicaid, and others.",https://www.google.com/url?rct=j&sa=t&url=https://www.fns.usda.gov/subscriber-updates/cn/direct-certification-grant&ct=ga&cd=CAIyHDFlZTI2MTBhMjBkODFiZWQ6Y29tOmVuOlVTOlI&usg=AOvVaw3mGx9Zd_Rip55RxpBLrdK4
"tag:google.com,2013:googlealerts/feed:14141358164280716816",2024-06-20T15:04:05Z,2024-06-20T15:04:05Z,<b>USDA</b> supspends avocado inspections amid safety concerns - WCMY,The <b>USDA</b> has suspended inspections of avocados and mangos from a Mexican state after the assault of two employees. According to the U.S. Embassy&nbsp;...,https://www.google.com/url?rct=j&sa=t&url=https://1430wcmy.com/2024/06/20/usda-supspends-avocado-inspections-amid-safety-concerns/&ct=ga&cd=CAIyHDFlZTI2MTBhMjBkODFiZWQ6Y29tOmVuOlVTOlI&usg=AOvVaw3kQ2EzvNOLm0cF_jgB4Orz
"tag:google.com,2013:googlealerts/feed:17975191852878491615",2024-06-20T14:40:25Z,2024-06-20T14:40:25Z,Tomahawk Pharmacy receives <b>USDA</b> grant to install solar electric array,For the Tomahawk Leader. TOMAHAWK – A Tomahawk business will receive federal grant funding to help improve its energy efficiency.,https://www.google.com/url?rct=j&sa=t&url=https://tomahawkleader.com/2024/06/20/tomahawk-pharmacy-receives-usda-grant-to-install-solar-electric-array/&ct=ga&cd=CAIyHDFlZTI2MTBhMjBkODFiZWQ6Y29tOmVuOlVTOlI&usg=AOvVaw09TV5PTLbdQo8c4K9bGm1C
"tag:google.com,2013:googlealerts/feed:5855429331562069564",2024-06-20T14:32:51Z,2024-06-20T14:32:51Z,Louisiana participates in <b>USDA</b>-funded summer grocery program for students of low-income families,"SUN Bucks work just like the <b>Supplemental Nutrition Assistance Program</b> (<b>SNAP</b>), with benefits loaded onto an EBT card in which parents and students&nbsp;...",https://www.google.com/url?rct=j&sa=t&url=https://neworleanscitybusiness.com/blog/2024/06/20/louisiana-participates-in-usda-funded-summer-grocery-program-for-students-of-low-income-families/&ct=ga&cd=CAIyHDFlZTI2MTBhMjBkODFiZWQ6Y29tOmVuOlVTOlI&usg=AOvVaw1KjUYWmhO-S9WtGsEAd1qE
"tag:google.com,2013:googlealerts/feed:7896921173778474030",2024-06-20T14:27:11Z,2024-06-20T14:27:11Z,<b>SNAP</b> Divide: The fight is not going away any time soon - RFD-TV,"At a recent House Ag Appropriations hearing, Chair Andy Harris once again called for states to run <b>SNAP</b>-healthy food pilots. ... <b>SNAP</b> program, so this&nbsp;...",https://www.google.com/url?rct=j&sa=t&url=https://www.rfdtv.com/snap-divide-the-fight-is-not-going-away-any-time-soon&ct=ga&cd=CAIyHDFlZTI2MTBhMjBkODFiZWQ6Y29tOmVuOlVTOlI&usg=AOvVaw1DSO9BJlK1_bkvfIoCQzcJ
"tag:google.com,2013:googlealerts/feed:10186447106318637891",2024-06-20T14:07:33Z,2024-06-20T14:07:33Z,The Crabs Go Crawling | @FinnyTheShark Counting Song - YouTube,sand. <b>Snap snap snap</b>! PARENTS AND TEACHERS: Thank you so much for watching Super Simple Songs with your families and/or students. Here are&nbsp;...,https://www.google.com/url?rct=j&sa=t&url=https://www.youtube.com/watch%3Fv%3DHR5Gckafp_o&ct=ga&cd=CAIyHDFlZTI2MTBhMjBkODFiZWQ6Y29tOmVuOlVTOlI&usg=AOvVaw0WPrdt7S5ZQPg-8EIuteEj
"tag:google.com,2013:googlealerts/feed:16606605072553622741",2024-06-20T14:04:15Z,2024-06-20T14:04:15Z,"Poudre Valley REA Secures $9 Million from <b>USDA</b> for Clean, Affordable Energy - North Forty News",U.S. Department of Agriculture (<b>USDA</b>) Secretary Tom Vilsack announced a $9 million investment in local clean energy projects.,https://www.google.com/url?rct=j&sa=t&url=https://northfortynews.com/category/news/building-a-brighter-future-poudre-valley-rea-secures-9-million-from-usda-for-clean-affordable-energy/&ct=ga&cd=CAIyHDFlZTI2MTBhMjBkODFiZWQ6Y29tOmVuOlVTOlI&usg=AOvVaw08awMEXnuus-BM-QCCVBVb
"tag:google.com,2013:googlealerts/feed:12790023293612624563",2024-06-20T13:59:46Z,2024-06-20T13:59:46Z,Morris business gets large grant from <b>USDA</b> | Local News | voiceofalexandria.com,"(Washington, DC)--A half dozen Minnesota businesses are getting some financial help from the <b>USDA</b>. The agency awarded $50-million in Farm Labor&nbsp;...",https://www.google.com/url?rct=j&sa=t&url=https://www.voiceofalexandria.com/news/local/morris-business-gets-large-grant-from-usda/article_8caffc96-2f0b-11ef-b2d7-83a4e71fddcf.html&ct=ga&cd=CAIyHDFlZTI2MTBhMjBkODFiZWQ6Y29tOmVuOlVTOlI&usg=AOvVaw0ohJDBMLUWLghqiD0cuTGg
"tag:google.com,2013:googlealerts/feed:4496317532979348274",2024-06-20T13:46:29Z,2024-06-20T13:46:29Z,<b>USDA</b> Releases Updated Climate Adaptation and Resilience Plan,"WASHINGTON, June 20, 2024 – Today, the U.S. Department of Agriculture (<b>USDA</b>) joined more than 20 federal agencies to release its updated Climate&nbsp;...",https://www.google.com/url?rct=j&sa=t&url=https://www.usda.gov/media/press-releases/2024/06/20/usda-releases-updated-climate-adaptation-and-resilience-plan&ct=ga&cd=CAIyHDFlZTI2MTBhMjBkODFiZWQ6Y29tOmVuOlVTOlI&usg=AOvVaw1r3oCf8wfSbpNgX1Ly2MK_
"tag:google.com,2013:googlealerts/feed:11870833018322534676",2024-06-20T22:00:11Z,2024-06-20T22:00:11Z,<b>USDA</b> reminds North Carolina producers to file crop acreage reports | Business,Agricultural producers in North Carolina should make an appointment with their local Farm Service Agency (FSA) office to complete crop acreage&nbsp;...,https://www.google.com/url?rct=j&sa=t&url=https://www.newsargus.com/brunswick_beacon/news/business/usda-reminds-north-carolina-producers-to-file-crop-acreage-reports/article_30f10853-32f3-5f40-923c-cebc54f2af53.html&ct=ga&cd=CAIyHDFlZTI2MTBhMjBkODFiZWQ6Y29tOmVuOlVTOlI&usg=AOvVaw2ZY8AIXhOx9QdKb5kFlPrn
"tag:google.com,2013:googlealerts/feed:15137023843498044417",2024-06-20T21:06:36Z,2024-06-20T21:06:36Z,Debate over <b>SNAP</b> funding could impact farm bill passage - WBTW,Gillibrand also worries about potential GOP funding cuts to nutrition programs for low-income Americans. “They want to cut <b>SNAP benefits</b> by $30&nbsp;...,https://www.google.com/url?rct=j&sa=t&url=https://www.wbtw.com/news/politics/debate-over-snap-funding-could-impact-farm-bill-passage/&ct=ga&cd=CAIyHDFlZTI2MTBhMjBkODFiZWQ6Y29tOmVuOlVTOlI&usg=AOvVaw26rT7tOACVJh4DhVGKt7id
"tag:google.com,2013:googlealerts/feed:15283072252352747419",2024-06-20T19:42:23Z,2024-06-20T19:42:23Z,<b>USDA</b> looks for ways to protect its operations from climate change,"Extreme temperatures and the risks of flooding and fire will put more <b>USDA</b> facilities at risk in coming years, the department said in a new&nbsp;...",https://www.google.com/url?rct=j&sa=t&url=https://www.agri-pulse.com/articles/21269-usda-looks-for-ways-to-protect-its-operations-from-climate-change&ct=ga&cd=CAIyHDFlZTI2MTBhMjBkODFiZWQ6Y29tOmVuOlVTOlI&usg=AOvVaw20SkI8DuzMNML1tMjvmNQP
"tag:google.com,2013:googlealerts/feed:17825931481908442925",2024-06-20T19:40:22Z,2024-06-20T19:40:22Z,AssetMark to <b>snap</b> up multibillion-dollar TAMP business from Morningstar - InvestmentNews,"In April, AssetMark itself became the object of an acquisition deal when PE firm GTCR announced plans to <b>snap</b> AssetMark up for $2.7 billion in a&nbsp;...",https://www.google.com/url?rct=j&sa=t&url=https://www.investmentnews.com/fintech/news/assetmark-snaps-up-multibillion-dollar-tamp-business-from-morningstar-254654&ct=ga&cd=CAIyHDFlZTI2MTBhMjBkODFiZWQ6Y29tOmVuOlVTOlI&usg=AOvVaw2SmMG2VTKl-eJiZoHxrM9R
"tag:google.com,2013:googlealerts/feed:7928483427207570238",2024-06-20T19:35:30Z,2024-06-20T19:35:30Z,<b>Snap</b> Will Pay $15 Million to End Worker Sex Discrimination Suit - Bloomberg Law News,<b>Snap</b> Inc. will pay around $15 million to workers to settle an employee sex discrimination lawsuit from California regulators.,https://www.google.com/url?rct=j&sa=t&url=https://news.bloomberglaw.com/litigation/snap-will-pay-15-million-to-end-worker-sex-discrimination-suit&ct=ga&cd=CAIyHDFlZTI2MTBhMjBkODFiZWQ6Y29tOmVuOlVTOlI&usg=AOvVaw3kOOX30hMPH1C20kQ0ceeM
"tag:google.com,2013:googlealerts/feed:10024884233276774467",2024-06-20T19:13:17Z,2024-06-20T19:13:17Z,Florida expands work requirements for <b>SNAP</b> - Ballotpedia News,... <b>Supplemental Nutrition Assistance Program</b> (<b>SNAP</b>). The legislation mandates that individuals aged 18-59 must participate in the <b>SNAP</b> Employment and&nbsp;...,https://www.google.com/url?rct=j&sa=t&url=https://news.ballotpedia.org/2024/06/20/florida-expands-work-requirements-for-snap/&ct=ga&cd=CAIyHDFlZTI2MTBhMjBkODFiZWQ6Y29tOmVuOlVTOlI&usg=AOvVaw23q-lU6P8OL0Ml9QyYmMIs
"tag:google.com,2013:googlealerts/feed:10575207088046711905",2024-06-20T18:28:01Z,2024-06-20T18:28:01Z,"Douglass Park returns to the people, Harold Washington Library acquires photos of Pilsen in ...","Douglass Park returns to the people, Harold Washington Library acquires photos of Pilsen in the 90s, and Summer <b>SNAP benefits</b>. by South Side Weekly&nbsp;...",https://www.google.com/url?rct=j&sa=t&url=https://southsideweekly.com/douglass-park-returns-to-the-people-harold-washington-library-acquires-photos-of-pilsen-in-the-90s-and-summer-snap-benefits/&ct=ga&cd=CAIyHDFlZTI2MTBhMjBkODFiZWQ6Y29tOmVuOlVTOlI&usg=AOvVaw1_2jyzzBhJL4FD2dU_d3zI
"tag:google.com,2013:googlealerts/feed:2619372662546264042",2024-06-20T18:23:23Z,2024-06-20T18:23:23Z,<b>SNAP Benefits</b> for Veterans: Can you get VA Disability benefits and <b>food stamps</b>? | Marca,Known as the <b>Supplemental Nutrition Assistance Program</b> (<b>SNAP</b>) is a set of benefits that include disability compensation and <b>food stamps</b> for&nbsp;...,https://www.google.com/url?rct=j&sa=t&url=https://www.marca.com/en/lifestyle/us-news/personal-finance/2024/06/20/667472c546163f4a8e8b457d.html&ct=ga&cd=CAIyHDFlZTI2MTBhMjBkODFiZWQ6Y29tOmVuOlVTOlI&usg=AOvVaw0tG2csHRLZ5GGIuNTSYqBl
"tag:google.com,2013:googlealerts/feed:10512552277531431702",2024-06-20T17:52:22Z,2024-06-20T17:52:22Z,First <b>USDA</b> trade mission dedicated to indigenous products | Iowa Agri Businessradio Network,The mission is intended to develop export markets for Tribal and Native Hawaiian businesses and products. “This historic trade mission showcasing&nbsp;...,https://www.google.com/url?rct=j&sa=t&url=https://iowaagribusinessradionetwork.com/first-usda-trade-mission-dedicated-to-indigenous-products/&ct=ga&cd=CAIyHDFlZTI2MTBhMjBkODFiZWQ6Y29tOmVuOlVTOlI&usg=AOvVaw3EZ2Gw1dQwFJ4QgTSgidFV
"tag:google.com,2013:googlealerts/feed:9058516520368290204",2024-06-20T17:23:24Z,2024-06-20T17:23:24Z,Tribal Comment Template Letters: Tribal Self-Determination at <b>USDA</b>,The Indigenous Food and Agriculture Initiative&#39;s legal and policy team have compiled comment template letters that Tribes and Tribal leaders can&nbsp;...,https://www.google.com/url?rct=j&sa=t&url=https://www.indigenousfoodandag.com/blog/news/tribal-comment-template-letters-tribal-self-determination-at-usda/&ct=ga&cd=CAIyHDFlZTI2MTBhMjBkODFiZWQ6Y29tOmVuOlVTOlI&usg=AOvVaw0HnfK9aTz3JTXAKgEGnngs
"tag:google.com,2013:googlealerts/feed:4529142704108600322",2024-06-20T17:16:58Z,2024-06-20T17:16:58Z,France&#39;s National Rally seen leading popular vote in <b>snap</b> elections – IFOP | WKZO,"France&#39;s National Rally seen leading popular vote in <b>snap</b> elections – IFOP. By Thomson Reuters Jun 20, 2024 | 1:06 PM. PARIS (Reuters) – Marine Le&nbsp;...",https://www.google.com/url?rct=j&sa=t&url=https://wkzo.com/2024/06/20/frances-national-rally-seen-leading-popular-vote-in-snap-elections-ifop/&ct=ga&cd=CAIyHDFlZTI2MTBhMjBkODFiZWQ6Y29tOmVuOlVTOlI&usg=AOvVaw3A_RSxoSryu1env0XV10cp
"tag:google.com,2013:googlealerts/feed:13073002427505697804",2024-06-20T17:12:31Z,2024-06-20T17:12:31Z,Snapchat Inc. to pay $15 million to settle discrimination and harassment lawsuit in California,"“We care deeply about our commitment to maintain a fair and inclusive environment at <b>Snap</b>, and do not believe we have any ongoing systemic pay&nbsp;...",https://www.google.com/url?rct=j&sa=t&url=https://abcnews.go.com/US/wireStory/snapchat-pay-15-million-settle-discrimination-harassment-lawsuit-111261800&ct=ga&cd=CAIyHDFlZTI2MTBhMjBkODFiZWQ6Y29tOmVuOlVTOlI&usg=AOvVaw0WnwFInv1iI_WtsjJCz-Td
"tag:google.com,2013:googlealerts/feed:5944234627979905841",2024-06-20T17:06:06Z,2024-06-20T17:06:06Z,<b>USDA</b> Cites Frozen Food Development Inc. in Pennsylvania for PACA Violations,"<b>USDA</b> filed a complaint in January 2023 alleging that Frozen Food failed to pay $2,479,131 to 22 sellers for produce that was purchased, received and&nbsp;...",https://www.google.com/url?rct=j&sa=t&url=https://www.ams.usda.gov/press-release/usda-cites-frozen-food-development-inc-pennsylvania-paca-violations&ct=ga&cd=CAIyHDFlZTI2MTBhMjBkODFiZWQ6Y29tOmVuOlVTOlI&usg=AOvVaw2SLeEhTZMWQcO8Q9020EY8
"tag:google.com,2013:googlealerts/feed:8301756116858126082",2024-06-20T16:51:37Z,2024-06-20T16:51:37Z,<b>Snap</b>-On Mandrels (Moore) | Dental Product,"Buy <b>Snap</b>-On Mandrels (Moore) at Pearson Dental Supply for the Best Price, Highest Quality, Superior Customer Service. 800-535-4535.",https://www.google.com/url?rct=j&sa=t&url=https://www.pearsonlab.com/catalog/product.asp%3Fmajcatid%3D9398%26catid%3D971%26subcatid%3D3092%26pid%3D20628&ct=ga&cd=CAIyHDFlZTI2MTBhMjBkODFiZWQ6Y29tOmVuOlVTOlI&usg=AOvVaw0-A2R7Y12Iq8AgDYkjOCSz
"tag:google.com,2013:googlealerts/feed:15083686780784784912",2024-06-20T16:50:11Z,2024-06-20T16:50:11Z,"Accenture, KB Home rise; <b>Snap</b>, Jabil fall, Thursday, 6/20/2024 | The Seattle Times","Stocks that are trading heavily or have substantial price changes on Thursday: Accenture, KB Home rise; <b>Snap</b>, Jabil fall.",https://www.google.com/url?rct=j&sa=t&url=https://www.seattletimes.com/business/accenture-kb-home-rise-snap-jabil-fall-thursday-6-20-2024/&ct=ga&cd=CAIyHDFlZTI2MTBhMjBkODFiZWQ6Y29tOmVuOlVTOlI&usg=AOvVaw3ff5yBdC9BAVh9qovoXUhE
"tag:google.com,2013:googlealerts/feed:9643414523582204313",2024-06-20T16:48:20Z,2024-06-20T16:48:20Z,Pre-<b>Snap</b> Reads 6/20: Lockett discusses differences between Carroll and Macdonald - Field Gulls,Seattle Seahawks News &middot; Pre-<b>Snap</b> Reads. Pre-<b>Snap</b> Reads 6/20: Lockett discusses differences between&nbsp;...,https://www.google.com/url?rct=j&sa=t&url=https://www.fieldgulls.com/2024/6/20/24182317/pre-snap-reads-6-20-lockett-discusses-differences-between-carroll-and-macdonald&ct=ga&cd=CAIyHDFlZTI2MTBhMjBkODFiZWQ6Y29tOmVuOlVTOlI&usg=AOvVaw0k1UwfB9kcS8-X0b3spFd4
"tag:google.com,2013:googlealerts/feed:3706853687432301494",2024-06-20T16:43:21Z,2024-06-20T16:43:21Z,Be the Link: Rooted in Resiliency | Farmers.gov,It&#39;s time once again for the <b>USDA</b> Farm Service Agency&#39;s annual county committee elections.,https://www.google.com/url?rct=j&sa=t&url=https://www.farmers.gov/blog/be-link-rooted-in-resiliency&ct=ga&cd=CAIyHDFlZTI2MTBhMjBkODFiZWQ6Y29tOmVuOlVTOlI&usg=AOvVaw1N0TmyEWZpV0oD9J43POyv
"tag:google.com,2013:googlealerts/feed:10085007885389385233",2024-06-21T03:56:41Z,2024-06-21T03:56:41Z,"Georgia&#39;s <b>SNAP</b> renewal backlog &#39;effectively cleared,&#39; but backlog of applications remains","Georgia&#39;s <b>SNAP</b> renewal backlog &#39;effectively cleared,&#39; but backlog of applications remains. As of June 20, numbers show 39 renewal cases are overdue&nbsp;...",https://www.google.com/url?rct=j&sa=t&url=https://www.11alive.com/video/news/local/georgias-snap-renewal-backlog-effectively-cleared-but-backlog-of-applications-remains/85-b67ac125-910e-4190-8f57-697a9c415332&ct=ga&cd=CAIyHDFlZTI2MTBhMjBkODFiZWQ6Y29tOmVuOlVTOlI&usg=AOvVaw1SVd_fD9YymBvTRZuxfHhP
