id,time,accessdate,title,description,link
"tag:google.com,2013:googlealerts/feed:14325274252293864310",2024-03-16T16:32:48Z,,Who should be on <b>SNAP</b>? An explainer on the discussion around HB 367 | Kentucky,"In his speech, he argued that House Bill 367 would disenfranchise <b>SNAP</b> recipients and greatly increase the demand for assistance from food banks all&nbsp;...",https://www.google.com/url?rct=j&sa=t&url=https://www.richmondregister.com/kentucky/who-should-be-on-snap-an-explainer-on-the-discussion-around-hb-367/article_3ad75322-e296-11ee-9582-a323910a927d.html&ct=ga&cd=CAIyHDQxZDMxZTk2MjZjMWY4NmI6Y29tOmVuOlVTOlI&usg=AOvVaw3W-R81GyuNAWO5sE4NeaUu
"tag:google.com,2013:googlealerts/feed:5860088708024106095",2024-03-16T15:45:45Z,,<b>SNAP</b> Payments in March: When will the money be reloaded this month? - La Grada,"The <b>Supplemental Nutrition Assistance Program</b> (<b>SNAP</b>), formerly the Food Stamp Program, is a government financial aid program that offers coupon&nbsp;...",https://www.google.com/url?rct=j&sa=t&url=https://lagradaonline.com/en/march-snap-payments-when-will-the-money-be-reloaded/&ct=ga&cd=CAIyHDQxZDMxZTk2MjZjMWY4NmI6Y29tOmVuOlVTOlI&usg=AOvVaw3dC-MA2C4kvZUgt7PR9zqL
"tag:google.com,2013:googlealerts/feed:17247867669086709741",2024-03-16T12:09:08Z,,Restaurant Meals Program expands to include food trucks - Spectrum News,It allows people to use <b>SNAP</b> benefits at approved restaurants and food trucks in Massachusetts. The Department of Transitional Assistance said food&nbsp;...,https://www.google.com/url?rct=j&sa=t&url=https://spectrumnews1.com/ma/worcester/news/2024/03/15/restaurant-meal-program-expands-to-include-food-trucks&ct=ga&cd=CAIyHDQxZDMxZTk2MjZjMWY4NmI6Y29tOmVuOlVTOlI&usg=AOvVaw3z9pbh5xybbLPKmTpWlmth
"tag:google.com,2013:googlealerts/feed:15380984631371967910",2024-06-04T18:50:34Z,,Medicaid &amp; <b>SNAP</b> Application Assistance - Columbus Metropolitan Library,Stop by the Carnegie Caf� to get assistance applying for <b>SNAP</b> or Medicaid benefits from the LSS Health Center team. Please bring a photo ID.,https://www.google.com/url?rct=j&sa=t&url=https://events.columbuslibrary.org/event/10999137&ct=ga&cd=CAIyHDFlZTI2MTBhMjBkODFiZWQ6Y29tOmVuOlVTOlI&usg=AOvVaw2jdcbxbqwCIu9htq4nuYSt
"tag:google.com,2013:googlealerts/feed:8351875460173059868",2024-06-04T18:39:46Z,,Cass County producers may be eligible for <b>USDA</b> emergency funds - Michigan Farm News,<b>USDA</b> has announced emergency funding through the Farm Service Agency's Emergency Conservation Program and the agency's Emergency Forest&nbsp;...,https://www.google.com/url?rct=j&sa=t&url=https://www.michiganfarmnews.com/cass-county-producers-may-be-eligible-for-usda-emergency-funds&ct=ga&cd=CAIyHDFlZTI2MTBhMjBkODFiZWQ6Y29tOmVuOlVTOlI&usg=AOvVaw2D7GDaDJ9SoBhmywcXmANI
"tag:google.com,2013:googlealerts/feed:16584468760266363966",2024-06-04T18:22:57Z,,"Producers, Landowners Can Sign Up for <b>USDA's</b> Grassland CRP Through June 28","The sign-up period for the Grassland Conservation Reserve Program (CRP) will run from June 3-28, according to a <b>USDA</b> news release.",https://www.google.com/url?rct=j&sa=t&url=https://www.dtnpf.com/agriculture/web/ag/news/business-inputs/article/2024/06/04/producers-landowners-can-sign-usdas&ct=ga&cd=CAIyHDFlZTI2MTBhMjBkODFiZWQ6Y29tOmVuOlVTOlI&usg=AOvVaw119_V5LIWoXCbm6nfs_Zw4
"tag:google.com,2013:googlealerts/feed:14222717692998257676",2024-06-04T18:11:28Z,,Confirmed dates of a new <b>SNAP</b> benefit payment in this state - La Grada,"3.4 million Texans get <b>Supplemental Nutrition Assistance Program</b> (<b>SNAP) benefits</b> each month, and many of them are interested in learning when their&nbsp;...",https://www.google.com/url?rct=j&sa=t&url=https://lagradaonline.com/en/new-snap-benefit-payment-in-this-state/&ct=ga&cd=CAIyHDFlZTI2MTBhMjBkODFiZWQ6Y29tOmVuOlVTOlI&usg=AOvVaw3BLA6R5HGYTGHAxlCfYcw5
"tag:google.com,2013:googlealerts/feed:590344141831121948",2024-06-04T17:38:28Z,,<b>USDA</b> grant to help Valley couple give farming lessons - KRGV,<b>USDA</b> grant to help Valley couple give farming lessons ... <b>USDA</b> grant to help Valley couple give... <b>USDA</b> ... Created with <b>Snap</b>. News Video. <b>USDA</b> grant to&nbsp;...,https://www.google.com/url?rct=j&sa=t&url=https://www.krgv.com/news/usda-grant-to-help-valley-couple-give-farming-lessons/&ct=ga&cd=CAIyHDFlZTI2MTBhMjBkODFiZWQ6Y29tOmVuOlVTOlI&usg=AOvVaw3inHrM-yDjwvQI5ecatV2O
"tag:google.com,2013:googlealerts/feed:12754715361655377194",2024-06-04T17:35:49Z,,How does <b>USDA's</b> animal traceability rule affect the Kansas food supply? | News - Farm Talk,"On May 30th in Manhattan, Kansas, state Animal Disease Coordinator, Garrett Girk, took the hot seat to chat with producers about the <b>USDA's</b> new beef&nbsp;...",https://www.google.com/url?rct=j&sa=t&url=https://www.farmtalknews.com/news/how-does-usda-s-animal-traceability-rule-affect-the-kansas-food-supply/article_a94709be-2293-11ef-847c-9b43145b61c8.html&ct=ga&cd=CAIyHDFlZTI2MTBhMjBkODFiZWQ6Y29tOmVuOlVTOlI&usg=AOvVaw2KOZQwtjc_omj20Ps9SDlj
"tag:google.com,2013:googlealerts/feed:15223855431856402637",2024-06-04T17:28:21Z,,<b>USDA</b> proposes next steps to fairer markets and transparency | Iowa Agri Businessradio Network,It also addresses abuses of additional capital investment requirements that poultry companies commonly ask of their contract growers for broiler&nbsp;...,https://www.google.com/url?rct=j&sa=t&url=https://iowaagribusinessradionetwork.com/usda-proposes-next-steps-to-fairer-markets-and-transparency/&ct=ga&cd=CAIyHDFlZTI2MTBhMjBkODFiZWQ6Y29tOmVuOlVTOlI&usg=AOvVaw1G9KrUPAvEvig1xGMU6wJW
"tag:google.com,2013:googlealerts/feed:1103259129562266137",2024-06-06T21:51:04Z,2024-06-06T21:51:04Z,Missourians who lost <b>SNAP benefits</b> due to May 25-26 storms can apply for replacement ...,(KBSI) - Missourians who lost food purchased with their <b>Supplemental Nutrition Assistance Program</b> (<b>SNAP) benefits</b> due to severe storms on May&nbsp;...,https://www.google.com/url?rct=j&sa=t&url=https://www.kbsi23.com/news/missourians-who-lost-snap-benefits-due-to-may-25-26-storms-can-apply-for-replacement-benefits/&ct=ga&cd=CAIyHDFlZTI2MTBhMjBkODFiZWQ6Y29tOmVuOlVTOlI&usg=AOvVaw2T445SumR2ZyQV5OJfeSFm
"tag:google.com,2013:googlealerts/feed:9173049686344701376",2024-06-06T21:43:26Z,2024-06-06T21:43:26Z,"20,000 pounds of beef recalled, <b>USDA</b> says - WIS",The frozen raw beef&nbsp;...,https://www.google.com/url?rct=j&sa=t&url=https://www.wistv.com/2024/06/06/20000-pounds-beef-recalled-usda-says/&ct=ga&cd=CAIyHDFlZTI2MTBhMjBkODFiZWQ6Y29tOmVuOlVTOlI&usg=AOvVaw2-BtVwpfqAdp56V9vO6P0d
"tag:google.com,2013:googlealerts/feed:8856500460968106861",2024-06-06T21:19:15Z,2024-06-06T21:19:15Z,Shapiro Administration Reminds Pennsylvanians to Be Aware of EBT Card Skimming ...,Val Arkoosh is reminding Pennsylvanians who receive <b>Supplemental Nutrition Assistance Program</b> (<b>SNAP) benefits</b> to remain vigilant in protecting&nbsp;...,https://www.google.com/url?rct=j&sa=t&url=https://www.media.pa.gov/pages/dhs_details.aspx%3Fnewsid%3D1025&ct=ga&cd=CAIyHDFlZTI2MTBhMjBkODFiZWQ6Y29tOmVuOlVTOlI&usg=AOvVaw2PC_pJftnVGvamtDNABEYK
"tag:google.com,2013:googlealerts/feed:12196721341336334183",2024-06-06T20:39:52Z,2024-06-06T20:39:52Z,<b>USDA</b>: WIC benefits to be upgraded this summer - WNKY News 40 Television,"According to the United States, Department of Agriculture, more benefits are coming to WIC users. There will be more access to canned fish and foods&nbsp;...",https://www.google.com/url?rct=j&sa=t&url=https://www.wnky.com/usda-wic-benefits-to-be-upgraded-this-summer/&ct=ga&cd=CAIyHDFlZTI2MTBhMjBkODFiZWQ6Y29tOmVuOlVTOlI&usg=AOvVaw1QbyjPdJNzvllHJcDihG32
"tag:google.com,2013:googlealerts/feed:3171279759486792352",2024-06-06T20:38:37Z,2024-06-06T20:38:37Z,OH <b>SNAP</b>! Snapping turtle lays her eggs in Hartland library garden bed - GMToday.com,"Kind of in the more mucky areas.&quot; He said snapping turtles &quot;hang out,&quot; waiting for something to swim by so they can, as the name implies, <b>snap</b> it up.",https://www.google.com/url?rct=j&sa=t&url=https://www.gmtoday.com/the_freeman/news/oh-snap-snapping-turtle-lays-her-eggs-in-hartland-library-garden-bed/article_5ba2f1e5-46cf-54e2-9ce1-33c930ee8f78.html&ct=ga&cd=CAIyHDFlZTI2MTBhMjBkODFiZWQ6Y29tOmVuOlVTOlI&usg=AOvVaw0F3wztOwusUFGydz28PzLj
"tag:google.com,2013:googlealerts/feed:16484018181467983805",2024-06-06T20:29:01Z,2024-06-06T20:29:01Z,<b>USDA</b> announces Grassland Conservation Reserve Program signup - Natchitoches Times,The U.S. Department of Agriculture (<b>USDA</b>) announced that agricultural producers and private landowners can now sign up for the Grassland&nbsp;...,https://www.google.com/url?rct=j&sa=t&url=https://www.natchitochestimes.com/news/usda-announces-grassland-conservation-reserve-program-signup&ct=ga&cd=CAIyHDFlZTI2MTBhMjBkODFiZWQ6Y29tOmVuOlVTOlI&usg=AOvVaw3hB0SaqK8ONEaqX7MEMGZw
"tag:google.com,2013:googlealerts/feed:7344064780929691252",2024-06-06T20:18:09Z,2024-06-06T20:18:09Z,&#39;Cook the kit&#39; with <b>snap</b> peas a hit at Mt. Pleasant Farmers Market - The Morning Sun,"... <b>snap</b> pea pasta. A small, plastic container of olive oil, a box of pasta, parsley and parmesan cheese awaited Simons and all the other people who&nbsp;...",https://www.google.com/url?rct=j&sa=t&url=https://www.themorningsun.com/2024/06/06/cook-the-kit-with-snap-peas-a-hit-at-mt-pleasant-farmers-market/&ct=ga&cd=CAIyHDFlZTI2MTBhMjBkODFiZWQ6Y29tOmVuOlVTOlI&usg=AOvVaw3HFK7DW1d3PzJ_n95vcFkw
"tag:google.com,2013:googlealerts/feed:18002188742423711263",2024-06-06T20:16:03Z,2024-06-06T20:16:03Z,<b>SNAP benefits</b> are a huge part of the farm bill and a big point of contention for lawmakers,Direct the <b>USDA</b> to issue formal guidance on notifying eligible college students that they qualify for <b>SNAP</b>. “We don&#39;t feel there are cuts to <b>SNAP</b>&nbsp;...,https://www.google.com/url?rct=j&sa=t&url=https://www.northernpublicradio.org/2024-06-06/snap-benefits-farm-bill&ct=ga&cd=CAIyHDFlZTI2MTBhMjBkODFiZWQ6Y29tOmVuOlVTOlI&usg=AOvVaw3rWCoNwCts49iNMe4KatPF
"tag:google.com,2013:googlealerts/feed:1368008355556955911",2024-06-06T20:10:25Z,2024-06-06T20:10:25Z,<b>SNAP</b> recipients impacted by storms get replacement benefit extension,"JEFFERSON CITY, Mo.– Missourians who lost food purchased with their <b>Supplemental Nutrition Assistance Program</b> (<b>SNAP) benefits</b> due to severe storms&nbsp;...",https://www.google.com/url?rct=j&sa=t&url=http://standard-democrat.com/story/3043020.html&ct=ga&cd=CAIyHDFlZTI2MTBhMjBkODFiZWQ6Y29tOmVuOlVTOlI&usg=AOvVaw2RogT2U_Uh_W2ekfMxyyL4
"tag:google.com,2013:googlealerts/feed:4879745775100197098",2024-06-06T19:55:02Z,2024-06-06T19:55:02Z,A guide to <b>USDA</b> streamlined refinance loans - Yahoo Finance,"<b>USDA</b> streamlined refinance loans don&#39;t require an appraisal, inspection, or any home equity. Find out which type of <b>USDA</b> streamlined refinance is&nbsp;...",https://www.google.com/url?rct=j&sa=t&url=https://finance.yahoo.com/personal-finance/usda-streamline-refinance-194249465.html&ct=ga&cd=CAIyHDFlZTI2MTBhMjBkODFiZWQ6Y29tOmVuOlVTOlI&usg=AOvVaw1SlZnz7psB5c0myqpWLcuM
"tag:google.com,2013:googlealerts/feed:609084014711013351",2024-06-06T19:48:51Z,2024-06-06T19:48:51Z,Heliot Ramos surpasses a Bondsian standard as Giants <b>snap</b> losing streak - The Athletic,Heliot Ramos surpasses a Bondsian standard as Giants <b>snap</b> losing streak. San Francisco Giants&amp;#039; Heliot Ramos points skyward after hitting a two&nbsp;...,https://www.google.com/url?rct=j&sa=t&url=https://www.nytimes.com/athletic/5544958/2024/06/06/sf-giants-heliot-ramos-six-times-on-base/&ct=ga&cd=CAIyHDFlZTI2MTBhMjBkODFiZWQ6Y29tOmVuOlVTOlI&usg=AOvVaw0m-HvqvLpnHZyJz8Qydmcm
"tag:google.com,2013:googlealerts/feed:11503476461308651680",2024-06-06T19:20:02Z,2024-06-06T19:20:02Z,<b>Snap</b> One partners with RG Nets - Security Systems News,"CHARLOTTE, N.C. — <b>Snap</b> One announced that it is partnering with RG Nets to provide <b>Snap</b> One Partners access to the rXg solution,&nbsp;...",https://www.google.com/url?rct=j&sa=t&url=https://www.securitysystemsnews.com/article/snap-one-partners-with-rg-nets&ct=ga&cd=CAIyHDFlZTI2MTBhMjBkODFiZWQ6Y29tOmVuOlVTOlI&usg=AOvVaw3AFpf5EWsFHQKUbDjMUSyF
"tag:google.com,2013:googlealerts/feed:8886899028060190525",2024-06-06T18:45:49Z,2024-06-06T18:45:49Z,"Meat industry increases political spending, lobbying as <b>USDA</b> updates crucial regulations",Meat industry groups and major meat companies spent more than $10 million on political contributions and lobbying efforts in 2023.,https://www.google.com/url?rct=j&sa=t&url=https://www.agriculture.com/meat-industry-increases-political-spending-lobbying-as-usda-updates-crucial-regulations-8659589&ct=ga&cd=CAIyHDFlZTI2MTBhMjBkODFiZWQ6Y29tOmVuOlVTOlI&usg=AOvVaw0GAQycFeBtBkAVb4Yo7oGA
"tag:google.com,2013:googlealerts/feed:10679798313422592800",2024-06-06T18:00:16Z,2024-06-06T18:00:16Z,The Sustainability Engagement Institute can now accept <b>SNAP</b>/EBT for VSA fresh produce boxes!,Western&#39;s Sustainability Engagement Institute is very excited to announce that it is now able to accept <b>SNAP</b>/EBT for Viva Farms weekly Viking&nbsp;...,https://www.google.com/url?rct=j&sa=t&url=https://news.wwu.edu/the-sustainability-engagement-institute-can-now-accept-snapebt-for-vsa-fresh-produce-boxes&ct=ga&cd=CAIyHDFlZTI2MTBhMjBkODFiZWQ6Y29tOmVuOlVTOlI&usg=AOvVaw3OblKOAXddQR-AUCVnd5eM
"tag:google.com,2013:googlealerts/feed:14063685603212180601",2024-06-06T17:18:34Z,2024-06-06T17:18:34Z,Surprising Things You Can&#39;t Buy With <b>Food Stamps</b> | Nasdaq,Surprising Things You Can&#39;t Buy With <b>Food Stamps</b> ... The <b>USDA</b> notes that “if an item has a Supplement ... Food Items You Can&#39;t Buy With <b>SNAP Benefits</b>.,https://www.google.com/url?rct=j&sa=t&url=https://www.nasdaq.com/articles/surprising-things-you-cant-buy-food-stamps&ct=ga&cd=CAIyHDFlZTI2MTBhMjBkODFiZWQ6Y29tOmVuOlVTOlI&usg=AOvVaw3VoO1-jigbCucSlgPri0US
"tag:google.com,2013:googlealerts/feed:12776855761766136046",2024-06-06T22:50:00Z,2024-06-06T22:50:00Z,"<b>USDA</b>, FarmRaise launch new ELAP decision tool - Texas Farm Bureau",A partnership between <b>USDA</b> and FarmRaise further expands the online library of disaster assistance and farm loan program reference resources and&nbsp;...,https://www.google.com/url?rct=j&sa=t&url=https://texasfarmbureau.org/usda-farmraise-launch-elap-decision-tool/&ct=ga&cd=CAIyHDFlZTI2MTBhMjBkODFiZWQ6Y29tOmVuOlVTOlI&usg=AOvVaw0qeQOGEKDvfz37Acdq6HOj
"tag:google.com,2013:googlealerts/feed:9937670084609131852",2024-06-06T18:49:44Z,2024-06-06T18:49:44Z,Resting place | Daily <b>Snap</b> | Yale Alumni Magazine,Daily <b>Snap</b>. Scenes on campus. Donate &middot; Classifieds &middot; Admissions Topic arrow ... Daily <b>Snap</b>. Scenes on campus. Ico print Print | Ico email Email |&nbsp;...,https://www.google.com/url?rct=j&sa=t&url=https://www.yalealumnimagazine.com/blog_posts/4394-resting-place&ct=ga&cd=CAIyHDFlZTI2MTBhMjBkODFiZWQ6Y29tOmVuOlVTOlI&usg=AOvVaw3ALNUIM_eDDMOZA8fY6nig
"tag:google.com,2013:googlealerts/feed:14962508542654515075",2024-06-07T23:09:38Z,2024-06-07T23:09:38Z,"US government wants $37M back from RI for <b>SNAP</b> overpayments, citing UHIP debacle","... <b>Supplemental Nutrition Assistance Program</b>, also known as <b>SNAP</b>. Stay in the know with WPRI 12 News. Local news, weather, sports, and award winning&nbsp;...",https://www.google.com/url?rct=j&sa=t&url=https://www.youtube.com/watch%3Fv%3D0gAZAAEvK7Y&ct=ga&cd=CAIyHDFlZTI2MTBhMjBkODFiZWQ6Y29tOmVuOlVTOlI&usg=AOvVaw20h44k3mD2nLwLPeBzym_A
"tag:google.com,2013:googlealerts/feed:3998222939607124306",2024-06-07T23:07:15Z,2024-06-07T23:07:15Z,State asks <b>USDA</b> for help after second case of bird flu detected in another Iowa dairy herd,"Bird flu has been confirmed in a second herd of dairy cattle in Iowa, this time in Sioux County. The news comes just a couple days after&nbsp;...",https://www.google.com/url?rct=j&sa=t&url=https://cbs2iowa.com/news/local/state-asks-usda-for-help-after-second-case-of-bird-flu-detected-in-another-iowa-dairy-herd-sioux-county-obrien-county-highly-pathogenic-avian-influenza&ct=ga&cd=CAIyHDFlZTI2MTBhMjBkODFiZWQ6Y29tOmVuOlVTOlI&usg=AOvVaw214moHPsMFuVg2CRbDnUZM
"tag:google.com,2013:googlealerts/feed:12402368199526981225",2024-06-07T22:20:15Z,2024-06-07T22:20:15Z,<b>USDA</b> grant helps City of Monroe pay for costly aerial-ladder fire truck,MONROE — Some unexpected good news is brightening the city&#39;s financial picture in the form of re-allocated American Rescue Plan Act of 2021 Funds.,https://www.google.com/url?rct=j&sa=t&url=https://themonroetimes.com/local-news/usda-grant-helps-city-monroe-pay-costly-aerial-ladder-fire-truck/&ct=ga&cd=CAIyHDFlZTI2MTBhMjBkODFiZWQ6Y29tOmVuOlVTOlI&usg=AOvVaw0poyrYqTmRf-8YFv6N3IGT
"tag:google.com,2013:googlealerts/feed:11082180198740987223",2024-06-07T22:04:58Z,2024-06-07T22:04:58Z,<b>USDA</b> confirms first case of bird flu in Wyoming dairy cattle herd - Cap City News,"CHEYENNE, Wyo. — The Wyoming Livestock Board and the Wyoming Department of Agriculture have received confirmation from the United States&nbsp;...",https://www.google.com/url?rct=j&sa=t&url=https://capcity.news/agriculture-2/2024/06/07/usda-confirms-first-case-of-bird-flu-in-wyoming-dairy-cattle-herd/&ct=ga&cd=CAIyHDFlZTI2MTBhMjBkODFiZWQ6Y29tOmVuOlVTOlI&usg=AOvVaw24TplQGyK1KUjNzfxPXlnZ
"tag:google.com,2013:googlealerts/feed:4439889601958670309",2024-06-07T21:55:20Z,2024-06-07T21:55:20Z,Meijer now accepting <b>SNAP benefits</b> for mobile orders - LimaOhio.com,— Meijer has announced that it is expanding access to <b>Supplemental Nutrition Assistance Program</b> benefits for families by accepting <b>SNAP</b> on its mobile&nbsp;...,https://www.google.com/url?rct=j&sa=t&url=https://www.limaohio.com/news/2024/06/07/meijer-now-accepting-snap-benefits-for-mobile-orders/&ct=ga&cd=CAIyHDFlZTI2MTBhMjBkODFiZWQ6Y29tOmVuOlVTOlI&usg=AOvVaw1HtdQxebM7KMewEM84oMJT
"tag:google.com,2013:googlealerts/feed:15787749889430841741",2024-06-07T21:41:38Z,2024-06-07T21:41:38Z,Meijer now accepting <b>SNAP benefits</b> for app orders - Upper Michigan&#39;s Source,Midwest retailer&nbsp;...,https://www.google.com/url?rct=j&sa=t&url=https://www.uppermichiganssource.com/video/2024/06/07/meijer-now-accepting-snap-benefits-app-orders/&ct=ga&cd=CAIyHDFlZTI2MTBhMjBkODFiZWQ6Y29tOmVuOlVTOlI&usg=AOvVaw0fJ1aj9BoWt0D8N5gnYhJP
"tag:google.com,2013:googlealerts/feed:16434280467891489419",2024-06-07T21:38:56Z,2024-06-07T21:38:56Z,<b>USDA</b> issues recall of several imported raw beef products due to inspection violation,"WASHINGTON, D.C. -- Over 20100 pounds of frozen beef is being recalled by the U.S. after they were not properly re-inspected upon entering the&nbsp;...",https://www.google.com/url?rct=j&sa=t&url=https://www.am1100theflag.com/news/national-news/77037-usda-issues-recall-of-several-imported-raw-beef-products-due-to-inspection&ct=ga&cd=CAIyHDFlZTI2MTBhMjBkODFiZWQ6Y29tOmVuOlVTOlI&usg=AOvVaw2Lcq3FDZhHwigyPNOniHuw
"tag:google.com,2013:googlealerts/feed:3668185528117001790",2024-06-07T21:36:39Z,2024-06-07T21:36:39Z,"LI&#39;s Sloth Encounters Owner Warned Of Federal Law Violations: <b>USDA</b> | Hauppauge, NY Patch",The warning claims that Wallach and Sloth Encounters violated two laws: animals housed in the same primary enclosure must be properly separated (those&nbsp;...,https://www.google.com/url?rct=j&sa=t&url=https://patch.com/new-york/hauppauge/lis-sloth-encounters-owner-warned-federal-law-violations-usda&ct=ga&cd=CAIyHDFlZTI2MTBhMjBkODFiZWQ6Y29tOmVuOlVTOlI&usg=AOvVaw31gs6QlgSOSs4lyTOhoxfv
"tag:google.com,2013:googlealerts/feed:18200874517902179663",2024-06-07T21:15:43Z,2024-06-07T21:15:43Z,<b>SNAP</b> Recipients in One State at Risk of Losing Benefits - Newsweek,"If you live in Rhode Island and receive <b>Supplemental Nutrition Assistance Program</b> (<b>SNAP) benefits</b>, you may be at risk of losing your monthly grocery&nbsp;...",https://www.google.com/url?rct=j&sa=t&url=https://www.newsweek.com/snap-benefits-one-state-risk-losing-benefits-1909903&ct=ga&cd=CAIyHDFlZTI2MTBhMjBkODFiZWQ6Y29tOmVuOlVTOlI&usg=AOvVaw3hVf7ZC93Ai1slEtKXRJVS
"tag:google.com,2013:googlealerts/feed:4131593252868354358",2024-06-07T21:06:16Z,2024-06-07T21:06:16Z,"<b>SNAP benefits</b> reported to be stolen in Philadelphia, Southeastern Pennsylvania","A man from Chester said his <b>SNAP benefits</b>, sometimes referred to as <b>food stamps</b>, were stolen and now he said he has no idea how he&#39;s going to put&nbsp;...",https://www.google.com/url?rct=j&sa=t&url=https://www.cbsnews.com/philadelphia/news/snap-benefits-reported-to-be-stolen-in-philadelphia-southeastern-pennsylvania/&ct=ga&cd=CAIyHDFlZTI2MTBhMjBkODFiZWQ6Y29tOmVuOlVTOlI&usg=AOvVaw1kkadZSjjZS8FgsR94GMzQ
"tag:google.com,2013:googlealerts/feed:15603672429900850671",2024-06-07T21:00:53Z,2024-06-07T21:00:53Z,"US government wants $37M back from RI for <b>SNAP</b> overpayments, citing UHIP debacle","... <b>Supplemental Nutrition Assistance Program</b>, also known as <b>SNAP</b>. In the letter, regional administrator Lizbeth Silbermann attributed the demand for&nbsp;...",https://www.google.com/url?rct=j&sa=t&url=https://www.wpri.com/target-12/us-government-wants-37m-back-from-ri-for-snap-overpayments-citing-uhip-debacle/&ct=ga&cd=CAIyHDFlZTI2MTBhMjBkODFiZWQ6Y29tOmVuOlVTOlI&usg=AOvVaw16vvfo0dQ3AStnYvyc4S9Y
"tag:google.com,2013:googlealerts/feed:15665361935225911542",2024-06-07T21:00:28Z,2024-06-07T21:00:28Z,<b>Snap</b> Needles in the Treatment of Postop Hemorrhoidal Pain | JPR - Dove Medical Press,Purpose: The aim of this study is to evaluate the efficacy and safety of <b>Snap</b> Needles (SN) in the management of Postoperative Hemorrhoidal Pain (POHP)&nbsp;...,https://www.google.com/url?rct=j&sa=t&url=https://www.dovepress.com/efficacy-and-safety-of-snap-needles-in-the-treatment-of-postoperative--peer-reviewed-fulltext-article-JPR&ct=ga&cd=CAIyHDFlZTI2MTBhMjBkODFiZWQ6Y29tOmVuOlVTOlI&usg=AOvVaw1Mw2Ow5yFHrMbxP7GquRYc
"tag:google.com,2013:googlealerts/feed:4944081339533058203",2024-06-07T20:54:06Z,2024-06-07T20:54:06Z,New case of Highly Pathogenic Avian Influenza detected in Sioux County - KCRG,The Iowa Department of&nbsp;...,https://www.google.com/url?rct=j&sa=t&url=https://www.kcrg.com/2024/06/07/new-case-highly-pathogenic-avian-influenza-detected-sioux-county/&ct=ga&cd=CAIyHDFlZTI2MTBhMjBkODFiZWQ6Y29tOmVuOlVTOlI&usg=AOvVaw0cGeIuRq0FyRc1OZKakSge
"tag:google.com,2013:googlealerts/feed:12827537915065553999",2024-06-07T20:47:54Z,2024-06-07T20:47:54Z,<b>Food Stamps</b> Payment Increase: What states are offering a boost in <b>food stamps</b> payments soon?,"Rhode Island; Tennessee; Virginia; Washington; Washington, D.C.; West Virginia; Wisconsin. <b>Food Stamps</b> - English &middot; <b>SNAP Benefits</b> - English.",https://www.google.com/url?rct=j&sa=t&url=https://www.marca.com/en/lifestyle/us-news/personal-finance/2024/06/07/66631cba268e3e7f358b45fa.html&ct=ga&cd=CAIyHDFlZTI2MTBhMjBkODFiZWQ6Y29tOmVuOlVTOlI&usg=AOvVaw3pt2f8kQZ2G4GcRDgfKPjc
"tag:google.com,2013:googlealerts/feed:14443798433074177510",2024-06-07T20:13:19Z,2024-06-07T20:13:19Z,Domestic Fertilizer Production and China Blocks Certain U.S. Beef,<b>USDA</b> invests $83 million in domestic fertilizer production to boost rural economies and enhance competition in agricultural markets.,https://www.google.com/url?rct=j&sa=t&url=https://newstalkkit.com/domestic-fertilizer-production-and-china-blocks-certain-u-s-beef/&ct=ga&cd=CAIyHDFlZTI2MTBhMjBkODFiZWQ6Y29tOmVuOlVTOlI&usg=AOvVaw3dLggIoumeX3cPESPf-6uN
"tag:google.com,2013:googlealerts/feed:3395123173776505944",2024-06-07T20:08:03Z,2024-06-07T20:08:03Z,Meijer Makes Healthy Foods More Accessible for <b>SNAP</b> Participants - Baker City Herald,"... <b>Supplemental Nutrition Assistance Program</b> (<b>SNAP) benefits</b> on its Meijer app, providing a more convenient option for customers to pay for groceries&nbsp;...",https://www.google.com/url?rct=j&sa=t&url=https://www.bakercityherald.com/ae/home_living/meijer-makes-healthy-foods-more-accessible-for-snap-participants/article_a6e552ab-4357-56d4-9c8f-4dedc0f4b87a.html&ct=ga&cd=CAIyHDFlZTI2MTBhMjBkODFiZWQ6Y29tOmVuOlVTOlI&usg=AOvVaw0xkC7866sQQUuIyrEHlBoZ
"tag:google.com,2013:googlealerts/feed:207956136586259944",2024-06-07T20:00:57Z,2024-06-07T20:00:57Z,<b>USDA</b> Proposes Fairer Compensation for Chicken Farm Contractors,"This week, the U.S. Department of Agriculture (<b>USDA</b>) proposed a new rule for poultry farmer contracts, seeking to curb the “tournament system”&nbsp;...",https://www.google.com/url?rct=j&sa=t&url=https://www.presidentialprayerteam.org/2024/06/07/usda-proposes-fairer-compensation-for-chicken-farm-contractors/&ct=ga&cd=CAIyHDFlZTI2MTBhMjBkODFiZWQ6Y29tOmVuOlVTOlI&usg=AOvVaw0zNKRI-zsMSATg4QDVEWiK
"tag:google.com,2013:googlealerts/feed:9088180899557277166",2024-06-07T19:58:40Z,2024-06-07T19:58:40Z,<b>USDA</b> Announces $22 Million to Support Underserved and Veteran Farmers and Ranchers,"With <b>USDA&#39;s</b> 2501 Program funding, organizations conduct education, training, farming demos, and ag conferences to help underserved and veteran&nbsp;...",https://www.google.com/url?rct=j&sa=t&url=https://cropwatch.unl.edu/2024/usda-announces-22-million-support-underserved-and-veteran-farmers-and-ranchers&ct=ga&cd=CAIyHDFlZTI2MTBhMjBkODFiZWQ6Y29tOmVuOlVTOlI&usg=AOvVaw2JGlIQudBOiBUKmWJRzxwZ
