id,time,accessdate,title,description,link
"tag:google.com,2013:googlealerts/feed:11224462521412734764",2024-06-07T19:52:25Z,2024-06-07T19:52:25Z,Meijer Accepts <b>SNAP Benefits</b> on Its App Orders - Progressive Grocer,"Midwest retailer Meijer has begun accepting the use of <b>Supplemental Nutrition Assistance Program</b> (<b>SNAP) benefits</b> on its Meijer app,&nbsp;...",https://www.google.com/url?rct=j&sa=t&url=https://progressivegrocer.com/meijer-accepts-snap-benefits-its-app-orders&ct=ga&cd=CAIyHDFlZTI2MTBhMjBkODFiZWQ6Y29tOmVuOlVTOlI&usg=AOvVaw0NiPPrRptxwgmY7Mlel2aG
"tag:google.com,2013:googlealerts/feed:7105982969541775033",2024-06-07T19:32:52Z,2024-06-07T19:32:52Z,<b>USDA</b> Certified Organic Tea Tree Essential Oil 2oz 100% Natural &amp; Pure - UpNature,"100% Pure &amp; Natural, Therapeutic Grade Essential Oil, Steam-Distilled, Undiluted Organic Tea Tree Oil (Melaleuca alternifolia) from carefully&nbsp;...",https://www.google.com/url?rct=j&sa=t&url=https://upnature.com/products/organic-tea-tree-essential-oil-2-oz-usda-certified-organic-pure-tea-tree-oil-therapeutic-grade-undiluted-non-gmo-hair-skin-body-care-natural-face-scalp-cleanser-aromatherapy-with-dropper&ct=ga&cd=CAIyHDFlZTI2MTBhMjBkODFiZWQ6Y29tOmVuOlVTOlI&usg=AOvVaw0trNCo6OsqsenrvdmL9tv-
"tag:google.com,2013:googlealerts/feed:10545251459990631454",2024-06-08T23:09:28Z,2024-06-08T23:09:28Z,"Bulgaria holds another <b>snap</b> election, with more instability seen ahead - WHBL","Bulgaria holds another <b>snap</b> election, with more instability seen ahead. By Thomson Reuters Jun 8, 2024 | 5:40 PM. By Stoyan Nenov. SOFIA (Reuters)&nbsp;...",https://www.google.com/url?rct=j&sa=t&url=https://whbl.com/2024/06/08/bulgaria-holds-another-snap-election-with-more-instability-seen-ahead/&ct=ga&cd=CAIyHDFlZTI2MTBhMjBkODFiZWQ6Y29tOmVuOlVTOlI&usg=AOvVaw0QPISs_SSlbfop92ZRaFKG
"tag:google.com,2013:googlealerts/feed:4781267215089104766",2024-06-08T22:57:03Z,2024-06-08T22:57:03Z,Philadelphia area victims come forward in scheme targeting low-income families&#39; <b>SNAP benefits</b>,More victims are coming forward after CBS News Philadelphia first aired a story reporting a man in Chester&#39;s <b>SNAP benefits</b> had allegedly been&nbsp;...,https://www.google.com/url?rct=j&sa=t&url=https://www.cbsnews.com/philadelphia/video/philadelphia-area-victims-come-forward-in-scheme-targeting-low-income-families-snap-benefits/&ct=ga&cd=CAIyHDFlZTI2MTBhMjBkODFiZWQ6Y29tOmVuOlVTOlI&usg=AOvVaw3Z9UylWAQx5R2K4J-8Kz5o
"tag:google.com,2013:googlealerts/feed:10150950429354360261",2024-06-08T22:50:14Z,2024-06-08T22:50:14Z,More victims come forward in card-skimming scheme targeting <b>SNAP benefits</b> meant for low ...,... <b>SNAP</b> ... Money from the <b>Supplemental Nutrition Assistance Program</b> (<b>SNAP</b>) is vanishing from accounts. ... <b>Food Stamps</b> &middot; Philadelphia. First published on&nbsp;...,https://www.google.com/url?rct=j&sa=t&url=https://www.cbsnews.com/philadelphia/news/stolen-snap-benefits-philadelphia-pennsylvania-new-york/&ct=ga&cd=CAIyHDFlZTI2MTBhMjBkODFiZWQ6Y29tOmVuOlVTOlI&usg=AOvVaw0Mh5PoNGQwLmihd7fBOBLB
"tag:google.com,2013:googlealerts/feed:13253186362560841992",2024-06-08T22:48:57Z,2024-06-08T22:48:57Z,"More than 70% of UC, CCC students are not using accessible <b>food stamps</b>: study - KRON4","... <b>food stamps</b>. According to the study, 30% of community college students in California utilize their accessible <b>food stamps</b>, nearly a third more&nbsp;...",https://www.google.com/url?rct=j&sa=t&url=https://www.kron4.com/news/bay-area/more-than-70-of-uc-ccc-students-are-not-using-accessible-food-stamps-study/&ct=ga&cd=CAIyHDFlZTI2MTBhMjBkODFiZWQ6Y29tOmVuOlVTOlI&usg=AOvVaw2XxSFFZVefJxxPJQgs0Qpp
"tag:google.com,2013:googlealerts/feed:9587066582762356235",2024-06-08T22:46:57Z,2024-06-08T22:46:57Z,"Bulgaria holds another <b>snap</b> election, with more instability seen ahead | WTVB","Bulgaria holds another <b>snap</b> election, with more instability seen ahead. By Thomson Reuters Jun 8, 2024 | 6:40 PM. By Stoyan Nenov. SOFIA (Reuters)&nbsp;...",https://www.google.com/url?rct=j&sa=t&url=https://wtvbam.com/2024/06/08/bulgaria-holds-another-snap-election-with-more-instability-seen-ahead/&ct=ga&cd=CAIyHDFlZTI2MTBhMjBkODFiZWQ6Y29tOmVuOlVTOlI&usg=AOvVaw0lOpxgNn6uAQzef8e9n5YA
"tag:google.com,2013:googlealerts/feed:17765328610559306776",2024-06-08T22:17:02Z,2024-06-08T22:17:02Z,Serious Warning to Millions of U.S. Citizens Who Receive <b>SNAP Benefits</b> - La Grada,There have recently been a lot of issues surrounding the <b>Supplemental Nutrition Assistance Program</b> (<b>SNAP) benefits</b> in Illinois.,https://www.google.com/url?rct=j&sa=t&url=https://lagradaonline.com/en/serious-warning-millions-us-citizens-snap/&ct=ga&cd=CAIyHDFlZTI2MTBhMjBkODFiZWQ6Y29tOmVuOlVTOlI&usg=AOvVaw0XFxaNGne-nnDRUOgxcDMw
"tag:google.com,2013:googlealerts/feed:15474102258507009957",2024-06-08T22:03:22Z,2024-06-08T22:03:22Z,"Ionescu, Jones lead way as Liberty <b>snap</b> Sun&#39;s undefeated run | theScore.com","Ionescu, Jones lead way as Liberty <b>snap</b> Sun&#39;s undefeated run ... UNCASVILLE, Conn. (AP) — Sabrina Ionescu scored 24 points, Jonquel Jones added 22 and&nbsp;...",https://www.google.com/url?rct=j&sa=t&url=https://www.thescore.com/wnba/news/2924249&ct=ga&cd=CAIyHDFlZTI2MTBhMjBkODFiZWQ6Y29tOmVuOlVTOlI&usg=AOvVaw2lvBsE_LKBGjF-DHdihUgY
"tag:google.com,2013:googlealerts/feed:12451012959799456104",2024-06-08T19:57:30Z,2024-06-08T19:57:30Z,"SPARKS: Brink records first career double-double, helps <b>snap</b> LA&#39;s 3-game losing skid","SPARKS: Brink records first career double-double, helps <b>snap</b> LA&#39;s 3-game losing skid. The Sparks matched Dallas&#39; physicality, led by a strong&nbsp;...",https://www.google.com/url?rct=j&sa=t&url=https://www.uscannenbergmedia.com/2024/06/08/sparks-brink-records-first-career-double-double-helps-snap-las-3-game-losing-skid/&ct=ga&cd=CAIyHDFlZTI2MTBhMjBkODFiZWQ6Y29tOmVuOlVTOlI&usg=AOvVaw3jhlLaT9TEXbOSo-wY3e4i
"tag:google.com,2013:googlealerts/feed:7801321112096627776",2024-06-08T19:38:57Z,2024-06-08T19:38:57Z,Nikes <b>snap</b> Hounds 3-game streak - Pen City Current,"Nikes <b>snap</b> Hounds 3-game streak. No. 1 Nikes score five in seventh for 6-0 win. Posted Saturday, June 8, 2024 2:32 pm. PCC Staff. FORT MADISON – The&nbsp;...","https://www.google.com/url?rct=j&sa=t&url=https://www.pencitycurrent.com/stories/nikes-snap-hounds-3-game-streak,89773&ct=ga&cd=CAIyHDFlZTI2MTBhMjBkODFiZWQ6Y29tOmVuOlVTOlI&usg=AOvVaw2Xuc1WFc0pF-fiKJALiIKI"
"tag:google.com,2013:googlealerts/feed:6570219190853394969",2024-06-08T19:17:15Z,2024-06-08T19:17:15Z,FSIS Issues Public Health Alert for Frozen Ready-To-Eat Bao Curry Chicken Products Due ...,Consumers with food safety questions can call the toll-free <b>USDA</b> Meat and Poultry Hotline at 888-MPHotline (888-674-6854) or send a question via email&nbsp;...,https://www.google.com/url?rct=j&sa=t&url=https://www.fsis.usda.gov/recalls-alerts/fsis-issues-public-health-alert-frozen-ready-eat-bao-curry-chicken-products-due&ct=ga&cd=CAIyHDFlZTI2MTBhMjBkODFiZWQ6Y29tOmVuOlVTOlI&usg=AOvVaw1VD6QgLyrWS4Z-lnDwy_Mv
"tag:google.com,2013:googlealerts/feed:9512621974144435380",2024-06-08T18:17:13Z,2024-06-08T18:17:13Z,Recipients of <b>SNAP benefits</b> are falling victim to rampant EBT card skimming schemes,"... <b>USDA</b>. By Joy ... <b>Supplemental Nutrition Assistance Program</b> (<b>SNAP) benefits</b>, typically during checkout. ... about <b>food stamps</b>: &quot;They&#39;re such cowards&quot;: GOP&nbsp;...",https://www.google.com/url?rct=j&sa=t&url=https://www.salon.com/2024/06/08/recipients-of-snap-benefits-are-falling-victim-to-rampant-ebt-card-skimming-schemes/&ct=ga&cd=CAIyHDFlZTI2MTBhMjBkODFiZWQ6Y29tOmVuOlVTOlI&usg=AOvVaw2zFtQJJRMXvWo4SyN9q9n8
"tag:google.com,2013:googlealerts/feed:16051453681954493751",2024-06-08T17:58:18Z,2024-06-08T17:58:18Z,"<b>Supplemental Nutrition Assistance Program</b> (<b>SNAP</b>) | Lucas County, OH - Official Website",The <b>Supplemental Nutrition Assistance Program</b> (<b>SNAP</b>) helps buy food for your family. ... <b>USDA</b> through the Federal Relay Service at (800) 877-8339. To&nbsp;...,https://www.google.com/url?rct=j&sa=t&url=https://co.lucas.oh.us/905/Supplemental-Nutrition-Assistance-Progra&ct=ga&cd=CAIyHDFlZTI2MTBhMjBkODFiZWQ6Y29tOmVuOlVTOlI&usg=AOvVaw3foJmiRMdC3Lm1tC_PqK_i
"tag:google.com,2013:googlealerts/feed:2693384669113334444",2024-06-08T17:51:35Z,2024-06-08T17:51:35Z,White Sox <b>snap</b> franchise-record 14-game losing streak with win over Red Sox - The Athletic,"White Sox <b>snap</b> franchise-record 14-game losing streak with win over Red Sox. Jun 7, 2024; Chicago, Illinois, USA; Chicago White Sox first base. By&nbsp;...",https://www.google.com/url?rct=j&sa=t&url=https://www.nytimes.com/athletic/5550074/2024/06/08/white-sox-snap-losing-streak/&ct=ga&cd=CAIyHDFlZTI2MTBhMjBkODFiZWQ6Y29tOmVuOlVTOlI&usg=AOvVaw0QvmR4JLoVPbhU1nsNKZ-y
"tag:google.com,2013:googlealerts/feed:18416911263338869938",2024-06-08T17:38:12Z,2024-06-08T17:38:12Z,New Era 9FIFTY Stretch <b>Snap</b> 46 Trucker Cap - VR46 - Shop,"Trucker 9FIFTY Stretch <b>Snap</b> cap belonging to the exclusive collaboration between VR46 and New Era. The cap, made of polyester, features the number&nbsp;...",https://www.google.com/url?rct=j&sa=t&url=https://vr46.com/en-us/products/new-era-9fifty-stretch-snap-46-trucker-cap-lvmca445202&ct=ga&cd=CAIyHDFlZTI2MTBhMjBkODFiZWQ6Y29tOmVuOlVTOlI&usg=AOvVaw0MW64RLoTVJv2lGa6BEFqp
"tag:google.com,2013:googlealerts/feed:7357360527662013943",2024-06-08T17:04:07Z,2024-06-08T17:04:07Z,"<b>Snap</b> One Employee Directory, Headcount &amp; Staff | LeadIQ","Established in 2005 and based in Charlotte, North Carolina, <b>Snap</b> One is a manufacturer and exclusive source of A/V, security, control, networking, and&nbsp;...",https://www.google.com/url?rct=j&sa=t&url=https://leadiq.com/c/snap-one/60dc6a48b27cefd863fcde64/employee-directory%3Fpage%3D6&ct=ga&cd=CAIyHDFlZTI2MTBhMjBkODFiZWQ6Y29tOmVuOlVTOlI&usg=AOvVaw2NDKECetPZ2oI4fs2UsCEq
"tag:google.com,2013:googlealerts/feed:7344128122207674289",2024-06-08T16:52:26Z,2024-06-08T16:52:26Z,White Sox slam Red Sox to <b>snap</b> franchise-worst 14-game skid - ABC7 Chicago,White Sox slam Red Sox to <b>snap</b> franchise-worst 14-game skid &middot; Garrett Crochet struck out 10 in six innings as Chicago posted its first win since a 5-0&nbsp;...,https://www.google.com/url?rct=j&sa=t&url=https://abc7chicago.com/sports/white-sox-slam-red-sox-to-snap-franchise-worst-14-game-skid/14924256/&ct=ga&cd=CAIyHDFlZTI2MTBhMjBkODFiZWQ6Y29tOmVuOlVTOlI&usg=AOvVaw3xlDOikiku764tBAOuH75_
"tag:google.com,2013:googlealerts/feed:5270994807347501232",2024-06-08T16:32:28Z,2024-06-08T16:32:28Z,How do I get a refund for a <b>Snap</b> I paid to promote in-app? - Snapchat Support,"How do I get a refund for a <b>Snap</b> I paid to promote in-app? If you made the purchase on iOS, please visit the App Store for iOS to learn how to&nbsp;...",https://www.google.com/url?rct=j&sa=t&url=https://help.snapchat.com/hc/et/articles/25312226181140-How-do-I-get-a-refund-for-a-Snap-I-paid-to-promote-in-app&ct=ga&cd=CAIyHDFlZTI2MTBhMjBkODFiZWQ6Y29tOmVuOlVTOlI&usg=AOvVaw0ZMXlpsP5nfXAy_AEyG5xp
"tag:google.com,2013:googlealerts/feed:6048143162993505784",2024-06-08T16:30:39Z,2024-06-08T16:30:39Z,Remaining June Schedule for <b>SNAP Food Stamps</b> Payments - Tododisca,"After the payments already sent from <b>SNAP Food Stamps</b>, some States can still send this money to the EBT card.",https://www.google.com/url?rct=j&sa=t&url=https://www.tododisca.com/en/remain-june-schedule-snap-food-stamps-payment/&ct=ga&cd=CAIyHDFlZTI2MTBhMjBkODFiZWQ6Y29tOmVuOlVTOlI&usg=AOvVaw1BXXxL4nsHJuxe7dVspGzm
"tag:google.com,2013:googlealerts/feed:6004170515997464842",2024-06-08T16:25:09Z,2024-06-08T16:25:09Z,<b>SNAP</b> Warnings Issued As Scams Reported - Newsweek,"Reports of scams targeting <b>Supplemental Nutrition Assistance Program</b> (<b>SNAP) benefits</b> have surged across the U.S., sparking concern among recipients&nbsp;...",https://www.google.com/url?rct=j&sa=t&url=https://www.newsweek.com/snap-warnings-issued-scams-reported-1910023&ct=ga&cd=CAIyHDFlZTI2MTBhMjBkODFiZWQ6Y29tOmVuOlVTOlI&usg=AOvVaw2An7VrwDeVTQr7Vgnr80ZB
"tag:google.com,2013:googlealerts/feed:10739072834019329032",2024-06-08T16:16:40Z,2024-06-08T16:16:40Z,HELP! How do I change <b>snap</b> dimension show to actual dimension? Please refer to image provided.,How to correct what shows in <b>snap</b> shows 28.984 when the actual length is 0.9 m. I want that <b>snap</b> dimension shows 0.9 directly instead of 28.984.,https://www.google.com/url?rct=j&sa=t&url=https://forums.autodesk.com/t5/autocad-forum/help-how-do-i-change-snap-dimension-show-to-actual-dimension/m-p/12827170&ct=ga&cd=CAIyHDFlZTI2MTBhMjBkODFiZWQ6Y29tOmVuOlVTOlI&usg=AOvVaw17M6IQEvTTmWRinUN8kSBU
"tag:google.com,2013:googlealerts/feed:8027386044436342125",2024-06-09T22:44:34Z,2024-06-09T22:44:34Z,"France&#39;s <b>snap</b> election: what happened, why, and what&#39;s next? - The Guardian","France&#39;s <b>snap</b> election: what happened, why, and what&#39;s next? In a shock move, president Emmanuel Macron called a parliamentary election&nbsp;...",https://www.google.com/url?rct=j&sa=t&url=https://www.theguardian.com/world/article/2024/jun/09/frances-snap-election-what-happened-why-and-whats-next&ct=ga&cd=CAIyHDFlZTI2MTBhMjBkODFiZWQ6Y29tOmVuOlVTOlI&usg=AOvVaw0FPa6oIBftx9hLHku8lLEB
"tag:google.com,2013:googlealerts/feed:13624822287409899885",2024-06-09T22:25:36Z,2024-06-09T22:25:36Z,"Following party defeat, French President Macron calls for <b>snap</b> elections - UPI.com",French President Emanuel Macron Sunday called a <b>snap</b> election after his own party suffered a big defeat in elections for the European Parliament&nbsp;...,https://www.google.com/url?rct=j&sa=t&url=https://www.upi.com/Top_News/World-News/2024/06/09/fr-party-defeat-prompts-macron-to-call-snap-elections/3871717971213/&ct=ga&cd=CAIyHDFlZTI2MTBhMjBkODFiZWQ6Y29tOmVuOlVTOlI&usg=AOvVaw2d2sLlVvXRswB32UDOue_F
"tag:google.com,2013:googlealerts/feed:15703502239524725316",2024-06-09T22:23:26Z,2024-06-09T22:23:26Z,Explainer-What&#39;s at Stake in Macron&#39;s Shock <b>Snap</b> Election Call? - USNews.com,"Explainer-What&#39;s at Stake in Macron&#39;s Shock <b>Snap</b> Election Call? By Reuters. |. June 9, 2024.",https://www.google.com/url?rct=j&sa=t&url=https://www.usnews.com/news/world/articles/2024-06-09/explainer-whats-at-stake-in-macrons-shock-snap-election-call&ct=ga&cd=CAIyHDFlZTI2MTBhMjBkODFiZWQ6Y29tOmVuOlVTOlI&usg=AOvVaw2Slxe3kPc4D6ffZVk__fRP
"tag:google.com,2013:googlealerts/feed:2625132012914109487",2024-06-09T22:21:08Z,2024-06-09T22:21:08Z,Explainer: What&#39;s at stake in Macron&#39;s shock <b>snap</b> election call? | Reuters,"Following &middot; Saved &middot; Europe. Explainer: What&#39;s at stake in Macron&#39;s shock <b>snap</b> election call? By Michel Rose. June 9, 20243:07 PM PDTUpdated a day ago.",https://www.google.com/url?rct=j&sa=t&url=https://www.reuters.com/world/europe/whats-stake-macrons-shock-snap-election-call-2024-06-09/&ct=ga&cd=CAIyHDFlZTI2MTBhMjBkODFiZWQ6Y29tOmVuOlVTOlI&usg=AOvVaw3S77gLTZT8lhUkls3pfcRD
"tag:google.com,2013:googlealerts/feed:16933801487302848936",2024-06-09T22:10:21Z,2024-06-09T22:10:21Z,Chris Bryant on X: &quot;How come France can actually make a <b>snap</b> election snappy whereas ...,How come France can actually make a <b>snap</b> election snappy whereas ours go on for an eternity?,https://www.google.com/url?rct=j&sa=t&url=https://twitter.com/RhonddaBryant/status/1799906535293730821&ct=ga&cd=CAIyHDFlZTI2MTBhMjBkODFiZWQ6Y29tOmVuOlVTOlI&usg=AOvVaw0U2zbDBp7HptZzDRqEA4PH
"tag:google.com,2013:googlealerts/feed:11820122586352345297",2024-06-09T22:07:05Z,2024-06-09T22:07:05Z,Macron dissolves the French parliament and calls a <b>snap</b> election after defeat in EU vote,France&#39;s Macron Calls <b>Snap</b> Election After Far-Right Win in EU Vote. 25m ago. AFP. Macron gambles on <b>snap</b> elections to halt far-right march. 27m ago.,https://www.google.com/url?rct=j&sa=t&url=https://www.yahoo.com/news/first-french-projections-put-hard-181145303.html&ct=ga&cd=CAIyHDFlZTI2MTBhMjBkODFiZWQ6Y29tOmVuOlVTOlI&usg=AOvVaw1c6kATXXfBqSC-V0DAqv46
"tag:google.com,2013:googlealerts/feed:12384341008059507424",2024-06-09T21:54:07Z,2024-06-09T21:54:07Z,France&#39;s Emmanuel Macron Calls <b>Snap</b> Election After Far-Right Victory in EU Vote,"The <b>snap</b> election will take place on June 30, with a run-off round set for July 7. Macron&#39;s presidential term expires in 2027, and he is not&nbsp;...",https://www.google.com/url?rct=j&sa=t&url=https://www.thedailybeast.com/frances-emmanuel-macron-calls-snap-election-after-far-right-victory-in-eu-vote&ct=ga&cd=CAIyHDFlZTI2MTBhMjBkODFiZWQ6Y29tOmVuOlVTOlI&usg=AOvVaw0_e7QtMev7lTnvLWS0qG7b
"tag:google.com,2013:googlealerts/feed:7254581305454327611",2024-06-09T21:41:46Z,2024-06-09T21:41:46Z,European parliament elections prompt France&#39;s Macron to call <b>snap</b> vote - Semafor,"In France, President Emmanuel Macron&#39;s party felt this acutely: Macron dissolved parliament and called a <b>snap</b> election after the far-right&nbsp;...",https://www.google.com/url?rct=j&sa=t&url=https://www.semafor.com/article/06/09/2024/european-parliament-elections-results-2024-france-snap-vote&ct=ga&cd=CAIyHDFlZTI2MTBhMjBkODFiZWQ6Y29tOmVuOlVTOlI&usg=AOvVaw2m47FQbBgT2lBemm_fB1Y9
"tag:google.com,2013:googlealerts/feed:2545406130605623921",2024-06-09T21:36:18Z,2024-06-09T21:36:18Z,Why Macron&#39;s calls for <b>snap</b> election may be a &#39;big gamble&#39; - YouTube,French President Emmanuel Macron has dissolved his country&#39;s parliament and called <b>snap</b> elections after an EU exit poll showed a historic surge&nbsp;...,https://www.google.com/url?rct=j&sa=t&url=https://www.youtube.com/watch%3Fv%3Dz3VUenT8IEw&ct=ga&cd=CAIyHDFlZTI2MTBhMjBkODFiZWQ6Y29tOmVuOlVTOlI&usg=AOvVaw3LeiGOCIpxiZ0JQsc3HLGv
"tag:google.com,2013:googlealerts/feed:9127820148276425684",2024-06-09T21:21:45Z,2024-06-09T21:21:45Z,France&#39;s Macron Calls <b>Snap</b> Elections as Far Right Surges in European Elections - Haaretz,France&#39;s Macron Calls <b>Snap</b> Elections as Far Right Surges in European Elections. A first projection provided by the EU suggests far-right parties&nbsp;...,https://www.google.com/url?rct=j&sa=t&url=https://www.haaretz.com/world-news/europe/2024-06-09/ty-article/frances-macron-calls-snap-elections-as-far-right-surges-in-european-elections/0000018f-fe85-de5e-a5ef-ff8742940000&ct=ga&cd=CAIyHDFlZTI2MTBhMjBkODFiZWQ6Y29tOmVuOlVTOlI&usg=AOvVaw2OusmYBbP-H1qTBpeKMvoz
"tag:google.com,2013:googlealerts/feed:12287160420743213270",2024-06-09T21:18:59Z,2024-06-09T21:18:59Z,Macron calls <b>snap</b> election after far-right victory in EU vote - The Irish Times,President Emmanuel Macron stunned France on Sunday when he called <b>snap</b> parliamentary elections after his centrist alliance was trounced by Marine&nbsp;...,https://www.google.com/url?rct=j&sa=t&url=https://www.irishtimes.com/politics/2024/06/09/far-right-le-pen-delivers-blow-to-macron-alliance-in-eu-vote/&ct=ga&cd=CAIyHDFlZTI2MTBhMjBkODFiZWQ6Y29tOmVuOlVTOlI&usg=AOvVaw2pU4wjnXzIjjLbjDx9X5de
"tag:google.com,2013:googlealerts/feed:9490575478550015568",2024-06-09T21:12:58Z,2024-06-09T21:12:58Z,France&#39;s Macron calls for <b>snap</b> election after losing big to the far right in EU vote - CNBC,“Whether today&#39;s French result and likely gains at the <b>snap</b> parliamentary election may put Le Pen on course to become president eventually is a very&nbsp;...,https://www.google.com/url?rct=j&sa=t&url=https://www.cnbc.com/2024/06/09/french-president-macron-calls-for-snap-election-after-heavy-defeat-in-eu-vote-.html&ct=ga&cd=CAIyHDFlZTI2MTBhMjBkODFiZWQ6Y29tOmVuOlVTOlI&usg=AOvVaw2XmqDjaGpB2LtL7Rhd4PE2
"tag:google.com,2013:googlealerts/feed:4266208977021621746",2024-06-09T21:00:39Z,2024-06-09T21:00:39Z,French President Emmanuel Macron announces <b>snap</b> elections after stinging EU elections defeat,"The next ones should therefore have been held in mid-2027. The <b>snap</b> elections are a massive gmable for Macron, who lost his absolute majority in the&nbsp;...",https://www.google.com/url?rct=j&sa=t&url=https://www.euronews.com/my-europe/2024/06/09/french-president-emmanuel-macron-announces-anticipated-elections-after-stinging-eu-electio&ct=ga&cd=CAIyHDFlZTI2MTBhMjBkODFiZWQ6Y29tOmVuOlVTOlI&usg=AOvVaw16X1K3rMbl6228kYjNbRtK
"tag:google.com,2013:googlealerts/feed:9514981171678005847",2024-06-09T21:00:19Z,2024-06-09T21:00:19Z,"Macron dissolves French parliament, calls <b>snap</b> elections after far-right wins EU vote","PARIS, France — French President Emmanuel Macron announced Sunday he was dissolving parliament and calling <b>snap</b> legislative elections after the&nbsp;...",https://www.google.com/url?rct=j&sa=t&url=https://www.timesofisrael.com/macron-dissolves-french-parliament-calls-snap-elections-after-far-right-wins-eu-vote/&ct=ga&cd=CAIyHDFlZTI2MTBhMjBkODFiZWQ6Y29tOmVuOlVTOlI&usg=AOvVaw0CDKsLoctp1jiFjaz-rjKj
"tag:google.com,2013:googlealerts/feed:63685983411887664",2024-06-09T20:54:57Z,2024-06-09T20:54:57Z,Emmanuel Macron Calls <b>Snap</b> Election After Far-Right Gains In Euro Vote - Deadline,French President Emmanuel Macron left his country reeling on Sunday after he dissolved parliament and called <b>snap</b> general elections in response to&nbsp;...,https://www.google.com/url?rct=j&sa=t&url=https://deadline.com/2024/06/frances-president-emmanuel-macron-shock-snap-election-after-far-right-victory-european-vote-1235966441/&ct=ga&cd=CAIyHDFlZTI2MTBhMjBkODFiZWQ6Y29tOmVuOlVTOlI&usg=AOvVaw3lNZ_Gxq7gsbVApiyxMaqz
"tag:google.com,2013:googlealerts/feed:8663925072778770380",2024-06-09T20:53:49Z,2024-06-09T20:53:49Z,France&#39;s Macron calls shock <b>snap</b> elections - AOL.com,LONDON (Reuters) -French President Emmanuel Macron on Sunday called a <b>snap</b> election after he was trounced in European elections by Marine Le Pen&#39;s&nbsp;...,https://www.google.com/url?rct=j&sa=t&url=https://www.aol.com/news/frances-macron-calls-shock-snap-201307298.html&ct=ga&cd=CAIyHDFlZTI2MTBhMjBkODFiZWQ6Y29tOmVuOlVTOlI&usg=AOvVaw2npKzb7-ZBC6ur7vWDRx_1
"tag:google.com,2013:googlealerts/feed:12302839159577817697",2024-06-09T20:52:59Z,2024-06-09T20:52:59Z,President Emmanuel Macron dissolves French National Assembly and calls <b>snap</b> election,... <b>snap</b>-election-13150407 #emmanuelmacron #france #election #skynews SUBSCRIBE to our YouTube channel for more videos: http://www.youtube.com/skynews&nbsp;...,https://www.google.com/url?rct=j&sa=t&url=https://www.youtube.com/watch%3Fv%3D6xtvil_5u-s&ct=ga&cd=CAIyHDFlZTI2MTBhMjBkODFiZWQ6Y29tOmVuOlVTOlI&usg=AOvVaw3WgsSN8EuIxJUVq6PAJIUq
"tag:google.com,2013:googlealerts/feed:1366940614826179331",2024-06-09T20:38:24Z,2024-06-09T20:38:24Z,Macron dissolves the French parliament and calls a <b>snap</b> election after defeat in EU vote,Macron dissolves the French parliament and calls a <b>snap</b> election after defeat in EU vote ... PARIS (AP) — French President Emmanuel Macron has decided&nbsp;...,https://www.google.com/url?rct=j&sa=t&url=https://kesq.com/news/2024/06/09/macron-dissolves-the-french-parliament-and-calls-a-snap-election-after-defeat-in-eu-vote/&ct=ga&cd=CAIyHDFlZTI2MTBhMjBkODFiZWQ6Y29tOmVuOlVTOlI&usg=AOvVaw3kn2eJzb9ooJUJXXVw3ugp
"tag:google.com,2013:googlealerts/feed:3826002480032738476",2024-06-09T20:19:52Z,2024-06-09T20:19:52Z,"Marine Le Pen Set for Record Win, Macron Calls <b>Snap</b> French Election - MishTalk",French President Emmanuel Macron called a <b>snap</b> legislative election after the far right pummeled mainstream parties in France as well as Germany in a&nbsp;...,https://www.google.com/url?rct=j&sa=t&url=https://mishtalk.com/economics/marine-le-pen-set-for-record-win-macron-calls-snap-french-election/&ct=ga&cd=CAIyHDFlZTI2MTBhMjBkODFiZWQ6Y29tOmVuOlVTOlI&usg=AOvVaw1b4gfQ5dla5tsZrX4XI7O1
"tag:google.com,2013:googlealerts/feed:10540496041104697151",2024-06-10T13:58:01Z,2024-06-10T13:58:01Z,France&#39;s Macron calls election his far-right rival Le Pen could win - CNBC,French President Emmanuel Macron&#39;s decision to call a <b>snap</b> national election after a surge for his far-right rivals is a high-stakes move and a huge&nbsp;...,https://www.google.com/url?rct=j&sa=t&url=https://www.cnbc.com/2024/06/10/frances-macron-calls-election-his-far-right-rival-le-pen-could-win.html&ct=ga&cd=CAIyHDFlZTI2MTBhMjBkODFiZWQ6Y29tOmVuOlVTOlI&usg=AOvVaw0_kSwDIg_2Nf1JSpHyeFqw
"tag:google.com,2013:googlealerts/feed:2033729972806996548",2024-06-10T13:44:21Z,2024-06-10T13:44:21Z,Macron calls shocking <b>snap</b> election in France; AI models compete in pageant - NPR,French President Macron calls for a <b>snap</b> election after defeat in EU vote. AI models are competing in the inaugural Miss AI pageant.,https://www.google.com/url?rct=j&sa=t&url=https://www.npr.org/2024/06/10/g-s1-3687/up-first-newsletter-macron-election-parliament-miss-ai-pageant&ct=ga&cd=CAIyHDFlZTI2MTBhMjBkODFiZWQ6Y29tOmVuOlVTOlI&usg=AOvVaw1JlIg44H_RcFOKOWxWzC_M
"tag:google.com,2013:googlealerts/feed:5895240194874191347",2024-06-10T13:36:37Z,2024-06-10T13:36:37Z,Euro hit by shock Macron call for <b>snap</b> election | REUTERS - YouTube,"French President Emmanuel Macron&#39;s call for a <b>snap</b> parliamentary election caused the euro to stumble, while French bonds and stocks took a hard&nbsp;...",https://www.google.com/url?rct=j&sa=t&url=https://www.youtube.com/watch%3Fv%3DHVJWF08Z7Ak&ct=ga&cd=CAIyHDFlZTI2MTBhMjBkODFiZWQ6Y29tOmVuOlVTOlI&usg=AOvVaw01xPfqD_wkWkF9Jb19Q6xl
