id,time,accessdate,title,description,link
"tag:google.com,2013:googlealerts/feed:14141654522471433966",2024-06-14T23:56:09Z,2024-06-14T23:56:09Z,Thousands of New Yorkers targeted in <b>SNAP</b> card-skimming scam. This simple upgrade ...,"NEW YORK -- A card-skimming scam has targeted tens of thousands of New Yorkers who use <b>SNAP</b>, or the <b>Supplemental Nutrition Assistance Program</b>. CBS&nbsp;...",https://www.google.com/url?rct=j&sa=t&url=https://www.cbsnews.com/newyork/news/snap-card-skimming-scam-nyc/&ct=ga&cd=CAIyHDFlZTI2MTBhMjBkODFiZWQ6Y29tOmVuOlVTOlI&usg=AOvVaw0oBixpEnON1Q3WYoBcHrcT
"tag:google.com,2013:googlealerts/feed:5516840119532006492",2024-06-14T21:02:44Z,2024-06-14T21:02:44Z,New Season of MARVEL <b>SNAP</b> Introduces the Eternals - CBR,"According to the official Marvel <b>SNAP</b> website, the galactic superheroes by comic book legend Jack Kirby are coming to the digital card game. Players&nbsp;...",https://www.google.com/url?rct=j&sa=t&url=https://www.cbr.com/marvel-snap-eternals-new-season/&ct=ga&cd=CAIyHDFlZTI2MTBhMjBkODFiZWQ6Y29tOmVuOlVTOlI&usg=AOvVaw02UGMgaAymPuECp-sUYe1G
"tag:google.com,2013:googlealerts/feed:7962372786978332608",2024-06-14T20:51:55Z,2024-06-14T20:51:55Z,Archdiocese responds as <b>SNAP</b> members allege names of credibly accused priests not disclosed,The Archdiocese of St. Paul and Minneapolis is responding as <b>SNAP</b> — or Survivors of those Abused by Priests — seeks to add the names of five&nbsp;...,https://www.google.com/url?rct=j&sa=t&url=https://thecatholicspirit.com/news/local-news/archdiocese-responds-as-snap-members-allege-names-of-credibly-accused-priests-not-disclosed/&ct=ga&cd=CAIyHDFlZTI2MTBhMjBkODFiZWQ6Y29tOmVuOlVTOlI&usg=AOvVaw3HE9WNkhK1FKX3uV9rzFe6
"tag:google.com,2013:googlealerts/feed:5667501248259472912",2024-06-14T20:42:53Z,2024-06-14T20:42:53Z,<b>USDA</b> aids Landus in opening new fertilizer production facility,"The facility, which costs nearly $15 million, will produce sustainable, slow-release fertilizer products to bring environmentally and economically&nbsp;...",https://www.google.com/url?rct=j&sa=t&url=https://iowaagribusinessradionetwork.com/usda-aids-landus-in-opening-new-fertilizer-production-facility/&ct=ga&cd=CAIyHDFlZTI2MTBhMjBkODFiZWQ6Y29tOmVuOlVTOlI&usg=AOvVaw0HF3bxZFciCz6eZojJmX_W
"tag:google.com,2013:googlealerts/feed:702421416383108613",2024-06-14T20:42:49Z,2024-06-14T20:42:49Z,"Farms win <b>USDA</b> grants to help hire, retain workers | Agri-Pulse Communications, Inc.","<b>USDA</b> is awarding $50 million to farms, ranches, labor contractors and other entities to hire and retain farmworkers, including by encouraging the&nbsp;...",https://www.google.com/url?rct=j&sa=t&url=https://www.agri-pulse.com/articles/21247-farms-win-usda-grants-to-help-hire-retain-workers&ct=ga&cd=CAIyHDFlZTI2MTBhMjBkODFiZWQ6Y29tOmVuOlVTOlI&usg=AOvVaw0Kajhva_2kcgDEFvPQmYnd
"tag:google.com,2013:googlealerts/feed:10600834525934296270",2024-06-14T20:39:09Z,2024-06-14T20:39:09Z,Two more bird flu cases detected in Northwest Iowa dairy herds - KCRG,The United States&nbsp;...,https://www.google.com/url?rct=j&sa=t&url=https://www.kcrg.com/2024/06/14/two-more-bird-flu-cases-detected-northwest-iowa-dairy-herds/&ct=ga&cd=CAIyHDFlZTI2MTBhMjBkODFiZWQ6Y29tOmVuOlVTOlI&usg=AOvVaw2mwny3271qQCb_NwdFKD_e
"tag:google.com,2013:googlealerts/feed:100688080386874238",2024-06-14T20:19:04Z,2024-06-14T20:19:04Z,Resideo Completes Acquisition of <b>Snap</b> One,"SCOTTSDALE, Ariz , June 14, 2024 /PRNewswire/ -- Resideo Technologies, Inc. ... Resideo will integrate <b>Snap</b> One into its ADI Global Distribution segment&nbsp;...",https://www.google.com/url?rct=j&sa=t&url=https://www.streetinsider.com/PRNewswire/Resideo%2BCompletes%2BAcquisition%2Bof%2BSnap%2BOne/23361009.html&ct=ga&cd=CAIyHDFlZTI2MTBhMjBkODFiZWQ6Y29tOmVuOlVTOlI&usg=AOvVaw0lHnNffQnk7nfAJf1BUSzr
"tag:google.com,2013:googlealerts/feed:5104530158457223957",2024-06-14T20:07:15Z,2024-06-14T20:07:15Z,Clearing intersections in a <b>snap</b> is a safety-first idea - Camarillo Acorn,"... <b>snap</b> of their fingers, can bring everything to a halt so they can get through swiftly and safely. Well, thanks to Miovision&#39;s Opticom system of&nbsp;...",https://www.google.com/url?rct=j&sa=t&url=https://www.thecamarilloacorn.com/articles/clearing-intersections-in-a-snap-is-a-safety-first-idea/&ct=ga&cd=CAIyHDFlZTI2MTBhMjBkODFiZWQ6Y29tOmVuOlVTOlI&usg=AOvVaw1aQI20ysF590FjpW1ffUdU
"tag:google.com,2013:googlealerts/feed:11079283034308455762",2024-06-14T20:03:08Z,2024-06-14T20:03:08Z,Forest Service Landscape Assessment of Restoration Projects Fellowship,"The <b>USDA</b> Forest Service mission is to sustain the health, diversity, and productivity of the Nation&#39;s forests and grasslands to meet the needs of&nbsp;...",https://www.google.com/url?rct=j&sa=t&url=https://jobs.rwfm.tamu.edu/view-job/%3Fid%3D95555&ct=ga&cd=CAIyHDFlZTI2MTBhMjBkODFiZWQ6Y29tOmVuOlVTOlI&usg=AOvVaw391XkJzByyW0jelU0y-rYJ
"tag:google.com,2013:googlealerts/feed:12271136624778763062",2024-06-14T20:00:25Z,2024-06-14T20:00:25Z,<b>USDA</b> Awards $50 Million to Support Farmworkers and Agricultural Employers,"PALISADE, Colo., June 14, 2024 – Agriculture Secretary Tom Vilsack announced today that the U.S. Department of Agriculture (<b>USDA</b>) is awarding $50&nbsp;...",https://www.google.com/url?rct=j&sa=t&url=https://www.usda.gov/media/press-releases/2024/06/14/usda-awards-50-million-support-farmworkers-and-agricultural&ct=ga&cd=CAIyHDFlZTI2MTBhMjBkODFiZWQ6Y29tOmVuOlVTOlI&usg=AOvVaw2R2YqGB8lEO1Fo1NagiDU2
"tag:google.com,2013:googlealerts/feed:8237749894686793061",2024-06-14T19:46:13Z,2024-06-14T19:46:13Z,<b>USDA</b> Announces Innovation Challenge | News Dakota,(NAFB.com) – The <b>USDA</b> and the Foundation for Food and Agriculture Research (FFAR) launched a global challenge to advance scientific research that&nbsp;...,https://www.google.com/url?rct=j&sa=t&url=https://www.newsdakota.com/2024/06/14/usda-announces-innovation-challenge/&ct=ga&cd=CAIyHDFlZTI2MTBhMjBkODFiZWQ6Y29tOmVuOlVTOlI&usg=AOvVaw3BEEJXUzpsEFNgunIm6Yz8
"tag:google.com,2013:googlealerts/feed:7548972372443528928",2024-06-14T19:45:54Z,2024-06-14T19:45:54Z,FLSP Awarded Grants | Agricultural Marketing Service - <b>USDA</b>,FLSP Awarded Grants. Breadcrumb. Home &middot; Services &middot; Grants &amp; Opportunities &middot; Farm Labor Stabilization and Protection Pilot Program; FLSP Awarded&nbsp;...,https://www.google.com/url?rct=j&sa=t&url=https://www.ams.usda.gov/services/grants/flsp/awards&ct=ga&cd=CAIyHDFlZTI2MTBhMjBkODFiZWQ6Y29tOmVuOlVTOlI&usg=AOvVaw3640K0CyM4vBMFq-yGxdVX
"tag:google.com,2013:googlealerts/feed:15905026407719793598",2024-06-14T19:43:11Z,2024-06-14T19:43:11Z,Welch introduces bicameral legislation to streamline <b>SNAP</b> recertification process,"... <b>SNAP</b> Recertification Reform Act, legislation that would give states and qualifying <b>Supplemental Nutrition Assistance Program</b> (<b>SNAP</b>) applicants the&nbsp;...",https://www.google.com/url?rct=j&sa=t&url=https://vermontbiz.com/news/2024/june/15/welch-introduces-bicameral-legislation-streamline-snap-recertification-process&ct=ga&cd=CAIyHDFlZTI2MTBhMjBkODFiZWQ6Y29tOmVuOlVTOlI&usg=AOvVaw3JOpp6uww9-xky8IaiSW5K
"tag:google.com,2013:googlealerts/feed:3244657239035641764",2024-06-14T19:40:57Z,2024-06-14T19:40:57Z,Pre-<b>Snap</b> Reads 6/14: More takeaways from Seahawks minicamp - Field Gulls,Seattle Seahawks News &middot; Pre-<b>Snap</b> Reads. Pre-<b>Snap</b> Reads 6/14: More takeaways from Seahawks&nbsp;...,https://www.google.com/url?rct=j&sa=t&url=https://www.fieldgulls.com/2024/6/14/24178285/pre-snap-reads-6-14-more-takeaways-from-seahawks-minicamp&ct=ga&cd=CAIyHDFlZTI2MTBhMjBkODFiZWQ6Y29tOmVuOlVTOlI&usg=AOvVaw0Eru5IVmmQhZ3jaQ8ssVFg
"tag:google.com,2013:googlealerts/feed:12879251350369948211",2024-06-14T19:27:26Z,2024-06-14T19:27:26Z,Resideo Completes Acquisition of <b>Snap</b> One,"Cision PR Newswire. Resideo Completes Acquisition of <b>Snap</b> One. (PRNewsfoto/Resideo Technologies, Inc.) News&nbsp;...",https://www.google.com/url?rct=j&sa=t&url=https://www.wate.com/business/press-releases/cision/20240614NY39715/resideo-completes-acquisition-of-snap-one&ct=ga&cd=CAIyHDFlZTI2MTBhMjBkODFiZWQ6Y29tOmVuOlVTOlI&usg=AOvVaw1WUSbbBOIwer9AQ4WcZEZQ
"tag:google.com,2013:googlealerts/feed:14665538728580788943",2024-06-14T19:23:12Z,2024-06-14T19:23:12Z,<b>Snap</b> One Announces Completion of Acquisition by Resideo | Markets Insider,"CHARLOTTE, N.C., June 14, 2024 (GLOBE NEWSWIRE) -- <b>Snap</b> One Holdings Corp. (the “Company” or “<b>Snap</b> One”) (Nasdaq: SNPO) is pleased to announce t.",https://www.google.com/url?rct=j&sa=t&url=https://markets.businessinsider.com/news/stocks/snap-one-announces-completion-of-acquisition-by-resideo-1033480193&ct=ga&cd=CAIyHDFlZTI2MTBhMjBkODFiZWQ6Y29tOmVuOlVTOlI&usg=AOvVaw3gXcI2SyHX_HyYs_CwOnl1
"tag:google.com,2013:googlealerts/feed:2509504739160364033",2024-06-14T19:07:04Z,2024-06-14T19:07:04Z,France ETF tumbles into 2024 losses as <b>snap</b> French election looms - MarketWatch,"Macron on Sunday called for a <b>snap</b> French legislative election after his party&#39;s “crushing defeat” in the European parliament, with voting&nbsp;...",https://www.google.com/url?rct=j&sa=t&url=https://www.marketwatch.com/livecoverage/stock-market-today-tech-rally-continues-while-dow-futures-struggle-after-adobe-beat/card/france-etf-tumbles-into-2024-losses-as-snap-french-election-looms-TbcSDXTHR7DGfsXNvZ9l&ct=ga&cd=CAIyHDFlZTI2MTBhMjBkODFiZWQ6Y29tOmVuOlVTOlI&usg=AOvVaw2x04KP_m_7Lbwg6t0kBarm
"tag:google.com,2013:googlealerts/feed:8712289358629693504",2024-06-14T18:56:07Z,2024-06-14T18:56:07Z,<b>USDA</b> Choice Beef Thin Sirloin Tip Steak - Wild Fork,"This thin sirloin tip steak is a very lean, boneless, thin-cut piece of beef that&#39;s perfect for s...Read more. Country of OriginUnited States&nbsp;...",https://www.google.com/url?rct=j&sa=t&url=https://www-prod.wildforkfoods.com/products/usda-choice-beef-thin-sirloin-tip-steak&ct=ga&cd=CAIyHDFlZTI2MTBhMjBkODFiZWQ6Y29tOmVuOlVTOlI&usg=AOvVaw2QEbUFl4sJRcZgSRtM47yn
"tag:google.com,2013:googlealerts/feed:8739617619706155288",2024-06-15T01:21:38Z,2024-06-15T01:21:38Z,Legal Information - Food Assistance(<b>Food Stamps</b>)- Disaster Relief | Iowa Legal Aid,Food Assistance (<b>Food Stamps</b>). Legal Information. Other Disaster Problems &middot; Legal Information &middot; Legal Aid Offices. 1 Resource(s) Found. Filter By:.,https://www.google.com/url?rct=j&sa=t&url=https://www.iowalegalaid.org/issues/disaster-relief/food-assistance-food-stamps%3Fchannel%3Dlegal%252Dinformation%26page%3D1%26lang%3DES%26format%3Dhtml&ct=ga&cd=CAIyHDFlZTI2MTBhMjBkODFiZWQ6Y29tOmVuOlVTOlI&usg=AOvVaw1VZCOxsB2Otsel4bEbgIA9
"tag:google.com,2013:googlealerts/feed:5138672488463878041",2024-06-15T00:43:24Z,2024-06-15T00:43:24Z,Very important update on the current status of <b>SNAP benefits</b> in the US - La Grada,"According to the US Department of Agriculture (<b>USDA</b>), the <b>SNAP</b> ... <b>Supplemental Nutrition Assistance Program</b> (<b>SNAP</b>). ... Although lawmakers from both&nbsp;...",https://www.google.com/url?rct=j&sa=t&url=https://lagradaonline.com/en/snap-benefits-update-us/&ct=ga&cd=CAIyHDFlZTI2MTBhMjBkODFiZWQ6Y29tOmVuOlVTOlI&usg=AOvVaw203RyvmfKgvE8YYH_n-ESY
"tag:google.com,2013:googlealerts/feed:827569094324472503",2024-06-14T23:59:16Z,2024-06-14T23:59:16Z,"Over 80,000 New Yorkers victimized in <b>SNAP</b> card-skimming scam - YouTube","Over 80,000 New Yorkers victimized in <b>SNAP</b> card-skimming scam. 89 views ... Common scam draining bank accounts and <b>SNAP benefits</b>. WFSB 3•5K views &middot; 2&nbsp;...",https://www.google.com/url?rct=j&sa=t&url=https://www.youtube.com/watch%3Fv%3DMoJpWn_BJo8&ct=ga&cd=CAIyHDFlZTI2MTBhMjBkODFiZWQ6Y29tOmVuOlVTOlI&usg=AOvVaw28NwgEOs_ggIDLRjyS4Lu8
"tag:google.com,2013:googlealerts/feed:6340468170466590951",2024-06-14T23:00:48Z,2024-06-14T23:00:48Z,Calories in <b>USDA</b> Choice Angus Beef Eye Of Round Steak by Aldi and Nutrition Facts,"There are 190 calories in serving of <b>USDA</b> Choice Angus Beef Eye Of Round Steak from: Carbs 0g, Fat 10g, Protein 24g. Get full nutrition facts.",https://www.google.com/url?rct=j&sa=t&url=https://www.mynetdiary.com/food/calories-in-usda-choice-angus-beef-eye-of-round-steak-by-aldi-gram-24551356-0.html&ct=ga&cd=CAIyHDFlZTI2MTBhMjBkODFiZWQ6Y29tOmVuOlVTOlI&usg=AOvVaw0RunNXMftPleCup7B76L4H
"tag:google.com,2013:googlealerts/feed:67224069800229912",2024-06-14T22:32:14Z,2024-06-14T22:32:14Z,"Search Results | Senate Committee On Agriculture, Nutrition &amp; Forestry",TXT. cost of crop insurance is down about 10 billion for the same reason And the cost of <b>food stamps</b> or <b>SNAP</b> is down by 84 billion over&nbsp;...,https://www.google.com/url?rct=j&sa=t&url=https://www.agriculture.senate.gov/search/%3Fq%3Dsnap%26page%3D%26pagenum_rs%3D12&ct=ga&cd=CAIyHDFlZTI2MTBhMjBkODFiZWQ6Y29tOmVuOlVTOlI&usg=AOvVaw3agtqsB7fU1uK8C5NKwOiO
"tag:google.com,2013:googlealerts/feed:1725718958146554751",2024-06-14T22:08:39Z,2024-06-14T22:08:39Z,Jessika Slack : <b>USDA</b> ARS,"ARS Home » Southeast Area » Oxford, Mississippi » Natural Products Utilization Research » People &amp; Locations » Jessika Slack&nbsp;...",https://www.google.com/url?rct=j&sa=t&url=https://www.ars.usda.gov/people-locations/person/%3Fperson-id%3D59795&ct=ga&cd=CAIyHDFlZTI2MTBhMjBkODFiZWQ6Y29tOmVuOlVTOlI&usg=AOvVaw3tAd6rxF3GsuJTfNufY1V0
"tag:google.com,2013:googlealerts/feed:574846043526469937",2024-06-14T21:57:31Z,2024-06-14T21:57:31Z,Dept. of Agriculture on X: &quot;.@growlocalSCG has used <b>USDA</b> 2501 Program grants to grow 17 ...,"growlocalSCG has used <b>USDA</b> 2501 Program grants to grow 17 community gardens, three urban farms, a community food forest and a test kitchen serving&nbsp;...",https://www.google.com/url?rct=j&sa=t&url=https://twitter.com/USDA/status/1801706172891992105&ct=ga&cd=CAIyHDFlZTI2MTBhMjBkODFiZWQ6Y29tOmVuOlVTOlI&usg=AOvVaw2KWqOQNW2ZzSvCKEGdLS9g
"tag:google.com,2013:googlealerts/feed:2481070418420751318",2024-06-14T21:42:41Z,2024-06-14T21:42:41Z,Harvest Snaps - Facebook,What&#39;s your favorite book and Harvest Snaps pairing? <b>SNAP</b> UP Harvest Snaps near you! https://happea.harvestsnaps.com/8vH79x #harvestsnaps...,https://www.google.com/url?rct=j&sa=t&url=https://m.facebook.com/HarvestSnaps/videos/whats-your-favorite-book-and-harvest-snaps-pairing-snap-up-harvest-snaps-near-yo/838700021516423/&ct=ga&cd=CAIyHDFlZTI2MTBhMjBkODFiZWQ6Y29tOmVuOlVTOlI&usg=AOvVaw2uQqD8N8Q5BAFbb1c5Si76
"tag:google.com,2013:googlealerts/feed:6553719747895220214",2024-06-14T21:13:38Z,2024-06-14T21:13:38Z,"<b>USDA</b> announces nearly $66 mullion for conservation work with states, tribes, private landowners","During a meeting of the Western Governors&#39; Association today, Deputy Secretary of Agriculture Xochitl Torres Small announced that <b>USDA</b> is&nbsp;...",https://www.google.com/url?rct=j&sa=t&url=https://www.lassennews.com/usda-announces-nearly-66-mullion-for-conservation-work-with-states-tribes-private-landowners&ct=ga&cd=CAIyHDFlZTI2MTBhMjBkODFiZWQ6Y29tOmVuOlVTOlI&usg=AOvVaw2mY74ZOJrZ4uRq79Tzi4UN
"tag:google.com,2013:googlealerts/feed:4507563533486661215",2024-06-14T20:54:08Z,2024-06-14T20:54:08Z,<b>Snap&#39;s</b> Tax Strategy for the Digital Economy - Fonoa,"In this webinar, you&#39;ll hear directly from Jon Locascio, Vice President of Tax at <b>Snap</b>, and Nicola Collins, Global Indirect Tax Lead at <b>Snap</b>. Learn&nbsp;...",https://www.google.com/url?rct=j&sa=t&url=https://www.fonoa.com/resources/webinars/customer-spotlight-snap-tax-strategy-for-the-digital-economy&ct=ga&cd=CAIyHDFlZTI2MTBhMjBkODFiZWQ6Y29tOmVuOlVTOlI&usg=AOvVaw0ZzX888j2ekLFRRBcO9bVZ
"tag:google.com,2013:googlealerts/feed:5816867350689689734",2024-06-14T20:52:57Z,2024-06-14T20:52:57Z,Feature request: Turn off Grid <b>snap</b> for select tools - Rhino for Windows - McNeel Forum,"It would really help a lot if some tools do not use Grid <b>snap</b> while the latter is active globally. for example, it&#39;s extremely disturbing that&nbsp;...",https://www.google.com/url?rct=j&sa=t&url=https://discourse.mcneel.com/t/feature-request-turn-off-grid-snap-for-select-tools/184576&ct=ga&cd=CAIyHDFlZTI2MTBhMjBkODFiZWQ6Y29tOmVuOlVTOlI&usg=AOvVaw0lfDwRlPfPAlasLTcqIuqf
"tag:google.com,2013:googlealerts/feed:1314650099611613390",2024-06-14T20:40:49Z,2024-06-14T20:40:49Z,16&quot; Long Flat Chisel - Snap-on Industrial,The anvil end on heads of <b>Snap</b>-on® punches and chisels are machined to a modified parabolic curve• This design directs the striking force to the&nbsp;...,https://www.google.com/url?rct=j&sa=t&url=https://b2b.snapon.com/productDetails/643788/2/884611&ct=ga&cd=CAIyHDFlZTI2MTBhMjBkODFiZWQ6Y29tOmVuOlVTOlI&usg=AOvVaw36w3rk6c4R-VizssTRuWTU
"tag:google.com,2013:googlealerts/feed:12213390113111787350",2024-06-15T08:22:30Z,2024-06-15T08:22:30Z,Allardt Elementary - Dining - Fentress County Schools,"In accordance with Federal Civil Rights law and U.S. Department of Agriculture (<b>USDA</b>) Civil Rights regulations and policies, the <b>USDA</b>,&nbsp;...",https://www.google.com/url?rct=j&sa=t&url=https://www.fentressboe.com/o/ale/dining&ct=ga&cd=CAIyHDFlZTI2MTBhMjBkODFiZWQ6Y29tOmVuOlVTOlI&usg=AOvVaw0OAGUJdA1HOKFTuwzJNlxC
"tag:google.com,2013:googlealerts/feed:1853491285332912517",2024-06-15T08:02:12Z,2024-06-15T08:02:12Z,<b>Snap</b> Crackle Pop - Fall Ball 21 Regular Season - Roster - # - Jason Burgdorf -,Fall Ball 22 &middot; C Division &middot; <b>Snap</b> Crackle Pop.,https://www.google.com/url?rct=j&sa=t&url=https://www.nolasoftball.org/roster_players/44309159%3Fsubseason%3D786366&ct=ga&cd=CAIyHDFlZTI2MTBhMjBkODFiZWQ6Y29tOmVuOlVTOlI&usg=AOvVaw0hDjs_Me84OPpSvegAg8hf
"tag:google.com,2013:googlealerts/feed:6734279408697778870",2024-06-15T08:01:22Z,2024-06-15T08:01:22Z,*<b>SNAP</b>*<b>SNAP</b>* - The Addams Family Musical Comedy is here! - News and Announcements -,*<b>SNAP</b>*<b>SNAP</b>* - The Addams Family Musical Comedy is here! MARCH 3-4 / MARCH 10-11 / 7:00 p.m.. Fairview Performing Arts Center / $15 adults; $12&nbsp;...,https://www.google.com/url?rct=j&sa=t&url=https://sleschool.org/apps/news/show_news.jsp%3FREC_ID%3D833624%26id%3D0&ct=ga&cd=CAIyHDFlZTI2MTBhMjBkODFiZWQ6Y29tOmVuOlVTOlI&usg=AOvVaw1KFmzIyYr93lEzbYTGR_0z
"tag:google.com,2013:googlealerts/feed:12280982534936603149",2024-06-15T07:15:07Z,2024-06-15T07:15:07Z,<b>SNAP benefits</b> now available at El Dorado farmers market - Butler County Times-Gazette,"<b>SNAP benefits</b> now available at El Dorado farmers market. June 14, 2024; News. Nikole Babbnbabb@cherryroad.com The summer is heating up and bursting&nbsp;...",https://www.google.com/url?rct=j&sa=t&url=https://www.butlercountytimesgazette.com/2024/06/snap-benefits-now-available-at-el-dorado-farmers-market/&ct=ga&cd=CAIyHDFlZTI2MTBhMjBkODFiZWQ6Y29tOmVuOlVTOlI&usg=AOvVaw3qKMFenGmNzhMLqP0tFeJx
"tag:google.com,2013:googlealerts/feed:11559619194027977071",2024-06-15T06:49:32Z,2024-06-15T06:49:32Z,Why do elevation views <b>snap</b> or lock or align horizontally but not vertically?,"Solved: When you are placing multiple elevations on a sheet, you can hover an elevation horizontally next to another one and it will <b>snap</b> into&nbsp;...",https://www.google.com/url?rct=j&sa=t&url=https://forums.autodesk.com/t5/revit-architecture-forum/why-do-elevation-views-snap-or-lock-or-align-horizontally-but/td-p/12838173&ct=ga&cd=CAIyHDFlZTI2MTBhMjBkODFiZWQ6Y29tOmVuOlVTOlI&usg=AOvVaw3ibunbuuqs3DWn1deMeBSb
"tag:google.com,2013:googlealerts/feed:6642292401516306667",2024-06-15T06:43:59Z,2024-06-15T06:43:59Z,Foresters <b>snap</b> 2-game slide as they bash the Blues | News Channel 3-12 - KEYT,"Foresters <b>snap</b> 2-game slide as they bash the Blues ... SANTA BARBARA, Calif. - The Foresters broke out of their offensive slumber with seven late runs&nbsp;...",https://www.google.com/url?rct=j&sa=t&url=https://keyt.com/sports/local-sports/2024/06/14/foresters-snap-2-game-slide-as-they-bash-the-blues/&ct=ga&cd=CAIyHDFlZTI2MTBhMjBkODFiZWQ6Y29tOmVuOlVTOlI&usg=AOvVaw3lKuOuToHW9rh1H8wdMyMa
"tag:google.com,2013:googlealerts/feed:10857663275378984049",2024-06-15T06:11:57Z,2024-06-15T06:11:57Z,"Wyoming boys finally <b>snap</b> skid, Montana girls roll in annual basketball series",Wyoming played like a team on a mission to <b>snap</b> what had been a difficult and exasperating losing skid. &quot;It&#39;s a streak. All these guys came in&nbsp;...,https://www.google.com/url?rct=j&sa=t&url=https://www.montanasports.com/high-school/montana-girls-trounce-wyoming-for-14th-straight-win-in-annual-basketball-series&ct=ga&cd=CAIyHDFlZTI2MTBhMjBkODFiZWQ6Y29tOmVuOlVTOlI&usg=AOvVaw0OwfxXlk4VuL0rSn-cxDar
"tag:google.com,2013:googlealerts/feed:16604503206325169937",2024-06-15T05:25:11Z,2024-06-15T05:25:11Z,<b>Supplemental Nutrition Assistance Program</b> (<b>SNAP</b>) - Chatham Hall EAP | Anthem,<b>Supplemental Nutrition Assistance Program</b> (<b>SNAP</b>). <b>Supplemental Nutrition</b> ... http://www.fns.<b>usda</b>.gov/<b>snap</b>/<b>supplemental-nutrition-assistance-program</b>-<b>snap</b>.,https://www.google.com/url?rct=j&sa=t&url=https://www.anthemeap.com/chatham-hall/plan-finances/resources/financial-assistance/resources/supplemental-nutrition-assistance-program-snap&ct=ga&cd=CAIyHDFlZTI2MTBhMjBkODFiZWQ6Y29tOmVuOlVTOlI&usg=AOvVaw2xBv_y99wnutO6Ns0RJlyf
"tag:google.com,2013:googlealerts/feed:560338199855386391",2024-06-15T04:58:15Z,2024-06-15T04:58:15Z,Honkers knock off Thunder Bay to <b>snap</b> eight-game losing streak - Post Bulletin,Honkers knock off Thunder Bay to <b>snap</b> eight-game losing streak. Cooper Marshall was great on the mound to help Rochester improve to 3-15 on the&nbsp;...,https://www.google.com/url?rct=j&sa=t&url=https://www.postbulletin.com/sports/honkers-snap-eight-game-losing-streak&ct=ga&cd=CAIyHDFlZTI2MTBhMjBkODFiZWQ6Y29tOmVuOlVTOlI&usg=AOvVaw2KUZSLdDkfljo-TY3BsZEx
"tag:google.com,2013:googlealerts/feed:7333053545287049976",2024-06-15T04:47:08Z,2024-06-15T04:47:08Z,<b>snap</b>: how to allow read/write access to a specific folder? - Ask Ubuntu,I&#39;d like to allow the snapped thunderbird RW access to the path /my/path . How can I do that? permissions &middot; <b>snap</b>.,https://www.google.com/url?rct=j&sa=t&url=https://askubuntu.com/questions/1517669/snap-how-to-allow-read-write-access-to-a-specific-folder&ct=ga&cd=CAIyHDFlZTI2MTBhMjBkODFiZWQ6Y29tOmVuOlVTOlI&usg=AOvVaw2ycCd6Q_vDPhKpjJNL-4Na
"tag:google.com,2013:googlealerts/feed:10791347586855746122",2024-06-15T04:02:24Z,2024-06-15T04:02:24Z,<b>USDA</b> Opens Application Period for Composting and Food Waste Reduction ... - Brazil Times,"The cooperative agreements, using remaining funds from the American Rescue Plan Act, are jointly administered by <b>USDA&#39;s</b> Office of Urban Agriculture&nbsp;...",https://www.google.com/url?rct=j&sa=t&url=http://www.thebraziltimes.com/story/3043807.html&ct=ga&cd=CAIyHDFlZTI2MTBhMjBkODFiZWQ6Y29tOmVuOlVTOlI&usg=AOvVaw3DzVjg6sTfD-CMsMQdTFd1
"tag:google.com,2013:googlealerts/feed:13055837628647614790",2024-06-15T03:48:13Z,2024-06-15T03:48:13Z,Biden administration tries to address generations of <b>USDA</b> racism against Black farmers and others,"Poor baby. The Post quoted Virginia farmer John Boyd Jr., who said it&#39;s hard for Black-owned farms to compete when farm subsidies overwhelmingly go to&nbsp;...",https://www.google.com/url?rct=j&sa=t&url=https://iowacapitaldispatch.com/2024/06/14/biden-administration-tries-to-address-generations-of-usda-racism-against-black-farmers-and-others/&ct=ga&cd=CAIyHDFlZTI2MTBhMjBkODFiZWQ6Y29tOmVuOlVTOlI&usg=AOvVaw1rXTerl6N1WTR9dwhY3WYu
"tag:google.com,2013:googlealerts/feed:14173018401437704136",2024-06-15T03:19:28Z,2024-06-15T03:19:28Z,American Legion: Texarkana Razorbacks aim to <b>snap</b> losing skid,"American Legion: Texarkana Razorbacks aim to <b>snap</b> losing skid. Today at 10:00 p.m.. TEXARKANA, Ark. -- The Texarkana Razorbacks will be back in&nbsp;...",https://www.google.com/url?rct=j&sa=t&url=https://www.texarkanagazette.com/news/2024/jun/14/american-legion-texarkana-razorbacks-aim-to-snap/&ct=ga&cd=CAIyHDFlZTI2MTBhMjBkODFiZWQ6Y29tOmVuOlVTOlI&usg=AOvVaw1EekfCZzBpyOqyLlQ_m5tO
"tag:google.com,2013:googlealerts/feed:2114146322505541558",2024-06-15T03:08:56Z,2024-06-15T03:08:56Z,"<b>USDA</b> to release $50M for Farm Labor Stabilization, Protection Program - The Fence Post","Agriculture Secretary Tom Vilsack will announce today in Palisade, Colo., a peach growing area, that <b>USDA</b> is awarding $50 million to 141 entities&nbsp;...",https://www.google.com/url?rct=j&sa=t&url=https://www.thefencepost.com/news/usda-to-release-50m-for-farm-labor-stabilization-protection-program/&ct=ga&cd=CAIyHDFlZTI2MTBhMjBkODFiZWQ6Y29tOmVuOlVTOlI&usg=AOvVaw013m4rEUIbEgLAwSnJH71N
"tag:google.com,2013:googlealerts/feed:8422010761153062897",2024-06-15T02:51:51Z,2024-06-15T02:51:51Z,"Lopez, Albies shine as Braves beat Orioles 6-5 and <b>snap</b> slide - San Antonio&#39;s Sports Star",... <b>snap</b> slide. 13 hours ago. Tigers rally in 7th inning to end Nationals&#39; 5-game win streak with 7-2 victory. 13 hours ago. 94.1 San Antonio&#39;s Sports&nbsp;...,https://www.google.com/url?rct=j&sa=t&url=https://www.sasportsstar.com/lopez-albies-shine-as-braves-beat-orioles-6-5-and-snap-slide/&ct=ga&cd=CAIyHDFlZTI2MTBhMjBkODFiZWQ6Y29tOmVuOlVTOlI&usg=AOvVaw17OToNzXssPl2c3_hsov2k
