id,time,accessdate,title,description,link
"tag:google.com,2013:googlealerts/feed:15748555869227923567",2024-06-10T13:34:58Z,2024-06-10T13:34:58Z,Macron Confident French People Will Make Right Choice In <b>Snap</b> Elections - NDTV,President Emmanuel Macron said Monday he was confident the French would make the &quot;right choice&quot; in <b>snap</b> elections he called after the far right&nbsp;...,https://www.google.com/url?rct=j&sa=t&url=https://www.ndtv.com/world-news/macron-confident-french-people-will-make-right-choice-in-snap-elections-5859238&ct=ga&cd=CAIyHDFlZTI2MTBhMjBkODFiZWQ6Y29tOmVuOlVTOlI&usg=AOvVaw3NN5J3bqhgG4bLkJpJgzJL
"tag:google.com,2013:googlealerts/feed:16387478404487887335",2024-06-10T13:17:14Z,2024-06-10T13:17:14Z,France&#39;s <b>Snap</b> Election Shakes Investor Confidence in Economy - Yahoo Finance,"(Bloomberg) -- French President Emmanuel Macron&#39;s bid to block Marine Le Pen&#39;s path to power by calling <b>snap</b> elections has rattled investors,&nbsp;...",https://www.google.com/url?rct=j&sa=t&url=https://finance.yahoo.com/news/macron-snap-vote-rattles-investor-112716675.html&ct=ga&cd=CAIyHDFlZTI2MTBhMjBkODFiZWQ6Y29tOmVuOlVTOlI&usg=AOvVaw2MnB_Ri_whnf6e426CJLFJ
"tag:google.com,2013:googlealerts/feed:6024204700939155181",2024-06-10T13:14:11Z,2024-06-10T13:14:11Z,Explainer-What <b>Snap</b> Election Means for France&#39;s Public Finances - USNews.com,PARIS (Reuters) - President Emmanuel Macron&#39;s surprise decision to call a <b>snap</b> parliamentary election calls into doubt France&#39;s already&nbsp;...,https://www.google.com/url?rct=j&sa=t&url=https://www.usnews.com/news/world/articles/2024-06-10/explainer-what-snap-election-means-for-frances-public-finances&ct=ga&cd=CAIyHDFlZTI2MTBhMjBkODFiZWQ6Y29tOmVuOlVTOlI&usg=AOvVaw2kV12di3qIzsU5MzZHkAyD
"tag:google.com,2013:googlealerts/feed:14302525820435430317",2024-06-10T13:06:17Z,2024-06-10T13:06:17Z,French President Emmanuel Macron&#39;s big gamble to halt the far-right surge in Europe,French President Emmanuel Macron called <b>snap</b> elections after rival Marine le Pen and other far-right parties made gains in the European&nbsp;...,https://www.google.com/url?rct=j&sa=t&url=https://www.nbcnews.com/news/world/macron-france-snap-election-far-right-victories-europe-le-pen-germany-rcna156271&ct=ga&cd=CAIyHDFlZTI2MTBhMjBkODFiZWQ6Y29tOmVuOlVTOlI&usg=AOvVaw0Gx-xtPDY9rtYwCclBbMWs
"tag:google.com,2013:googlealerts/feed:13831008866476877369",2024-06-10T12:52:25Z,2024-06-10T12:52:25Z,France&#39;s Macron gambles on <b>snap</b> election as far-right gains ground in EU Parliament vote,Center-right parties scored the most votes in an EU Parliament vote. But far-right groups saw gains and France called a <b>snap</b> parliamentary&nbsp;...,https://www.google.com/url?rct=j&sa=t&url=https://www.usatoday.com/story/news/world/2024/06/10/emmanuel-macron-france-election-after-eu-parliament-vote/74041395007/&ct=ga&cd=CAIyHDFlZTI2MTBhMjBkODFiZWQ6Y29tOmVuOlVTOlI&usg=AOvVaw3hgMT-Xo-OXBok50B2jYl-
"tag:google.com,2013:googlealerts/feed:18360285148733160795",2024-06-10T12:46:40Z,2024-06-10T12:46:40Z,France&#39;s <b>Snap</b> Parliamentary Elections: What to Know - The New York Times,President Emmanuel Macron threw French politics into disarray on Sunday when he unexpectedly called for <b>snap</b> elections. The surprise move came&nbsp;...,https://www.google.com/url?rct=j&sa=t&url=https://www.nytimes.com/2024/06/10/world/europe/france-election-macron-explained.html&ct=ga&cd=CAIyHDFlZTI2MTBhMjBkODFiZWQ6Y29tOmVuOlVTOlI&usg=AOvVaw38S9FmjxRV9Lw00_9UYSvg
"tag:google.com,2013:googlealerts/feed:15567320822886163920",2024-06-10T12:46:34Z,2024-06-10T12:46:34Z,EU election: Germany rules out <b>snap</b> election after AfD gains - DW,"German government says there are no plans for a <b>snap</b> election &middot; German voters turned out in record numbers on Sunday, with 64.8% of eligible voters&nbsp;...",https://www.google.com/url?rct=j&sa=t&url=https://www.dw.com/en/eu-election-germany-rules-out-snap-election-after-afd-gains/live-69318858&ct=ga&cd=CAIyHDFlZTI2MTBhMjBkODFiZWQ6Y29tOmVuOlVTOlI&usg=AOvVaw20q1BCu1ZQADwhTkznpe0L
"tag:google.com,2013:googlealerts/feed:15021181424349131843",2024-06-10T12:46:10Z,2024-06-10T12:46:10Z,<b>Snap</b> elections in France: a political scientist lays out what&#39;s at stake - The Conversation,"<b>Snap</b> elections in France: a political scientist lays out what&#39;s at stake. Published: June 10, 2024 7:36am EDT. Julien Robin, Université de Montréal&nbsp;...",https://www.google.com/url?rct=j&sa=t&url=https://theconversation.com/snap-elections-in-france-a-political-scientist-lays-out-whats-at-stake-232036&ct=ga&cd=CAIyHDFlZTI2MTBhMjBkODFiZWQ6Y29tOmVuOlVTOlI&usg=AOvVaw1hdM7JXwleCDMbURCMt0ed
"tag:google.com,2013:googlealerts/feed:17565244822937836089",2024-06-10T12:08:16Z,2024-06-10T12:08:16Z,Macron calls shocking <b>snap</b> election in France; AI models compete in pageant,French President Macron has dissolved parliament and called for a <b>snap</b> election. AI models are competing in the inaugural Miss AI pageant.,https://www.google.com/url?rct=j&sa=t&url=https://www.ualrpublicradio.org/npr-news/2024-06-10/macron-calls-shocking-snap-election-in-france-ai-models-compete-in-pageant&ct=ga&cd=CAIyHDFlZTI2MTBhMjBkODFiZWQ6Y29tOmVuOlVTOlI&usg=AOvVaw1c9N7eGnaBnCk-2hcmGyqZ
"tag:google.com,2013:googlealerts/feed:13626674936532917410",2024-06-10T12:00:09Z,2024-06-10T12:00:09Z,"Battered by far right, France&#39;s Macron bets big on risky <b>snap</b> election - Washington Post",... <b>snap</b> legislative elections. He seems to be betting that voters were angry at him and not truly enamored with Marine Le Pen&#39;s brand of nationalist&nbsp;...,https://www.google.com/url?rct=j&sa=t&url=https://www.washingtonpost.com/world/2024/06/10/eu-parliament-election-results-france-germany/&ct=ga&cd=CAIyHDFlZTI2MTBhMjBkODFiZWQ6Y29tOmVuOlVTOlI&usg=AOvVaw0jV_6yAM0Hg_ydUAANE1vs
"tag:google.com,2013:googlealerts/feed:1248063526662394904",2024-06-10T11:53:29Z,2024-06-10T11:53:29Z,"Macron&#39;s <b>snap</b> elections, von der Leyen&#39;s hold, far-right&#39;s dominance | Fortune Europe","Macron calls <b>snap</b> election in France, far-right gains ground and Ursula von der Leyen closes in on a second term: Here are 4 key takeaways from the EU&nbsp;...",https://www.google.com/url?rct=j&sa=t&url=https://fortune.com/europe/2024/06/10/eu-parliamentary-elections-macron-snap-election-ursula-von-der-leyen-france-far-right-future/&ct=ga&cd=CAIyHDFlZTI2MTBhMjBkODFiZWQ6Y29tOmVuOlVTOlI&usg=AOvVaw1xZFlP5XeKCRGDDbJCIpPI
"tag:google.com,2013:googlealerts/feed:2438412965559372643",2024-06-10T11:51:52Z,2024-06-10T11:51:52Z,France <b>snap</b> elections: Why Macron is gambling with France and Europe? - Euronews.com,Macron argued on Sunday evening he was pushed to dissolve the assembly and call <b>snap</b> elections because he could not &quot;pretend nothing had happened&quot;.,https://www.google.com/url?rct=j&sa=t&url=https://www.euronews.com/my-europe/2024/06/10/france-snap-elections-why-macron-is-gambling-with-france-and-europe&ct=ga&cd=CAIyHDFlZTI2MTBhMjBkODFiZWQ6Y29tOmVuOlVTOlI&usg=AOvVaw24foxgD34RKiqoZq6Numo-
"tag:google.com,2013:googlealerts/feed:8105206421402590485",2024-06-10T11:41:16Z,2024-06-10T11:41:16Z,No <b>Snap</b> Election In Germany After EU Vote: Scholz Spokesman | Barron&#39;s,"Germany will not follow France and hold a <b>snap</b> election despite the ruling coalition&#39;s dismal performance in the EU election, a spokesman for&nbsp;...",https://www.google.com/url?rct=j&sa=t&url=https://www.barrons.com/news/no-snap-election-in-germany-after-eu-vote-scholz-spokesman-5ab0add1&ct=ga&cd=CAIyHDFlZTI2MTBhMjBkODFiZWQ6Y29tOmVuOlVTOlI&usg=AOvVaw1cF87FzqTo83YbF00n2QBH
"tag:google.com,2013:googlealerts/feed:8993916076000042325",2024-06-10T11:10:51Z,2024-06-10T11:10:51Z,Macron Calls <b>Snap</b> Election After Far-Right Gains in EU Elections | Common Dreams,French President Emmanuel Macron called <b>snap</b> legislative elections on Sunday after his party suffered a major defeat in European Parliament&nbsp;...,https://www.google.com/url?rct=j&sa=t&url=https://www.commondreams.org/news/macron-snap-election&ct=ga&cd=CAIyHDFlZTI2MTBhMjBkODFiZWQ6Y29tOmVuOlVTOlI&usg=AOvVaw39ta1Pij9zO5POpOtinoWI
"tag:google.com,2013:googlealerts/feed:10023951093809336015",2024-06-10T10:38:57Z,2024-06-10T10:38:57Z,Macron gambles on <b>snap</b> French election in bid to stop Le Pen - Yahoo Finance,"... <b>snap</b> legislative ballot that re-stages his perennial battle with far-right rival, Marine Le Pen.Most Read from BloombergRussia Is Sending Young&nbsp;...",https://www.google.com/url?rct=j&sa=t&url=https://finance.yahoo.com/news/macron-high-risk-vote-attempts-002624656.html&ct=ga&cd=CAIyHDFlZTI2MTBhMjBkODFiZWQ6Y29tOmVuOlVTOlI&usg=AOvVaw2PZEMhgxb1RN5TlGmqB0gu
"tag:google.com,2013:googlealerts/feed:3979701896671540160",2024-06-10T10:17:25Z,2024-06-10T10:17:25Z,Miss Elaine Interlock Knit Short Tropical Floral <b>Snap</b>-Front Robe - Dillard&#39;s,V-neckline; Short sleeves; Two side seam pockets; <b>Snap</b>-front closure; Cotton/polyester; Machine wash cold/tumble dry low. Imported.,https://www.google.com/url?rct=j&sa=t&url=https://www.dillards.com/p/miss-elaine-interlock-knit-short-tropical-floral-snap-front-robe/518337798&ct=ga&cd=CAIyHDFlZTI2MTBhMjBkODFiZWQ6Y29tOmVuOlVTOlI&usg=AOvVaw3m-JGhYfkNSh0B3o6QuJf_
"tag:google.com,2013:googlealerts/feed:8051882872399024303",2024-06-10T10:16:58Z,2024-06-10T10:16:58Z,Don&#39;t <b>Snap</b> Tea Towel - Shop PBS,"&quot;You don&#39;t want to see me <b>snap</b>.&quot; No kidding. When a sea turtle snaps, it&#39;s no laughing matter. But this pure-cotton floursack towel in your house,&nbsp;...",https://www.google.com/url?rct=j&sa=t&url=https://shop.pbs.org/HBK412.html&ct=ga&cd=CAIyHDFlZTI2MTBhMjBkODFiZWQ6Y29tOmVuOlVTOlI&usg=AOvVaw3E8VHyebvSzBn37PkYaIj2
"tag:google.com,2013:googlealerts/feed:1518151500944071436",2024-06-10T18:14:22Z,2024-06-10T18:14:22Z,French parties hold emergency talks with possible allies for <b>snap</b> election - The Guardian,... Macron dissolves national assembly for <b>snap</b> poll after EU election results – video. The president&#39;s&nbsp;...,https://www.google.com/url?rct=j&sa=t&url=https://www.theguardian.com/world/article/2024/jun/10/france-braced-election-far-right-surge-macron&ct=ga&cd=CAIyHDFlZTI2MTBhMjBkODFiZWQ6Y29tOmVuOlVTOlI&usg=AOvVaw1kO-KfEp7aC-fgroOqdTZP
"tag:google.com,2013:googlealerts/feed:9096513849614469699",2024-06-10T18:05:17Z,2024-06-10T18:05:17Z,Sweetwater <b>SNAP</b> hosting fan donation to keep seniors cool this summer - KTXS,"The Senior Nutrition Activities Program (<b>SNAP</b>) is hosting a fan donation event to help seniors beat the heat this summer.As the temperatures rise,&nbsp;...",https://www.google.com/url?rct=j&sa=t&url=https://ktxs.com/news/local/sweetwater-snap-hosting-fan-donation-to-keep-seniors-cool-this-summer&ct=ga&cd=CAIyHDFlZTI2MTBhMjBkODFiZWQ6Y29tOmVuOlVTOlI&usg=AOvVaw3ScB7YzK88JIQNO8S7lBeN
"tag:google.com,2013:googlealerts/feed:3275454643383885761",2024-06-10T18:04:04Z,2024-06-10T18:04:04Z,Why France&#39;s president called a <b>snap</b> election - The Economist,"His unexpected decision, announced on June 9th, to dissolve the National Assembly and hold <b>snap</b> elections at a two-round vote on June 30th and&nbsp;...",https://www.google.com/url?rct=j&sa=t&url=https://www.economist.com/europe/2024/06/10/why-frances-president-called-a-snap-election&ct=ga&cd=CAIyHDFlZTI2MTBhMjBkODFiZWQ6Y29tOmVuOlVTOlI&usg=AOvVaw2JqFYpu-nQsOwV4wKoQqu1
"tag:google.com,2013:googlealerts/feed:14806399498962274252",2024-06-10T17:59:18Z,2024-06-10T17:59:18Z,USWNT REWIND: Wave <b>Snap</b> Pride Win Streak; Red Stars Set Attendance Record at Wrigley Field,"USWNT REWIND: Wave <b>Snap</b> Pride Win Streak; Red Stars Set Attendance Record at Wrigley Field. June 10, 2024.",https://www.google.com/url?rct=j&sa=t&url=https://www.ussoccer.com/stories/2024/06/uswnt-rewind-wave-snap-pride-win-streak-red-stars-set-attendance-record-at-wrigley-field&ct=ga&cd=CAIyHDFlZTI2MTBhMjBkODFiZWQ6Y29tOmVuOlVTOlI&usg=AOvVaw39EWc_8kvMJnRHzC_t3LLi
"tag:google.com,2013:googlealerts/feed:12468460546692821436",2024-06-10T17:58:05Z,2024-06-10T17:58:05Z,Macron calls <b>snap</b> elections after heavy defeat – DW – 06/09/2024,Macron calls <b>snap</b> elections after heavy defeat &middot; Similar stories from France &middot; More on Politics from Europe &middot; More on Politics from around the world.,https://www.google.com/url?rct=j&sa=t&url=https://www.dw.com/en/macron-calls-snap-elections-after-heavy-defeat/video-69317656&ct=ga&cd=CAIyHDFlZTI2MTBhMjBkODFiZWQ6Y29tOmVuOlVTOlI&usg=AOvVaw2IQoEar8zlyF5ZaRCMHN-c
"tag:google.com,2013:googlealerts/feed:16531397816894055495",2024-06-10T17:16:02Z,2024-06-10T17:16:02Z,"French parties scramble to prepare for <b>snap</b> ballot, weigh prospect of far-right rule | Reuters",... Emmanuel Macron&#39;s shock decision to call a <b>snap</b> election after a bruising loss in Sunday&#39;s vote for the European Parliament.,https://www.google.com/url?rct=j&sa=t&url=https://www.reuters.com/world/europe/france-enters-election-mode-after-far-right-win-european-parliament-vote-2024-06-10/&ct=ga&cd=CAIyHDFlZTI2MTBhMjBkODFiZWQ6Y29tOmVuOlVTOlI&usg=AOvVaw27z3x0FXcQpqr3mI0JULHU
"tag:google.com,2013:googlealerts/feed:7750258697178763856",2024-06-10T17:08:55Z,2024-06-10T17:08:55Z,UK Real Estate Law: Survivors and Casualties of <b>Snap</b> 4 July General Election,"UK Real Estate Law: Survivors and Casualties of <b>Snap</b> 4 July General Election ... On 22 May, UK Prime Minister Rishi Sunak called a surprise general&nbsp;...",https://www.google.com/url?rct=j&sa=t&url=https://www.gtlaw.com/en/insights/2024/6/uk-real-estate-law-survivors-and-casualties-of-snap-4-july-general-election&ct=ga&cd=CAIyHDFlZTI2MTBhMjBkODFiZWQ6Y29tOmVuOlVTOlI&usg=AOvVaw1Yc27gQPs8_NqmhP7YlVVJ
"tag:google.com,2013:googlealerts/feed:15098941731594826705",2024-06-10T16:13:21Z,2024-06-10T16:13:21Z,Macron calls <b>snap</b> election for France after far-right gains - NBC News,Macron shocks France with <b>snap</b> election after far-right gains in European Parliament &middot; Now Playing &middot; UP NEXT &middot; Olympic rings installed on Eiffel Tower to&nbsp;...,https://www.google.com/url?rct=j&sa=t&url=https://www.nbcnews.com/video/macron-calls-snap-election-for-france-after-far-right-gains-212627525866&ct=ga&cd=CAIyHDFlZTI2MTBhMjBkODFiZWQ6Y29tOmVuOlVTOlI&usg=AOvVaw0eoXfYtf1Rf3_Zv-O-0A2W
"tag:google.com,2013:googlealerts/feed:3533561385307484803",2024-06-10T16:08:26Z,2024-06-10T16:08:26Z,OREO Cookies - Safeway,OREO Chocolate Sandwich Cookies Family Size - 18.12 Oz. <b>SNAP</b>. 4.8Rating 4.8 out of 5 stars. Your Price $6.79 each. OREO Chocolate Sandwich Cookies&nbsp;...,https://www.google.com/url?rct=j&sa=t&url=https://www.safeway.com/aisle-vs/cookies-snacks-candy/oreo-cookies.html&ct=ga&cd=CAIyHDFlZTI2MTBhMjBkODFiZWQ6Y29tOmVuOlVTOlI&usg=AOvVaw3lYHQ14HIr-tWw1q162VUZ
"tag:google.com,2013:googlealerts/feed:4655638643649555208",2024-06-10T16:00:34Z,2024-06-10T16:00:34Z,Macron calls <b>snap</b> election after EU setback: What&#39;s at stake for France? - Al Jazeera,"According to Jacques Reland, a senior research fellow at the Global Policy Institute, Macron&#39;s decision to seek a <b>snap</b> election is a call from him to&nbsp;...",https://www.google.com/url?rct=j&sa=t&url=https://www.aljazeera.com/news/2024/6/10/macron-calls-snap-election-after-eu-setback-whats-at-stake-for-france&ct=ga&cd=CAIyHDFlZTI2MTBhMjBkODFiZWQ6Y29tOmVuOlVTOlI&usg=AOvVaw0vJVkeHvos4--HQQPBBMTG
"tag:google.com,2013:googlealerts/feed:11553040616997291732",2024-06-10T15:34:26Z,2024-06-10T15:34:26Z,Sweetwater <b>SNAP</b> taking fan donations for local seniors,"SWEETWATER, Texas (KTAB/KRBC) - The City of Sweetwater is taking donations for its <b>SNAP</b> Summer fan drive.",https://www.google.com/url?rct=j&sa=t&url=https://www.bigcountryhomepage.com/news/sweetwater/sweetwater-snap-taking-fan-donations-for-local-seniors/&ct=ga&cd=CAIyHDFlZTI2MTBhMjBkODFiZWQ6Y29tOmVuOlVTOlI&usg=AOvVaw1IZIzZ102i_-m8-1FN3qKs
"tag:google.com,2013:googlealerts/feed:7541928657747323658",2024-06-10T15:32:20Z,2024-06-10T15:32:20Z,IOC boss Thomas Bach says <b>snap</b> elections in France won&#39;t impact the Paris Olympics,The president of the International Olympic Committee says the <b>snap</b> national election called by French President Emmanuel Macron will not impact&nbsp;...,https://www.google.com/url?rct=j&sa=t&url=https://abcnews.go.com/Sports/wireStory/ioc-boss-thomas-bach-snap-elections-france-impact-110987688&ct=ga&cd=CAIyHDFlZTI2MTBhMjBkODFiZWQ6Y29tOmVuOlVTOlI&usg=AOvVaw2BmdNzL4K9zBTS3fyQWgv8
"tag:google.com,2013:googlealerts/feed:1853680318276437709",2024-06-10T15:22:02Z,2024-06-10T15:22:02Z,Matthew McConaughey posts sweet <b>snap</b> to celebrate 12th anniversary with wife Camila Alves,"Rick Kern/Getty ImagesOn Sunday, Matthew McConaughey posted a sweet <b>snap</b> on socials to thank wife Camila Alves McConaughey for 12 years of&nbsp;...",https://www.google.com/url?rct=j&sa=t&url=https://bigcheese1079.com/2024/06/10/matthew-mcconaughey-posts-sweet-snap-to-celebrate-12th-anniversary-with-wife-camila-alves/&ct=ga&cd=CAIyHDFlZTI2MTBhMjBkODFiZWQ6Y29tOmVuOlVTOlI&usg=AOvVaw3Fz3LhbZ8Y-qcG_HVQBEkJ
"tag:google.com,2013:googlealerts/feed:17162072415140775205",2024-06-10T15:14:00Z,2024-06-10T15:14:00Z,"<b>USDA</b>, University of Wisconsin-Madison Break Ground on New Dairy Research Facility",“The construction of this new facility represents a continuum of cooperative research between ARS and UW–Madison CALS that builds on achievements of&nbsp;...,https://www.google.com/url?rct=j&sa=t&url=https://www.ars.usda.gov/news-events/news/research-news/2024/usda-university-of-wisconsin-madison-break-ground-on-new-dairy-research-facility/&ct=ga&cd=CAIyHDFlZTI2MTBhMjBkODFiZWQ6Y29tOmVuOlVTOlI&usg=AOvVaw2SztQLkTT0TgLypCigUeTi
"tag:google.com,2013:googlealerts/feed:14136694368331008917",2024-06-10T15:13:48Z,2024-06-10T15:13:48Z,Why Emmanuel Macron has called <b>snap</b> elections | The Week,French President Emmanuel Macron has called <b>snap</b> parliamentary elections after a victory for Marine Le Pen&#39;s National Rally in the European&nbsp;...,https://www.google.com/url?rct=j&sa=t&url=https://theweek.com/politics/why-emmanuel-macron-has-called-snap-elections&ct=ga&cd=CAIyHDFlZTI2MTBhMjBkODFiZWQ6Y29tOmVuOlVTOlI&usg=AOvVaw1m5kgsVjP5Ve2PhZ77Z2mH
"tag:google.com,2013:googlealerts/feed:10009463643564408747",2024-06-10T13:58:13Z,2024-06-10T13:58:13Z,"Card skimmers being used against PA <b>SNAP</b> recipients, Dept of Health says - Tri-State Alert",DHS is aware of reports of stolen <b>SNAP benefits</b> in the Philadelphia and Southeastern Pennsylvania region due to card skimming devices and has referred&nbsp;...,https://www.google.com/url?rct=j&sa=t&url=https://tristatealert.com/card-skimmers-being-used-against-pa-snap-recipients-dept-of-health-says/&ct=ga&cd=CAIyHDFlZTI2MTBhMjBkODFiZWQ6Y29tOmVuOlVTOlI&usg=AOvVaw2KJ4bOHCZSZLchE-Lo1wxH
"tag:google.com,2013:googlealerts/feed:70976546056276748",2024-06-10T13:56:32Z,2024-06-10T13:56:32Z,EU elections 2024 live: Scholz says no <b>snap</b> election in Germany - The Guardian,"Germany will not follow France and hold a <b>snap</b> vote despite the ruling coalition&#39;s dismal performance in the EU election, a spokesperson says.",https://www.google.com/url?rct=j&sa=t&url=https://www.theguardian.com/world/live/2024/jun/10/eu-europe-elections-2024-live-results-news-updates-latest-france-germany-euro-european-parliamentary-election-result&ct=ga&cd=CAIyHDFlZTI2MTBhMjBkODFiZWQ6Y29tOmVuOlVTOlI&usg=AOvVaw2rvZsP-jv2MtbKE2xJc6Px
"tag:google.com,2013:googlealerts/feed:7357909510163602239",2024-06-10T13:38:11Z,2024-06-10T13:38:11Z,Macron sends shockwaves through France with <b>snap</b> decision to dissolve government,"French President Emmanuel Macron is dissolving the country&#39;s lower chamber of parliament, the National Assembly, and calling for <b>snap</b> elections.",https://www.google.com/url?rct=j&sa=t&url=https://www.courthousenews.com/macron-sends-shockwaves-through-france-with-snap-decision-to-dissolve-government/&ct=ga&cd=CAIyHDFlZTI2MTBhMjBkODFiZWQ6Y29tOmVuOlVTOlI&usg=AOvVaw0mO9YvjB6s00g3Z9-cguXE
"tag:google.com,2013:googlealerts/feed:8071804536410052089",2024-06-10T23:14:33Z,2024-06-10T23:14:33Z,Euro markets react to Macron&#39;s <b>snap</b> election. Why it matters - Yahoo Finance,"French President Emmanuel Macron has called for a <b>snap</b> election, a gamble that puts France&#39;s Parliament seats and his own presidency at risk.",https://www.google.com/url?rct=j&sa=t&url=https://finance.yahoo.com/video/euro-markets-react-macrons-snap-140117687.html&ct=ga&cd=CAIyHDFlZTI2MTBhMjBkODFiZWQ6Y29tOmVuOlVTOlI&usg=AOvVaw1w3Vjx4Nk9UnbTOL4B9SOh
"tag:google.com,2013:googlealerts/feed:10014584758983833880",2024-06-10T23:08:54Z,2024-06-10T23:08:54Z,Chip Stocks Lose Shine as Hedge Funds <b>Snap</b> Up Software Instead - Bloomberg,"Chip Stocks Lose Shine as Hedge Funds <b>Snap</b> Up Software Instead. Goldman prime brokerage data show reversal in chips, software; Semiconductor stocks&nbsp;...",https://www.google.com/url?rct=j&sa=t&url=https://www.bloomberg.com/news/articles/2024-06-10/chip-stocks-lose-shine-as-hedge-funds-snap-up-software-instead&ct=ga&cd=CAIyHDFlZTI2MTBhMjBkODFiZWQ6Y29tOmVuOlVTOlI&usg=AOvVaw1FgbDQVw8bp8gOuDzhEbmg
"tag:google.com,2013:googlealerts/feed:11020899377338833011",2024-06-10T22:56:15Z,2024-06-10T22:56:15Z,Morning Bid: Europe jolted by Macron&#39;s <b>snap</b> election call - Reuters,... <b>snap</b> parliamentary election. French bonds and stocks were sold off while the euro dropped as political uncertainty had investors heading for the&nbsp;...,https://www.google.com/url?rct=j&sa=t&url=https://www.reuters.com/markets/us/global-markets-view-usa-2024-06-10/&ct=ga&cd=CAIyHDFlZTI2MTBhMjBkODFiZWQ6Y29tOmVuOlVTOlI&usg=AOvVaw2bT5e7ENWx9IacwsWOlUvS
"tag:google.com,2013:googlealerts/feed:11760092309183086022",2024-06-10T22:55:18Z,2024-06-10T22:55:18Z,France&#39;s <b>snap</b> election: Could Europe see huge policy shifts? - Yahoo Finance,... <b>snap</b> election in an attempt to offset the rise of the far-right National Rally party throughout Europe. While European stock reactions were&nbsp;...,https://www.google.com/url?rct=j&sa=t&url=https://finance.yahoo.com/video/frances-snap-election-could-europe-211528360.html&ct=ga&cd=CAIyHDFlZTI2MTBhMjBkODFiZWQ6Y29tOmVuOlVTOlI&usg=AOvVaw1kmSM2FDP4dJ8S0JQ7VjKV
"tag:google.com,2013:googlealerts/feed:1354169759017508708",2024-06-10T22:29:53Z,2024-06-10T22:29:53Z,France&#39;s hard-right EU result pushes Macron to a <b>snap</b> election - The Economist,"... <b>snap</b> election. Elsewhere, though, the political centre held. We examine the policies that are getting America&#39;s many chronically truant students&nbsp;...",https://www.google.com/url?rct=j&sa=t&url=https://www.economist.com/podcasts/2024/06/10/frances-hard-right-eu-result-pushes-macron-to-a-snap-election&ct=ga&cd=CAIyHDFlZTI2MTBhMjBkODFiZWQ6Y29tOmVuOlVTOlI&usg=AOvVaw3Ua7ivR08Sy1lFgQjnQMcP
"tag:google.com,2013:googlealerts/feed:18047592239572350097",2024-06-10T21:51:52Z,2024-06-10T21:51:52Z,Emmanuel Macron wants a <b>snap</b> election to get him out of a deep hole - The Economist,"Will Mr Macron&#39;s bold move—to seize the initiative by calling a <b>snap</b> election at the end of this month, a full three years early—make his situation&nbsp;...",https://www.google.com/url?rct=j&sa=t&url=https://www.economist.com/leaders/2024/06/10/emmanuel-macron-wants-a-snap-election-to-get-him-out-of-a-deep-hole&ct=ga&cd=CAIyHDFlZTI2MTBhMjBkODFiZWQ6Y29tOmVuOlVTOlI&usg=AOvVaw1DWCncPYG9sstlnrinszDY
"tag:google.com,2013:googlealerts/feed:3027977599223712157",2024-06-10T21:51:51Z,2024-06-10T21:51:51Z,Watch France&#39;s Macron Calls <b>Snap</b> Election - Bloomberg,00:00Emmanuel Macron calling a <b>snap</b> election following his party&#39;s crushing defeat in Sunday&#39;s European Parliament elections.,https://www.google.com/url?rct=j&sa=t&url=https://www.bloomberg.com/news/videos/2024-06-10/france-s-macron-calls-snap-election-video&ct=ga&cd=CAIyHDFlZTI2MTBhMjBkODFiZWQ6Y29tOmVuOlVTOlI&usg=AOvVaw2mPJPjffSI7Dk3cUvaH2vt
"tag:google.com,2013:googlealerts/feed:2431608809007962911",2024-06-10T21:27:48Z,2024-06-10T21:27:48Z,<b>USDA</b> Reminds Producers to File Crop Acreage Reports,"WASHINGTON, June 10, 2024 – Agricultural producers should make an appointment with their local Farm Service Agency (FSA) office to complete crop&nbsp;...",https://www.google.com/url?rct=j&sa=t&url=https://www.fsa.usda.gov/news-room/news-releases/2024/usda-reminds-producers-to-file-crop-acreage-reports&ct=ga&cd=CAIyHDFlZTI2MTBhMjBkODFiZWQ6Y29tOmVuOlVTOlI&usg=AOvVaw3k13hEp0XxmXU-ZlUPwIJ6
"tag:google.com,2013:googlealerts/feed:14760609527767111326",2024-06-10T21:23:00Z,2024-06-10T21:23:00Z,"<b>USDA</b>, University of Wisconsin-Madison break ground on new dairy research facility",The U.S. Department of Agriculture&#39;s Agricultural Research Service and University of Wisconsin–Madison&#39;s College of Agricultural and Life Sciences&nbsp;...,https://www.google.com/url?rct=j&sa=t&url=https://www.feedstuffs.com/dairy/usda-university-of-wisconsin-madison-break-ground-on-new-dairy-research-facility&ct=ga&cd=CAIyHDFlZTI2MTBhMjBkODFiZWQ6Y29tOmVuOlVTOlI&usg=AOvVaw2spkt5_AVxsQL1cIgJ3_bm
