id,time,accessdate,title,description,link
"tag:google.com,2013:googlealerts/feed:7544359990852466524",2024-06-25T06:34:04Z,2024-06-25T06:34:04Z,"Giants rally to top Cubs 5-4, <b>snap</b> five-game skid - SRN News","Giants rally to top Cubs 5-4, <b>snap</b> five-game skid. Tue, Jun 25, 2024 0 Comments. Enlarge. SAN FRANCISCO (AP) — Wilmer Flores drew a bases loaded walk&nbsp;...",https://www.google.com/url?rct=j&sa=t&url=https://srnnews.com/giants-rally-to-top-cubs-5-4-snap-five-game-skid/&ct=ga&cd=CAIyHDFlZTI2MTBhMjBkODFiZWQ6Y29tOmVuOlVTOlI&usg=AOvVaw1ibVzjmH2DHBxCXN708Wjv
"tag:google.com,2013:googlealerts/feed:10941468390290947629",2024-06-25T05:35:33Z,2024-06-25T05:35:33Z,<b>USDA</b> Inspectors to Gradually Return to Work in Mexican Avocado Plants - Atlas News,"In fact, more work needs to be done so that APHIS [Animal and Plant Health Inspection Service] inspectors can resume inspections and thus eliminate&nbsp;...",https://www.google.com/url?rct=j&sa=t&url=https://theatlasnews.co/latest/2024/06/24/usda-inspectors-to-gradually-return-to-work-in-mexican-avocado-plants/&ct=ga&cd=CAIyHDFlZTI2MTBhMjBkODFiZWQ6Y29tOmVuOlVTOlI&usg=AOvVaw02IEyksJU0bebz_Bfzj9Cj
"tag:google.com,2013:googlealerts/feed:1119278713773767907",2024-06-25T05:28:05Z,2024-06-25T05:28:05Z,HurriCaine <b>Snap</b>-n-Go BEU 0283-0569-72 Unit-Dose Swabs Topical Anesthetic,Shop Henry Schein Dental for HurriCaine <b>Snap</b>-n-Go BEU 0283-0569-72 Unit-Dose Swabs Topical Anesthetic. Browse our full selection of products and&nbsp;...,https://www.google.com/url?rct=j&sa=t&url=https://www.henryschein.com/redirect.aspx%3Fdid%3Dspecialmarkets_m%26returnurl%3D/us-en/Shopping/ProductDetails.aspx%253Fproductid%253D9160000%2526CatalogName%253DPRIME%2526utm_source%253DSpecialMarkets%2526utm_medium%253DNxtbook%2526utm_campaign%253Dsm-supplies20232024%2526utm_term%253D9160000&ct=ga&cd=CAIyHDFlZTI2MTBhMjBkODFiZWQ6Y29tOmVuOlVTOlI&usg=AOvVaw1qUYz1btkD6KgKQxMbflmO
"tag:google.com,2013:googlealerts/feed:3506546487478359079",2024-06-25T05:22:37Z,2024-06-25T05:22:37Z,Door Lock Control Link <b>Snap</b> #69759-20100 | Autoparts.toyota.com,"Secure your car with the Toyota Autoparts Door Lock Control Link <b>Snap</b>. Essential for safety and efficiency, it ensures proper door and hood&nbsp;...",https://www.google.com/url?rct=j&sa=t&url=https://autoparts.i-5toyota.com/products/product/snap-door-lock-cont-6975920100&ct=ga&cd=CAIyHDFlZTI2MTBhMjBkODFiZWQ6Y29tOmVuOlVTOlI&usg=AOvVaw1Xdn9qNbEhckyIYaWM4AD8
"tag:google.com,2013:googlealerts/feed:15986037748098546929",2024-06-25T05:00:49Z,2024-06-25T05:00:49Z,<b>USDA</b> Hosting Beginner Farmer and Rancher Webinar - by Floyd Rovano - Ark Valley Voice,The U.S. Department of Agriculture (<b>USDA</b>) will be holding a series of webinars for beginner farmers and ranchers. The webinars will be held over&nbsp;...,https://www.google.com/url?rct=j&sa=t&url=https://arkvalleyvoice.com/usda-hosting-beginner-farmer-and-rancher-webinar/&ct=ga&cd=CAIyHDFlZTI2MTBhMjBkODFiZWQ6Y29tOmVuOlVTOlI&usg=AOvVaw0sOyjTXUIXR4XimOGd8gjM
"tag:google.com,2013:googlealerts/feed:14845608093299941262",2024-06-25T03:31:56Z,2024-06-25T03:31:56Z,"Tomcat® Rat <b>Snap</b> Mechanical Rat Trap (1-Pack) 0361710, 1 ct - Gerbes Super Markets","Tomcat® <b>snap</b> rat trap with a powerful, aggressive design that is effective and easy to use. Easy to set by hand or foot. Removable bait cup allows&nbsp;...",https://www.google.com/url?rct=j&sa=t&url=https://www.gerbes.com/p/tomcat-rat-snap-mechanical-rat-trap-1-pack-0361710/0088860303617&ct=ga&cd=CAIyHDFlZTI2MTBhMjBkODFiZWQ6Y29tOmVuOlVTOlI&usg=AOvVaw0TjAh4n250eEnTcsI0YAmD
"tag:google.com,2013:googlealerts/feed:6785621266733140303",2024-06-25T03:16:43Z,2024-06-25T03:16:43Z,<b>Snap</b>-on launches ADAS for Experts website - Tire Business,<b>Snap</b>-on has launched an e-commerce portal for Tru-Point equipment owners.,https://www.google.com/url?rct=j&sa=t&url=https://www.tirebusiness.com/smart-shop/snap-launches-adas-experts-website&ct=ga&cd=CAIyHDFlZTI2MTBhMjBkODFiZWQ6Y29tOmVuOlVTOlI&usg=AOvVaw0vlIG1laFoT66v_eUWHFIl
"tag:google.com,2013:googlealerts/feed:8922627670342189317",2024-06-25T03:02:07Z,2024-06-25T03:02:07Z,<b>Snap</b>-on Launches New &#39;ADAS for Experts&#39; Site - aftermarketNews,"Tru-Point customers can access Tru-Point subscription plans and targets, as well as access the vehicle coverage guide. ... <b>Snap</b>-on Total Shop Solutions&nbsp;...",https://www.google.com/url?rct=j&sa=t&url=https://www.aftermarketnews.com/snap-on-new-site/&ct=ga&cd=CAIyHDFlZTI2MTBhMjBkODFiZWQ6Y29tOmVuOlVTOlI&usg=AOvVaw1Vij-0bpPEcPdeePWlUG8E
"tag:google.com,2013:googlealerts/feed:13106457251405653911",2024-06-25T02:53:35Z,2024-06-25T02:53:35Z,Swivel Eye Baby Spring <b>Snap</b> - Richelieu Hardware,"Find the largest offer in Snaps like Swivel Eye Baby Spring <b>Snap</b> at Richelieu.com, the one stop shop for woodworking industry.",https://www.google.com/url?rct=j&sa=t&url=https://www.richelieu.com/us/en/category/builders-hardware/ropes-cables-and-chains/rope-cable-and-chain-hardware/snaps/swivel-eye-baby-spring-snap/1224775/sku-485501&ct=ga&cd=CAIyHDFlZTI2MTBhMjBkODFiZWQ6Y29tOmVuOlVTOlI&usg=AOvVaw38hI94vO8mDY2KiGfGjQRo
"tag:google.com,2013:googlealerts/feed:17256534058503494111",2024-06-25T02:43:17Z,2024-06-25T02:43:17Z,"Speaker <b>Snap</b> SSPC4-50 PHX 4-Pin Connectors, 50-Pack - ADI","4-Pin Speaker <b>snap</b> PHX connectors. Other audio connectors are a hassle and time-consuming. Speaker <b>Snap</b> is the solution, using patented technology&nbsp;...",https://www.google.com/url?rct=j&sa=t&url=https://www.adiglobaldistribution.us/Catalog/shop-brands/speaker-snap/S2-SSPC450&ct=ga&cd=CAIyHDFlZTI2MTBhMjBkODFiZWQ6Y29tOmVuOlVTOlI&usg=AOvVaw2wgu4d1KwpIFlyFwj3HQ1p
"tag:google.com,2013:googlealerts/feed:18011446884461738195",2024-06-25T02:36:10Z,2024-06-25T02:36:10Z,The <b>USDA</b> Farm Service Agency and Natural Resource Conservation ... - Elkhorn Media Group,You can find the Farm Service Agency relocated at the Forest Service at 265 HWY 20 S in Hines and you can find Natural Resource Conservation Service&nbsp;...,https://www.google.com/url?rct=j&sa=t&url=https://elkhornmediagroup.com/the-usda-farm-service-agency-and-natural-resource-conservation-service-and-the-harney-county-soil-and-water-conservation-district-have-temporarily-moved/&ct=ga&cd=CAIyHDFlZTI2MTBhMjBkODFiZWQ6Y29tOmVuOlVTOlI&usg=AOvVaw1MmlUmkwda-06z2u9gssd4
"tag:google.com,2013:googlealerts/feed:12253050678460809238",2024-06-25T02:33:30Z,2024-06-25T02:33:30Z,Pay with <b>SNAP</b> EBT - H-E-B,Track totals as you shop. See running subtotals for <b>SNAP</b> eligible items and remaining items in your cart. Split payment at checkout,https://www.google.com/url?rct=j&sa=t&url=https://www.heb.com/static-page/online-snap-ebt&ct=ga&cd=CAIyHDFlZTI2MTBhMjBkODFiZWQ6Y29tOmVuOlVTOlI&usg=AOvVaw1UsezqGD0uWi-hbDE1QNge
"tag:google.com,2013:googlealerts/feed:13029503057680064709",2024-06-25T18:09:53Z,2024-06-25T18:09:53Z,Don&#39;t expect recent floods to be reflected in <b>USDA</b> acreage report - WCMY,Tanner Ehmke says the farmer planting surveys were collected before the Upper Midwest was hammered by torrential rains over the weekend. “I think <b>USDA</b>&nbsp;...,https://www.google.com/url?rct=j&sa=t&url=https://1430wcmy.com/2024/06/25/dont-expect-recent-floods-to-be-reflected-in-usda-acreage-report/&ct=ga&cd=CAIyHDFlZTI2MTBhMjBkODFiZWQ6Y29tOmVuOlVTOlI&usg=AOvVaw2x3jBYbWJUJdHOtqHaY2f8
"tag:google.com,2013:googlealerts/feed:4543513272597756655",2024-06-25T17:52:04Z,2024-06-25T17:52:04Z,"Case Against Forest Service Burn Boss Dropped, <b>USDA</b> Hails Decision - FEDmanager",The U.S. Department of Agriculture (<b>USDA</b>) applauded a recent decision to drop the criminal charge against a U.S. Forest Service employee for&nbsp;...,https://www.google.com/url?rct=j&sa=t&url=https://fedmanager.com/news/case-against-forest-service-burn-boss-dropped-usda-hails-decision&ct=ga&cd=CAIyHDFlZTI2MTBhMjBkODFiZWQ6Y29tOmVuOlVTOlI&usg=AOvVaw1HaINBeXhmz_mmK-Ja_h9R
"tag:google.com,2013:googlealerts/feed:13941403726712830714",2024-06-25T17:21:07Z,2024-06-25T17:21:07Z,So...I Think I BROKE The META!? 75% Winrate?! | A High Infinite Guide To Mobius Counter Decks!,... <b>snap</b>.untapped.gg/en/decks/Alioth-Annihilus-Hood-JeffTheBabyLandShark ... | <b>SNAP</b> HOT TAKES | <b>SNAP</b> Bayless. KM Best: In A <b>Snap</b> New 8.5K views &middot; 46:15.,https://www.google.com/url?rct=j&sa=t&url=https://www.youtube.com/watch%3Fv%3DOD7dVgZcSU8&ct=ga&cd=CAIyHDFlZTI2MTBhMjBkODFiZWQ6Y29tOmVuOlVTOlI&usg=AOvVaw2eU_cmw7lUy3o6G3wJrcvw
"tag:google.com,2013:googlealerts/feed:15530193382854241632",2024-06-25T16:36:47Z,2024-06-25T16:36:47Z,<b>USDA</b> Focuses on Healthy Foods in Underserved Communities - Conduit Street,"Through the HFFI FARE Fund, <b>USDA</b> and the Reinvestment Fund are making available $60 million in loans, grants and technical assistance for food retail&nbsp;...",https://www.google.com/url?rct=j&sa=t&url=https://conduitstreet.mdcounties.org/2024/06/25/usda-focuses-on-healthy-foods-in-underserved-communities/&ct=ga&cd=CAIyHDFlZTI2MTBhMjBkODFiZWQ6Y29tOmVuOlVTOlI&usg=AOvVaw0AC7aMaesJChIOzmxvWoj_
"tag:google.com,2013:googlealerts/feed:15801496293687233372",2024-06-25T16:34:20Z,2024-06-25T16:34:20Z,<b>SNAP</b> Recipients See Major Change to Food Options - Newsweek,Being able to access <b>SNAP benefits</b> from your phone helps <b>SNAP</b> enable more low-income families to access nutritious meals. It can also sometimes be the&nbsp;...,https://www.google.com/url?rct=j&sa=t&url=https://www.newsweek.com/snap-recipients-see-major-change-food-options-1917074&ct=ga&cd=CAIyHDFlZTI2MTBhMjBkODFiZWQ6Y29tOmVuOlVTOlI&usg=AOvVaw2xyKISv6skcHUWg2kFKYVl
"tag:google.com,2013:googlealerts/feed:15166175320216369383",2024-06-25T16:20:44Z,2024-06-25T16:20:44Z,<b>USDA</b> Launches New Program to Increase Access to Healthy Foods,"Health foods. iStock. At the National Rural Grocer&#39;s Summit, U.S. Agriculture Secretary Tom Vilsack announced that <b>USDA</b> and Reinvestment Fund are&nbsp;...",https://www.google.com/url?rct=j&sa=t&url=https://www.foodmanufacturing.com/consumer-trends/news/22913546/usda-launches-new-program-to-increase-access-to-healthy-foods&ct=ga&cd=CAIyHDFlZTI2MTBhMjBkODFiZWQ6Y29tOmVuOlVTOlI&usg=AOvVaw1NKQj534y4UldrFfHNbZs5
"tag:google.com,2013:googlealerts/feed:3556328300192286309",2024-06-25T16:16:53Z,2024-06-25T16:16:53Z,90 people charged over alleged <b>SNAP benefits</b> fraud in Pennsylvania - CBS News,Pennsylvania officials announced Tuesday that they charged 90 people with fraud related to <b>SNAP benefits</b> cases in April and May of 2024.,https://www.google.com/url?rct=j&sa=t&url=https://www.cbsnews.com/philadelphia/video/90-people-charged-over-alleged-snap-benefits-fraud-in-pennsylvania/&ct=ga&cd=CAIyHDFlZTI2MTBhMjBkODFiZWQ6Y29tOmVuOlVTOlI&usg=AOvVaw3At0jOor5Oi-dYFx0PEYMj
"tag:google.com,2013:googlealerts/feed:1088120915008131992",2024-06-25T16:16:19Z,2024-06-25T16:16:19Z,<b>SNAP</b> payment update the last week of June - You must meet these requirements to receive $973,"The Supplemental Nutrition Support Program (<b>SNAP</b>) in Florida, sometimes known as <b>food stamps</b>, provides financial support to low-income individuals&nbsp;...",https://www.google.com/url?rct=j&sa=t&url=https://lagradaonline.com/en/973-snap-payment-update-last-week-of-june/&ct=ga&cd=CAIyHDFlZTI2MTBhMjBkODFiZWQ6Y29tOmVuOlVTOlI&usg=AOvVaw34gNKvJhhCAThuR9XpQKFj
"tag:google.com,2013:googlealerts/feed:17986861751694794020",2024-06-25T15:43:03Z,2024-06-25T15:43:03Z,End of June 2024 Patch Datamine - <b>Snap</b>.fan : r/MarvelSnap - Reddit,"19 votes, 35 comments. 190K subscribers in the MarvelSnap community. Welcome to the Superpowered Subreddit for all things MARVEL <b>SNAP</b>.",https://www.google.com/url?rct=j&sa=t&url=https://www.reddit.com/r/MarvelSnap/comments/1do86o5/end_of_june_2024_patch_datamine_snapfan/&ct=ga&cd=CAIyHDFlZTI2MTBhMjBkODFiZWQ6Y29tOmVuOlVTOlI&usg=AOvVaw2RLXTWnKD5vTqAtzK7FZdo
"tag:google.com,2013:googlealerts/feed:12681323514759896090",2024-06-25T15:30:35Z,2024-06-25T15:30:35Z,<b>Snap</b>-on (NYSE:SNA) shareholders have earned a 13% CAGR over the last five years,"Over half a decade, <b>Snap</b>-on managed to grow its earnings per share at 9.4% a year. This EPS growth is reasonably close to the 10% average annual&nbsp;...",https://www.google.com/url?rct=j&sa=t&url=https://finance.yahoo.com/news/snap-nyse-sna-shareholders-earned-150901358.html&ct=ga&cd=CAIyHDFlZTI2MTBhMjBkODFiZWQ6Y29tOmVuOlVTOlI&usg=AOvVaw1DjDEp2sc3ZIM3QpiPGAQq
"tag:google.com,2013:googlealerts/feed:5410293464428636524",2024-06-25T15:10:24Z,2024-06-25T15:10:24Z,Romania <b>snap</b> two-match losing streak with clear win over Egypt - IHF,"Romania <b>snap</b> two-match losing streak with clear win over Egypt ... After two consecutive losses, Romania bounced back with a big win against Egypt, 32:&nbsp;...",https://www.google.com/url?rct=j&sa=t&url=https://www.ihf.info/media-center/news/romania-snap-two-match-losing-streak-clear-win-over-egypt&ct=ga&cd=CAIyHDFlZTI2MTBhMjBkODFiZWQ6Y29tOmVuOlVTOlI&usg=AOvVaw1Tdp57XwjXUvPxZtD78nBK
"tag:google.com,2013:googlealerts/feed:5290788336293135864",2024-06-25T15:08:56Z,2024-06-25T15:08:56Z,Bakery | Specials – Manteno – <b>Usda</b> Choice Bone-in Rib Roast - Berkot&#39;s Super Foods,Berkot&#39;s Experience the Difference- Fresh. Friendly. Focused on You.,https://www.google.com/url?rct=j&sa=t&url=https://shop.berkotfoods.com/online/manteno/specials/bakery%3Fpid%3Df4f83f90-f398-483d-bfa6-af410066b04b%26productName%3Dusda-choice-bone-in-rib-roast&ct=ga&cd=CAIyHDFlZTI2MTBhMjBkODFiZWQ6Y29tOmVuOlVTOlI&usg=AOvVaw0tRTO4SLp8NOIjlRE3VGht
"tag:google.com,2013:googlealerts/feed:10426591986315059352",2024-06-25T13:43:32Z,2024-06-25T13:43:32Z,Madison Mallards <b>Snap</b> Skid with Extra-Inning Victory over Kokomo Jackrabbits,"Madison Mallards <b>Snap</b> Skid with Extra-Inning Victory over Kokomo Jackrabbits &middot; Kokomo, IN – The Madison Mallards got back in the win column on Monday&nbsp;...",https://www.google.com/url?rct=j&sa=t&url=https://northwoodsleague.com/madison-mallards/2024/06/25/madison-mallards-snap-skid-with-extra-inning-victory-over-kokomo-jackrabbits/&ct=ga&cd=CAIyHDFlZTI2MTBhMjBkODFiZWQ6Y29tOmVuOlVTOlI&usg=AOvVaw2QdKfND3tbugyeu5FVD-Dx
"tag:google.com,2013:googlealerts/feed:15986637302697050161",2024-06-25T13:40:49Z,2024-06-25T13:40:49Z,I need help with something please help - <b>Snap</b>! Editor - <b>Snap</b>! Forum,"I need help with something please help &middot; Help with <b>Snap</b>! <b>Snap</b>! Editor &middot; awdeni June 25, 2024, 12:04pm 1. Now… I was wondering how I would get the&nbsp;...",https://www.google.com/url?rct=j&sa=t&url=https://forum.snap.berkeley.edu/t/i-need-help-with-something-please-help/17086&ct=ga&cd=CAIyHDFlZTI2MTBhMjBkODFiZWQ6Y29tOmVuOlVTOlI&usg=AOvVaw3hCbbC1uKLpqF67qc6nkV4
"tag:google.com,2013:googlealerts/feed:4746759764872063855",2024-06-25T13:37:26Z,2024-06-25T13:37:26Z,"France deepens military ties with Germany, Poland ahead of risky <b>snap</b> election – POLITICO","PARIS — France, Germany and Poland agreed on Monday to deepen defense cooperation ahead of a <b>snap</b> election that could see the far-right National&nbsp;...",https://www.google.com/url?rct=j&sa=t&url=https://www.politico.eu/article/france-germany-poland-emmanuel-macron-military-ties-risky-snap-election/&ct=ga&cd=CAIyHDFlZTI2MTBhMjBkODFiZWQ6Y29tOmVuOlVTOlI&usg=AOvVaw0waOnMJcC3dtgUBJdqOYgJ
"tag:google.com,2013:googlealerts/feed:2680541378140067281",2024-06-25T13:31:29Z,2024-06-25T13:31:29Z,<b>USDA</b>: Expect more cases of bird flu in dairy cattle - Successful Farming,The <b>USDA</b> is encouraging farmers to enroll in a voluntary program for weekly tests of milk samples taken from bulk coolers on dairy farms.,https://www.google.com/url?rct=j&sa=t&url=https://www.agriculture.com/usda-expect-more-cases-of-bird-flu-in-dairy-cattle-8668726&ct=ga&cd=CAIyHDFlZTI2MTBhMjBkODFiZWQ6Y29tOmVuOlVTOlI&usg=AOvVaw0IrypgNe_wiCHxEInC3X-g
"tag:google.com,2013:googlealerts/feed:2403410885983816307",2024-06-25T13:29:47Z,2024-06-25T13:29:47Z,<b>Snap</b> Finance&#39;s New Digital Spot Named a Top Business-to-Consumer and Promotional ...,<b>Snap</b> Finance&#39;s New Digital Spot Named a Top Business-to-Consumer and Promotional Online Commercial in 45th Annual Telly Awards.,https://www.google.com/url?rct=j&sa=t&url=https://www.morningstar.com/news/business-wire/20240625741511/snap-finances-new-digital-spot-named-a-top-business-to-consumer-and-promotional-online-commercial-in-45th-annual-telly-awards&ct=ga&cd=CAIyHDFlZTI2MTBhMjBkODFiZWQ6Y29tOmVuOlVTOlI&usg=AOvVaw0EUh0LRdKassdYcqFpujLL
"tag:google.com,2013:googlealerts/feed:11885721790226138834",2024-06-25T13:29:19Z,2024-06-25T13:29:19Z,"NEXUS Morning Connect - <b>USDA</b>, Rural Development Guaranteed Housing Financing Options",NEXUS Morning Connect is a quick jot of industry tips and insights. This series is an impactful way to expand your knowledge in topics related to&nbsp;...,https://www.google.com/url?rct=j&sa=t&url=https://nexusaor.com/member-center-top-members-menu/calendar-top-members-menu/186-events-calendar-category/1803-nexus-morning-connect-bank-programs-assisting-homebuyers-2.html&ct=ga&cd=CAIyHDFlZTI2MTBhMjBkODFiZWQ6Y29tOmVuOlVTOlI&usg=AOvVaw3c3KusbmNbyw23tAc_d-r_
"tag:google.com,2013:googlealerts/feed:12445715942970591007",2024-06-25T13:20:07Z,2024-06-25T13:20:07Z,DoorDash Teams With Forage to Expand <b>SNAP</b>/EBT Acceptance - PYMNTS.com,"With the help of payments processor Forage, the company can now accelerate the <b>USDA</b> ... <b>Snap</b>, <b>SNAP</b> EBT, <b>Supplemental Nutrition Assistance Program</b>,&nbsp;...",https://www.google.com/url?rct=j&sa=t&url=https://www.pymnts.com/partnerships/2024/doordash-teams-with-forage-to-expand-snap-ebt-acceptance/&ct=ga&cd=CAIyHDFlZTI2MTBhMjBkODFiZWQ6Y29tOmVuOlVTOlI&usg=AOvVaw2XySBA4HF2IPTxZ1LYVr2O
"tag:google.com,2013:googlealerts/feed:184307128579144106",2024-06-25T13:07:59Z,2024-06-25T13:07:59Z,Best Phastos Decks to Try on Day 1 and Strategy Guide - Marvel <b>Snap</b> Zone,Phastos enters the Marvel <b>Snap</b> arena! Read about the new Series 5 card&#39;s strengths and weaknesses and find some decks to try it out in here!,https://www.google.com/url?rct=j&sa=t&url=https://marvelsnapzone.com/phastos-theorycraft/&ct=ga&cd=CAIyHDFlZTI2MTBhMjBkODFiZWQ6Y29tOmVuOlVTOlI&usg=AOvVaw3-6UuzMOq5_p-HtBAjWQNo
"tag:google.com,2013:googlealerts/feed:10965472146255550626",2024-06-25T22:46:01Z,2024-06-25T22:46:01Z,Miss Selfridge sleeveless <b>snap</b> top in charcoal - ASOS,Browse online for the newest Miss Selfridge sleeveless <b>snap</b> top in charcoal styles. Shop easier with ASOS&#39; multiple payments and return options&nbsp;...,https://www.google.com/url?rct=j&sa=t&url=https://www.asos.com/us/miss-selfridge/miss-selfridge-sleeveless-snap-top-in-charcoal/prd/206002008&ct=ga&cd=CAIyHDFlZTI2MTBhMjBkODFiZWQ6Y29tOmVuOlVTOlI&usg=AOvVaw3QQzNpOnXd6hRghqhjPYm_
"tag:google.com,2013:googlealerts/feed:13696870890225377412",2024-06-25T22:34:05Z,2024-06-25T22:34:05Z,<b>USDA</b> Offering $12M in Grants for Dairy Industry Innovation - Powder &amp; Bulk Solids,"The US Department of Agriculture (<b>USDA</b>) just announced $12 million in grant funding to support processing capacity expansion, on-farm improvements&nbsp;...",https://www.google.com/url?rct=j&sa=t&url=https://www.powderbulksolids.com/food-beverage/usda-offering-12m-in-grants-to-dairy-industry-for-innovation&ct=ga&cd=CAIyHDFlZTI2MTBhMjBkODFiZWQ6Y29tOmVuOlVTOlI&usg=AOvVaw27Kkd23Uq4cZKbWrlCdDjt
"tag:google.com,2013:googlealerts/feed:8515775017645531040",2024-06-25T21:50:16Z,2024-06-25T21:50:16Z,<b>USDA</b> announces $60 million program to combat food deserts - WDTV,"Over the next 5 years,&nbsp;...",https://www.google.com/url?rct=j&sa=t&url=https://www.wdtv.com/2024/06/25/usda-announces-60-million-program-combat-food-deserts/&ct=ga&cd=CAIyHDFlZTI2MTBhMjBkODFiZWQ6Y29tOmVuOlVTOlI&usg=AOvVaw373NmQPmlHSdgjwU-Aeqkh
"tag:google.com,2013:googlealerts/feed:3236321801293210611",2024-06-25T21:39:30Z,2024-06-25T21:39:30Z,First RNA-particle vaccination for canine influenza receives <b>USDA</b> approval - DVM360,NOBIVAC NXT Canine Flu H3N2 will help safeguard dogs against the highly contagious respiratory disease.,https://www.google.com/url?rct=j&sa=t&url=https://www.dvm360.com/view/first-rna-particle-vaccination-for-canine-influenza-receives-usda-approval&ct=ga&cd=CAIyHDFlZTI2MTBhMjBkODFiZWQ6Y29tOmVuOlVTOlI&usg=AOvVaw2EUVGUYGhlNlAr4Z718VNn
"tag:google.com,2013:googlealerts/feed:12195717613688806957",2024-06-25T21:33:17Z,2024-06-25T21:33:17Z,<b>Snap</b>-on Tools added a new photo. - Facebook,I&#39;ve got ( 1 )-1/2 drive and ( 2 ) 3/8 drive and ( 1 ) 1/4 drive <b>Snap</b> On indexing head solid handled ratchets and once Austin Kiley gives me the&nbsp;...,https://www.google.com/url?rct=j&sa=t&url=https://www.facebook.com/photo.php%3Ffbid%3D10158275315783288%26id%3D12098993287%26set%3Da.190989578287&ct=ga&cd=CAIyHDFlZTI2MTBhMjBkODFiZWQ6Y29tOmVuOlVTOlI&usg=AOvVaw2sC67C0CUzbrDOVJO_g3zL
"tag:google.com,2013:googlealerts/feed:4990812808187767472",2024-06-25T21:22:46Z,2024-06-25T21:22:46Z,How a Russell neighborhood deli deals with inflation&#39;s impact on <b>SNAP benefits</b>,"For some, the money&nbsp;...",https://www.google.com/url?rct=j&sa=t&url=https://www.wave3.com/2024/06/25/how-russell-neighborhood-deli-deals-with-inflations-impact-snap-benefits/&ct=ga&cd=CAIyHDFlZTI2MTBhMjBkODFiZWQ6Y29tOmVuOlVTOlI&usg=AOvVaw3Sy2m_7VlwpRJ84XP-UWhV
"tag:google.com,2013:googlealerts/feed:120098639847229188",2024-06-25T21:11:26Z,2024-06-25T21:11:26Z,<b>USDA</b> Fare fund - WDTV,<b>USDA</b> Fare fund.&nbsp;...,https://www.google.com/url?rct=j&sa=t&url=https://www.wdtv.com/video/2024/06/25/usda-fare-fund/&ct=ga&cd=CAIyHDFlZTI2MTBhMjBkODFiZWQ6Y29tOmVuOlVTOlI&usg=AOvVaw09lQi254INAe9S8H4nqzMJ
"tag:google.com,2013:googlealerts/feed:17164596715657207462",2024-06-25T20:50:59Z,2024-06-25T20:50:59Z,<b>USDA</b> proposes new rule to clarify unfair practices in agriculture industries,The U.S. Department of Agriculture announced a proposed rule Tuesday designed to better define the meaning of &quot;unfair&quot; as used in the Packers and&nbsp;...,https://www.google.com/url?rct=j&sa=t&url=https://www.arkansasonline.com/news/2024/jun/25/usda-proposes-new-rule-to-clarify-unfair/&ct=ga&cd=CAIyHDFlZTI2MTBhMjBkODFiZWQ6Y29tOmVuOlVTOlI&usg=AOvVaw0uSU-rFv-4JNUl-WeiiZ9P
"tag:google.com,2013:googlealerts/feed:15347799326529627156",2024-06-25T20:45:33Z,2024-06-25T20:45:33Z,EVOLVE YOUR DECK With High Evo Phastos! | Marvel <b>SNAP</b> - YouTube,"Let&#39;s Play Marvel <b>SNAP</b>! Here we spotlight a High Evo Phastos Deck! Xtra Stuff, Balatro, and VODs - https://www.youtube.com/@BynxXtra&nbsp;...",https://www.google.com/url?rct=j&sa=t&url=https://www.youtube.com/watch%3Fv%3DcsTa_BDIPAE&ct=ga&cd=CAIyHDFlZTI2MTBhMjBkODFiZWQ6Y29tOmVuOlVTOlI&usg=AOvVaw1W87nAEzo6jrtVB6FCa-S1
"tag:google.com,2013:googlealerts/feed:3745893218165074631",2024-06-25T20:42:43Z,2024-06-25T20:42:43Z,GIGA <b>SNAP</b> HOOK 110MM LIGHT ALLOW POLISHED CONNECTOR | Singing Rock USA,The Giga Double Locking <b>Snap</b> hook is a big light alloy connector intended as a rope terminal which forms a flexible anchoring line.,https://www.google.com/url?rct=j&sa=t&url=https://singingrock-usa.com/activities/497843-giga-snap-hook-110mm-light-allow-polished-connector.html&ct=ga&cd=CAIyHDFlZTI2MTBhMjBkODFiZWQ6Y29tOmVuOlVTOlI&usg=AOvVaw0oJWM_V82MOpgiGfkT48o-
"tag:google.com,2013:googlealerts/feed:15662446556261667896",2024-06-25T20:41:09Z,2024-06-25T20:41:09Z,"Stock Market Today: S&amp;P 500, Nasdaq <b>Snap</b> Losing Streaks - Kiplinger","Indeed, a bounce in tech stocks helped the S&amp;P 500 and Nasdaq Composite <b>snap</b> their three-day losing streaks. Heading into Tuesday&#39;s trading, Nvidia (&nbsp;...",https://www.google.com/url?rct=j&sa=t&url=https://www.kiplinger.com/investing/stocks/stock-market-today-sandp-500-nasdaq-snap-losing-streaks&ct=ga&cd=CAIyHDFlZTI2MTBhMjBkODFiZWQ6Y29tOmVuOlVTOlI&usg=AOvVaw1UF9SD4bWOialpoeb4Hk6f
"tag:google.com,2013:googlealerts/feed:1596538875185834389",2024-06-25T20:25:45Z,2024-06-25T20:25:45Z,<b>USDA</b> Approves NOBIVAC® NXT Canine Flu H3N2 Vaccine - Merck Animal Health,"RAHWAY, N.J., June 25, 2024 – Merck Animal Health, known as MSD Animal Health outside of the United States and Canada, a division of Merck &amp; Co.,&nbsp;...",https://www.google.com/url?rct=j&sa=t&url=https://www.merck-animal-health.com/blog/2024/06/25/usda-approval-nobivac-nxt-civ/&ct=ga&cd=CAIyHDFlZTI2MTBhMjBkODFiZWQ6Y29tOmVuOlVTOlI&usg=AOvVaw1Muts78per2xhIB-0_q8C0
"tag:google.com,2013:googlealerts/feed:18371183225123533907",2024-06-25T20:08:58Z,2024-06-25T20:08:58Z,<b>USDA</b> Approves Merck Animal Health&#39;s NOBIVAC® NXT Canine Flu H3N2,"Innovative technology represents a breakthrough scientific achievement for highly contagious respiratory disease. RAHWAY, N.J., June 25,&nbsp;...",https://www.google.com/url?rct=j&sa=t&url=https://www.merck.com/news/usda-approves-merck-animal-healths-nobivac-nxt-canine-flu-h3n2-the-first-and-only-rna-particle-technology-vaccine-for-canine-influenza/&ct=ga&cd=CAIyHDFlZTI2MTBhMjBkODFiZWQ6Y29tOmVuOlVTOlI&usg=AOvVaw0HLRNfW3EUraYbUCTwZbjC
"tag:google.com,2013:googlealerts/feed:15675701946266425579",2024-06-25T20:07:03Z,2024-06-25T20:07:03Z,Proposed Redux on <b>USDA</b> Packer Rule - Great American Crop Insurance,"OMAHA (DTN) -- Continuing to push on livestock competition issues, <b>USDA</b> on Tuesday proposed a new Packers and Stockyards Act rule targeting how&nbsp;...",https://www.google.com/url?rct=j&sa=t&url=https://www.greatamericancrop.com/news-resources/article/2024/06/25/proposed-redux-on-usda-packer-rule&ct=ga&cd=CAIyHDFlZTI2MTBhMjBkODFiZWQ6Y29tOmVuOlVTOlI&usg=AOvVaw2hYPhEjTi1Adrj0N_4iWO9
